tweet_id,tweet_text,img_url,lgbtterm1,lgbtcat1,lgbtterm2,lgbtcat2,lgbtterm3,lgbtcat3,raceterm1,racecat1,raceterm2,racecat2,raceterm3,racecat3
1352636870639955969g,Yes @POTUS don’t deport criminals. Fill low paying jobs and raise taxes https://t.co/X1Ac6nMf0z,http://pbs.twimg.com/media/EsWIEJ5W4AQnkL0.jpg,NA,NA,NA,NA,NA,NA,deport,immigrant,NA,NA,NA,NA
1352637098176638976g,"The Turks &amp; Caicos is open for all visitors! To assist us in keeping the Turks and Caicos Islands safe, please read more information on travel entry requirements and the TCI Assured Pre-Travel Authorization Program at https://t.co/liwK0mhuAE https://t.co/6hopWT6yij",http://pbs.twimg.com/media/EsWIQ-NXUAMFthf.jpg,NA,NA,NA,NA,NA,NA,turks,middle eastern,NA,NA,NA,NA
1352647000181895172g,Niggas took down my IG page for no reason. Im done https://t.co/DCdODQC1S7,http://pbs.twimg.com/media/EsWRRvHXMAMgCFF.jpg,NA,NA,NA,NA,NA,NA,nigga,black,niggas,black,NA,NA
1352650713134817280g,@GamebredFighter @AndreasHale Or you talking about this family members that just doesn't think he's racist in a traditional sense? You sir just can't understand there's different type of racism and y'all think it's okay for some stupid fucking reason to allow any of it as long as you don't get taxed the fuck https://t.co/GtkJeP9gFl,http://pbs.twimg.com/media/EsWUp7KUUAEljrt.jpg,NA,NA,NA,NA,NA,NA,racism,minority,racist,minority,NA,NA
1352653244095467538g,@donwinslow An ignorant racist. #Karl Rove #MarjorieTaylorGreeneIsUnfit #ExpelTedCruzNow #Delusional #QAnonmeltdown #Hannity #George Conway #Maria Bartiromo #Claudia #Kayleigh #Bannon https://t.co/FlLfyqdOSi,http://pbs.twimg.com/media/EsWW9GvW4AEI-hd.jpg,NA,NA,NA,NA,NA,NA,racist,minority,NA,NA,NA,NA
1352656156758585345g,Dr Elizabeth Mormino from @Stanford_Neuro is presenting at #apoemtg2021 some of her lab’s work (lead by @KcD_PhD) on APOE phenotypes in non-Hispanic Blacks! 👍🏼 @MGHmapp @ytquiroz @rikvanderkant https://t.co/WFCGB0UJpu,http://pbs.twimg.com/media/EsWZmmiUwAElH5n.jpg,NA,NA,NA,NA,NA,NA,blacks,black,hispanic,hispanic,NA,NA
1352669467772383245g,POC: We want representation Ford: We got representation at home The representation at home: https://t.co/BwG3I1QiaX,http://pbs.twimg.com/ext_tw_video_thumb/1352088881097822215/pu/img/n7tmTZh-zicn_ZBk.jpg,NA,NA,NA,NA,NA,NA,poc,minority,NA,NA,NA,NA
1352676251996184576g,Nigga Chose facts 😂💀 https://t.co/dXc8wcXTJi,http://pbs.twimg.com/media/EsWr4EUWMAAO3iN.jpg,NA,NA,NA,NA,NA,NA,nigga,black,NA,NA,NA,NA
1352676325425901569g,"Yep Biden’s Braking His Oath Of Office Not Following Our Constitution! All This Are ILLEGALS That Are Braking Our Laws ! But, Dictator Biden Has Invited ILLEGALS To Come &amp; He Will Break Our Immigration Laws To Get Their ILLEGAL Voter ! Yep Just Like They Did This Election! Stupid https://t.co/XjMsP3MWpm",http://pbs.twimg.com/media/EsWr8l5W8AQDZIe.jpg,bi,bisexual,NA,NA,NA,NA,illegals,immigrant,NA,NA,immig,immigrant
1352680561823920128g,Weekly Friday learn to speak a new #language #Chinese Mandarin #virtual zoom #class. #stl #saintlouis #stlouis #gigstl #entertainmentinstl #zyilimusic #zyilistl. Website https://t.co/rJSfawOZiM. https://t.co/GJVmx0ZSdb for community events. https://t.co/9ECeUwBy2p,http://pbs.twimg.com/media/EsWvzW0XcAIGSGs.jpg,NA,NA,NA,NA,NA,NA,chinese,asian,NA,NA,NA,NA
1352684978161782786g,"Joining some of my colleagues in @NHHouseofReps for a presentation from @ajc on #Antisemitism in #America. Would like #SpeakerPackard to see this, according to @FBI 60% of religious bias crimes target Jews. The hate speech from members should be dealt w/seriously. #NHPolitics https://t.co/AiGM1uja9a",http://pbs.twimg.com/media/EsWz0KxW4AI19t8.jpg,bi,bisexual,NA,NA,NA,NA,jews,jewish,jew,jewish,NA,NA
1352686323329601542g,This is reached over 7 million people with almost a million interactions. And it's still going #Ella #BlackLivesMatter https://t.co/wOz5vkuuxz,http://pbs.twimg.com/media/EsW1CsEWMAIZaLV.jpg,NA,NA,NA,NA,NA,NA,#blacklivesmatter,black,blacklivesmatter,black,NA,NA
1352691519346536448g,No one is above the Law!! With Liberty &amp; Justice for all! #45isacriminal #BLM✊🏿✊🏾🇺🇸 https://t.co/j0ddNEKdu3,http://pbs.twimg.com/tweet_video_thumb/EsW5w9NUYAA45gC.jpg,NA,NA,NA,NA,NA,NA,blm,black,NA,NA,NA,NA
1352694339349204992g,Me enjoying the blackity black community I have curated across all of my timelines. https://t.co/MpvcwyI3aY,http://pbs.twimg.com/media/EsW8VPvW4Ak_58c.jpg,NA,NA,NA,NA,NA,NA,blackity,black,NA,NA,NA,NA
1352694442457587712g,@TheRealHoarse Gay Agenda here https://t.co/sXsD9p9gUE,http://pbs.twimg.com/tweet_video_thumb/EsW8bGLUwAAz3yK.jpg,gay,gay,NA,NA,NA,NA,NA,NA,NA,NA,NA,NA
1352702189127544832g,These niggas already gone get on my nerves like wtf https://t.co/lUkWqHZcGk,http://pbs.twimg.com/media/EsXDeJmXIAYBzHy.jpg,NA,NA,NA,NA,NA,NA,nigga,black,niggas,black,NA,NA
1352702289107066880g,"Here’s some of his... fan mail. To suggest he was some superhuman whose skill helped eliminate and transcend racism is foolish. Blacked out some words in the second letter in case they offend anyone, but you can use your imagination. https://t.co/mvTGD9dpcE",http://pbs.twimg.com/media/EsXDkAYUcAAXs6e.jpg,trans,transgender,NA,NA,NA,NA,racism,minority,NA,NA,NA,NA
1352704792896950273g,@jrlord1 We have blood quantum laws and they raped us for years trying to weaken that. Rape statistics in Canada are horrible. This is a systemic issue. No justice. Colonialism never ended. Neither did slavery. https://t.co/YypZQioqGR,http://pbs.twimg.com/media/EsXF1ncXYAAVTOd.jpg,NA,NA,NA,NA,NA,NA,slavery,black,NA,NA,NA,NA
1352706159547920391g,New single from the upcoming new album from @PassportRav ft @BoldyJames &amp; prod by @lexwiththerecords 💪🏽🔥 SONG-“Battle Horn” ALBUM-“Travel Ban” AVAILABLE-https://t.co/8jZUxJd9Co Album drops next Friday so don’t sleep💯 https://t.co/S6NQfcgB30,http://pbs.twimg.com/ext_tw_video_thumb/1352705968254169089/pu/img/_b3FYhl0qrEtbRY_.jpg,NA,NA,NA,NA,NA,NA,travel ban,immigrant,NA,NA,NA,NA
1352715242329894913g,"Bill Post has let his Islamophobia slide into racism &amp; religious bigotry. He often questioned Barack Obama’s Christian faith. In 2012, a fan offered a racist screed about the opportunity to replace Obama with Romney to “improve the neighborhood.” Post praised the comment. #orpol https://t.co/SkE0QG08Bd",http://pbs.twimg.com/media/EsXPWBEUUAE5I_S.jpg,bi,bisexual,NA,NA,NA,NA,islam,middle eastern,racism,minority,racist,minority
1352728533173374976g,Un latino de California haciendo historia 🇺🇸 https://t.co/XedjD0qHEH,http://pbs.twimg.com/ext_tw_video_thumb/1352728420677894144/pu/img/1PiJGJ3Apa5EWMnm.jpg,NA,NA,NA,NA,NA,NA,latino,hispanic,NA,NA,NA,NA
1352733825084710912g,#Periscope White Boys Dance Conger has moves yes or no? Memory lane https://t.co/evhXYmDqYp,http://pbs.twimg.com/ext_tw_video_thumb/1352733723112792064/pu/img/oEPC53ltJ5DwAbqR.jpg,NA,NA,NA,NA,NA,NA,white boy,white,white boys,white,NA,NA
1352734364451397633g,"(Indeed, when Gentiles, who do not have the law, do by nature things required by the law, they are a law for themselves, even though they do not have the law. Romans 2:14 NIV #ExpressNightExpo https://t.co/44AKjWN1FJ",http://pbs.twimg.com/media/EsXgvA7XcAAFzZY.jpg,NA,NA,NA,NA,NA,NA,romans,white,NA,NA,NA,NA
1352736140089061377g,"@GraceSamuel888 @Aidan52420511 @MarilynHarden13 @The2Battle @michael01958903 @ClCasteel @810100jn @johns20014 @GaryPankow @elliesangelwing @nancy757366841 @emmanuelobi476 @RoseAmeli1 @victor22922600 @DanComp02107462 @intrinsictweets @EllahieCooking @racheljill66 @je_sures @CavanPaulMulv18 @savebygrace71 @JaJa777Peter @JoshuaPichard15 @FBosschart @DonataLueck @jim_hilt @Barbarajeff55 @91Psalms123 @frisch_fish @FREEBetsyB @DavidPr70117773 @endtimeslife @Gary_Morgan_77 @Ccangelsing @abothamer_mm @maria_dannat @zandra_dixon @JLU_2016 @AsiimweGeofre17 @Antonel31937982 @GabrielleMary55 @GregPettys2 @JC4evermore @PamGibs64104547 @thompsonb2569 @jerryzez @bibleartgifts @JuliannebyGrace @NathanRaySollis @Mary39800280 KJV Eph.2:19 Now Therefore Ye Are No More Strangers &amp; Foreigners, But Fellowcitizens With The Saints &amp; Of The Household Of God Sister Grace It's Almost Verbatim, But A Simple Changing A Two Letter Word As ""On &amp; *In Can Make A Dramatic Difference, Example: Like Dark &amp; Light https://t.co/uv6kfxGx0j",http://pbs.twimg.com/media/EsXiWcCW8AETl9C.jpg,bi,bisexual,NA,NA,NA,NA,foreigner,immigrant,foreigners,immigrant,NA,NA
1352737282575405056g,"@yukutomi @LucaVillarrea12 @AccionNacional @PRI_Nacional @PRDMexico @Jesus_ZambranoG Así es, miles d MEXICANOS en el desempleo, NIÑOS enfermos d CÁNCER sin tratamiento, No hay VACUNAS en MÉXICO para el COVID, los MUERTOS en ascenso, la OPOSICIÓN en la pende.., pero q tal para RECIBIR sus prerrogativa millonarias, como el #PRD, q solo postula a amantes y NARCOS. https://t.co/yVi71xbEU8",http://pbs.twimg.com/media/EsXjYv3VkAAJ4yr.jpg,bi,bisexual,NA,NA,NA,NA,mex,hispanic,NA,NA,mexican,hispanic
1352738207817895936g,great talk today at combined #SGIMCAHI &amp;##SGIMNW regional mtg by R3 Richard Leuchter on reductions in #ACSC hospitalizations during the #COVID19 pandemic but (quite concerning) much less among African Americans @UCLA_GIMHSR @dgsomucla @uclaimchiefs @SocietyGIM https://t.co/OkhP0q4FFb,http://pbs.twimg.com/media/EsXkOygUcAEY3Y7.jpg,bi,bisexual,NA,NA,NA,NA,african american,black,african americans,black,NA,NA
1352758762570919939g,#ZopilotesFracasados #GobernadoresTraidores #ParaCalderonJuicioYCastigo #PeriodismoBasura los mexicanos no olvidamos https://t.co/swUqW9kYyY,http://pbs.twimg.com/media/EsX27F4W8AYGbOv.jpg,NA,NA,NA,NA,NA,NA,mex,hispanic,mexican,hispanic,mexicanos,hispanic
1352762400248897538g,@SenMikeLee &amp; @HawleyMO voted against confirmation of Lloyd Austin for the First African American for Secretary of Defense. Remember that. It could not have been because he wasn’t qualified. #SeditionCaucus #HawleyIsATraitor https://t.co/OOcSzOXfef,http://pbs.twimg.com/media/EsX6O4NXYAAsen8.jpg,NA,NA,NA,NA,NA,NA,african american,black,NA,NA,NA,NA
1352770215621386245g,@JoshuaPotash Exactly. The #antifa / #BlackLivesMatter militant race cult is finally being exposed. Great news. https://t.co/vRMB4BeeBo,http://pbs.twimg.com/media/EsYBUU1WMAMd6Wy.jpg,NA,NA,NA,NA,NA,NA,#blacklivesmatter,black,blacklivesmatter,black,NA,NA
1352779942715654147g,"who oppress the widows and the fatherless, and deprive the foreigners among you of justice, but do not fear me,” says the Lord Almighty. Malachi 3:5 NIV #ExpressNightExpo https://t.co/xIwUorTgNp",http://pbs.twimg.com/media/EsYKMEtXMAEBjEG.jpg,NA,NA,NA,NA,NA,NA,foreigner,immigrant,foreigners,immigrant,NA,NA
1352782068640440321g,#HomerunKing #HankAaron defied #racism &amp; #deaththreats as he broke #BabeRuth’s record in 1972 https://t.co/DmLG8DRSk4 Many think #Braves should honor #Aaron by changing their name to the #Hammers. They are last big sports team w/ #NativeAmerican mascot #americanhero #hammerinhank https://t.co/rnv4yOs2XW,http://pbs.twimg.com/media/EsYMHr0UYAAJRUr.jpg,bi,bisexual,NA,NA,NA,NA,racism,minority,NA,NA,NA,NA
1352787559508795393g,UC-Berkeley’s Department of African American &amp; African Diaspora Studies “Critical Conversations: Spring 2021 Speaker Series” #BlackStudies https://t.co/r4Jq93qCoS,http://pbs.twimg.com/media/EsYRHYEXMAIKM8h.jpg,NA,NA,NA,NA,NA,NA,african american,black,blacks,black,NA,NA
1352794122608910337g,@KEEMSTAR yes trump is so supportive of gay people ❤️ https://t.co/xcsAIgPiAt,http://pbs.twimg.com/media/EsYXFcOXMAAcocg.jpg,gay,gay,NA,NA,NA,NA,NA,NA,NA,NA,NA,NA
1352796354960044038g,The Future is Now 2021 Conference February 8th-12th! Come and enjoy speaker presentations from some of the top professionals in the country along with networking sessions and fun! Be sure to secure your seat at the #blackexcellence table. https://t.co/KBBeYnnGuh https://t.co/bN4ZxacV3H,http://pbs.twimg.com/media/EsYZHZ1WMAAPVU6.jpg,NA,NA,NA,NA,NA,NA,blackexcellence,black,NA,NA,NA,NA
1352808679414718465g,3. Okay. A lot racist. #orpol https://t.co/V0WKJoQUzH,http://pbs.twimg.com/media/EsYkUv_UYAkHJO6.jpg,NA,NA,NA,NA,NA,NA,racist,minority,NA,NA,NA,NA
1352809530422292480g,"https://t.co/BRYs8gWBXE got a light skin friend look like Michael Jackson, got a dark sink friend look like Michael Jackson https://t.co/FXo8lRgryP",http://pbs.twimg.com/media/EsYlGUgUUAE4Adi.jpg,NA,NA,NA,NA,NA,NA,light skin,black,NA,NA,NA,NA
1352826129724313600g,"Farewell Kabul-From Afghanistan to a More Dangerous World by @christinalamb John Reid, then Brit def sec, said Brit troops would ‘leave in 3 yrs &amp; without firing a single shot.’ But when asked to locate Afg on the map,he failed - a place where 100s of his troops were to b killed https://t.co/AmWLzHNU2I",http://pbs.twimg.com/media/EsY0McRVoAAqaTt.jpg,NA,NA,NA,NA,NA,NA,afghanistan,middle eastern,afg,middle eastern,NA,NA
1352834236907196417g,JFK knew the danger of the Zionist ideology and how they controlled and help establish the federal reserve https://t.co/iXx14M0jX4,http://pbs.twimg.com/media/EsY7kJmXMAECUQL.jpg,NA,NA,NA,NA,NA,NA,zionist,jewish,NA,NA,NA,NA
1352835443700752385g,I'm sure these elites control every dept and globalist control foriegn affairs. Ehy did Bïden give the CCP access to our power grid? Hunter had a meeting with CCP power company . https://t.co/hMbYWvTF2f,http://pbs.twimg.com/media/EsY8oqCXYAUB86B.jpg,NA,NA,NA,NA,NA,NA,globalist,jewish,NA,NA,NA,NA
1352837484523081728g,"Omg! Joelle Dinnage, an international art dealer from Amsterdam put a question sticker.” Ask me anything,” on her instagram today. She answered my question! I need to focus my international art pursuits with the Asian market! #japan #china #asia #ArtMarket #ArtMarketing https://t.co/IpT1j7XK9j",http://pbs.twimg.com/ext_tw_video_thumb/1352837437794340864/pu/img/-f2BYVvXWH2gVyt0.jpg,NA,NA,NA,NA,NA,NA,asian,asian,NA,NA,NA,NA
1352840253107798018g,"@mario_delgado , te aseguro que tú y tus cómplices del gobierno, cargarán con las muertes y los daños ocasionados a millones de mexicanos, por ineptitud, terquedad y mezquindad, ya que han preferido gastar en obras inservibles o estadios de beis, que en medicamentos contra Covid https://t.co/nrqRAS92IJ",http://pbs.twimg.com/media/EsZBCmiXcAA4sQi.jpg,bi,bisexual,NA,NA,NA,NA,mex,hispanic,mexican,hispanic,mexicanos,hispanic
1352843178706141184g,@JeepCanada I Found Jeep Grand Cherokee https://t.co/eMqksdplnR,http://pbs.twimg.com/media/EsZDsbfXMAA1RrP.jpg,NA,NA,NA,NA,NA,NA,cherokee,native american,NA,NA,NA,NA
1352843470243852293g,"In a letter from Herman Melville to Nathaniel Hawthorne - and so i must ask - fellas, is it gay to have a paper-mill established at one end of the house, as to more easily write a thousand - a million - a billion thoughts, in a letter to you? https://t.co/QVp9nyRa9a",http://pbs.twimg.com/media/EsZD92rXYAEyo98.jpg,bi,bisexual,gay,gay,NA,NA,NA,NA,NA,NA,NA,NA
1352845962838827009g,You have to watch this movie! Powerful. Gut-wrenching. Honest. The way it reveals systemic racism and bias is heavy. Great conversation starter and path to self-evaluation. https://t.co/VWPsBPUJZp,http://pbs.twimg.com/media/EsZGO6-U0AAultl.jpg,bi,bisexual,NA,NA,NA,NA,racism,minority,NA,NA,NA,NA
1352848159869964291g,🆘Por favor compartan!!! Sus dueños estan desesperados! Trae collar negro y Placa Azul Col. Las sombrillas en Santa Catarina! 🆘 #RT @Cicmty https://t.co/L6Upz3oJaO,http://pbs.twimg.com/media/EsZIOlAXUAA7_hn.jpg,NA,NA,NA,NA,NA,NA,negro,black,NA,NA,NA,NA
1352913541343412230g,"This photo shop image of Madame Vice President @KamalaIsMyPOTUS image is powerful 2 me. 60 years ago, Ruby Bridges broke down barrier in education that opened doors 4 little Black girls and boys everywhere. Our country’s first Black Woman Vice President has given me hope. https://t.co/O0VgURh9HV",http://pbs.twimg.com/media/EsaDsjdW8AAjMzF.jpg,NA,NA,NA,NA,NA,NA,black girl,black,black girls,black,black woman,black
1352916584214441984g,#ObidensAmerica #MurielBowser #NationalGuard #WashingtonDC #Unity #DemocratsHateAmerica #democracy #BackTheBlue #USarmy #USNavy #USAirforce #USMarines #army #navy #airforce #marines #trump2022 #Hunter #Biden #China #Ukraine https://t.co/hQoGfpcX82 https://t.co/rNzgNUKCIq,http://pbs.twimg.com/media/EsaGdorXYAEhW9R.jpg,bi,bisexual,NA,NA,NA,NA,backtheblue,black,NA,NA,NA,NA
1352945827749253121g,@TedWellsMustach Good morning Debi . My weekend starts in 15 mins. Wifes birthday . With covid going to be quiet. Just going to order chinese food and have a few drinks with thr family https://t.co/Vh76HAg7Dd,http://pbs.twimg.com/tweet_video_thumb/EsahDmgXcAEBqzg.jpg,bi,bisexual,NA,NA,NA,NA,chinese,asian,NA,NA,NA,NA
1352961312716972032g,"But real Nigga shit, So who trynna come bust this pussy down this am? 👀 Early Birds gets the worm right?? Lol Because what I don’t have time for is more of this high being wasted on hoes who simply can’t keep up.. https://t.co/QMXFT0qfOu",http://pbs.twimg.com/tweet_video_thumb/EsavI8ZXYAAkvpX.jpg,bi,bisexual,NA,NA,NA,NA,nigga,black,NA,NA,NA,NA
1352972266863292417g,@duragdip1omat horny nigga detected https://t.co/KTG3ug0sSw,http://pbs.twimg.com/ext_tw_video_thumb/1327420170244153345/pu/img/ToSQHqFY2PNkT-RI.jpg,NA,NA,NA,NA,NA,NA,nigga,black,NA,NA,NA,NA
1352984630060838913g,"As promised, one of President Biden’s first acts was to erase his predecessor’s Islamophobic and inegalitarian travel ban. Here’s what I say in a forthcoming piece in response to someone who thinks that comparisons between Korematsu and Trump v. Hawaii are inapt. https://t.co/tD5uemmIQJ",http://pbs.twimg.com/media/EsbEWWBW8AE7D-e.jpg,bi,bisexual,NA,NA,NA,NA,travel ban,immigrant,islam,middle eastern,NA,NA
1352986498853965825g,"[#BrainStorm☈] #RunOnOfTheDay #ROOTD #ThoughtOfTheDay #TOTD #QuestionOfTheDay #QOTD: ""@latimes...The #plant is called #Cannabis(.) Are you trying to spread #racism?🤔"" ~L.C. a.k.a. 🦁 O.G. https://t.co/znlJmLmL0X",http://pbs.twimg.com/media/EsbGDOMW4AArgyk.jpg,bi,bisexual,NA,NA,NA,NA,racism,minority,NA,NA,NA,NA
1352998026810445824g,I hope all the white women complaining about the long lines are reminded to never again vote for a fascist. Because this is his fault. https://t.co/cnwEVxXUQD,http://pbs.twimg.com/tweet_video_thumb/EsbQiD2XcAEt_HP.jpg,NA,NA,NA,NA,NA,NA,white women,white,NA,NA,NA,NA
1352998418663288833g,#Blacklivesmatter #Twerkonwashington #Blacklash #controversy #ShainaLynn #twerksome https://t.co/r7bQBC5xeq,http://pbs.twimg.com/ext_tw_video_thumb/1352998328401854474/pu/img/pvv5iD_wJDv1njcx.jpg,NA,NA,NA,NA,NA,NA,#blacklivesmatter,black,blacklivesmatter,black,NA,NA
1352999223441190912g,Read #Tierra’s #book The Way of Chinese Herbs. The author offers a wealth of information on herbs and how #TCM uses them. He explains the #Chinese idealogy behind the #herbs and provides a list of Chinese herbal formulas that are available in the market place and their benefits. https://t.co/uhDZEHrKeE,http://pbs.twimg.com/media/EsbRn0gW4AAQXTe.jpg,NA,NA,NA,NA,NA,NA,chinese,asian,NA,NA,NA,NA
1353011402839969793g,"[𝑰𝑳𝑳𝑬𝑮𝑨𝑳] Sizzle reel is LIVE! It's a series about an undocumented immigrant in Los Angeles who gets into all sorts of trouble. On the outside she’s a successful model, but she also starts to work for a drug cartel to make ends meet. https://t.co/z54NWDYmaN https://t.co/slpde89plL",http://pbs.twimg.com/media/EsbcsyaU0AAe3EI.jpg,NA,NA,NA,NA,NA,NA,immig,immigrant,immigrant,immigrant,migrant,immigrant
1353015399688921089g,#TedCruz #InsurrectionAct #Insurrection #Senate #GOP #CapitolRiots #TedCruzResign There are a few Senators that certainly did have an impact on MAGA Proud Boys Boogaloo Supremacist Extremist.. and Ted Cruz is worthy of a thorough investigation by Senate Ethics Committee asap 🙄 https://t.co/ClrrnWUV43,http://pbs.twimg.com/ext_tw_video_thumb/1353015362481225729/pu/img/YMaSbkQ-wt4uyeif.jpg,NA,NA,NA,NA,NA,NA,proud boys,white,NA,NA,NA,NA
1353026543883177986g,"Raza no compren en @InnvictusMX Les adjunto lo que me pasó, lo que pedí y lo que me llego. No me están resolviendo nada, ahórrense su tiempo y compren en otro lado https://t.co/bJePaZDjzz",http://pbs.twimg.com/media/Esbqd9dVoAI_1eM.jpg,NA,NA,NA,NA,NA,NA,raza,hispanic,NA,NA,NA,NA
1353030706641969154g,@2sidescoin @smartstatistic @2sidescoin you’re making it abundantly clear that you haven’t even read the introductory text &amp; it’s becoming embarrassing. Black women in the “epitome of health” are dying while delivering. I suggest you become more informed on this topic before throwing around your prof creds. https://t.co/cndJ5wL8FU,http://pbs.twimg.com/tweet_video_thumb/EsbuP-LXEAgsFMu.jpg,NA,NA,NA,NA,NA,NA,black women,black,NA,NA,NA,NA
1353034512159166464g,This song is so dope...I love when gay artist really deliver... https://t.co/0ZLZyPwVle,http://pbs.twimg.com/media/EsbxtzXXAAAA6ik.jpg,gay,gay,NA,NA,NA,NA,NA,NA,NA,NA,NA,NA
1353046616274558976g,"@iKilledCarmine7 @PrimeVideo MLK left a #NonViolentDirectAction strategy that is ignored by US mainstream media, education system, most agencies, politicians, and even religions. He was going for a human rights movement that isnt taught while leaders forget #TheThreeEvils of #Militarism #Racism an #Poverty https://t.co/zNJWxFhMUx",http://pbs.twimg.com/media/Esb8tu_VoAAyQpv.jpg,NA,NA,NA,NA,NA,NA,racism,minority,NA,NA,NA,NA
1353046808218357764g,I was obligated to throw in a picture from the Immigration Wars book tour https://t.co/JUrd00jWT9,http://pbs.twimg.com/media/Esb85fSVoAApDs3.jpg,NA,NA,NA,NA,NA,NA,immig,immigrant,immigration,immigrant,NA,NA
1353049241510285314g,I need Black people to save Black People from COVID19. I will train you fir free. Yiu will become wealthy. You will train others for free. @WilliamDBurton2 https://t.co/X8x9aYfkLs https://t.co/edQqaOg52n,http://pbs.twimg.com/media/Esb_GQTXUAAfPkn.jpg,NA,NA,NA,NA,NA,NA,black people,black,NA,NA,NA,NA
1353049358736887808g,@MindyHarley 💯 BS! #BigPharma #ChinaVirus #FakeNews https://t.co/WqVgQ5bhi7,http://pbs.twimg.com/media/Esb_OEMU0AEcehZ.jpg,bi,bisexual,NA,NA,NA,NA,chinavirus,asian,NA,NA,NA,NA
1353054134346235904g,"@DonaldJTrumpJr The Trump rightwingers like the ones who attempted to kidnap Gov. Whitmer and execute her. That is your base now! They wanted to do the same to Pence, Pelosi, AOC &amp; Schumer. BLM &amp; Antifa are no angels but how can you your dad defend &amp; support these Racist Militia who attacked. https://t.co/ZwMzwTLr4Q",http://pbs.twimg.com/media/EscDj9bXUAAe-yN.jpg,NA,NA,NA,NA,NA,NA,blm,black,racist,minority,NA,NA
1353062619993706496g,Increasing clouds with little temperature change. https://t.co/oWO9EQnzsJ Apache Junction #AZ #forecast 12:30 https://t.co/DzhLuQImsN,http://pbs.twimg.com/media/EscLSFwVoAUwodG.jpg,NA,NA,NA,NA,NA,NA,apache,native american,NA,NA,NA,NA
1353068892143271936g,Omg omg omg omg! That would be the best thing ever! 😂😂😂😂 While eating Chinese food please! #POstables #SomethingGood https://t.co/PmSLWmlbTZ,http://pbs.twimg.com/tweet_video_thumb/EscQ-0AUYAI2KYq.jpg,NA,NA,NA,NA,NA,NA,chinese,asian,NA,NA,NA,NA
1353073435895713793g,@ScorpionsInvest @mtgreenee Hi! Here to remind you that transgender women are (checks notes) WOMEN https://t.co/HWiesc5b4h,http://pbs.twimg.com/tweet_video_thumb/EscVHGVUwAMqQ2z.jpg,trans,transgender,transgender,transgender,NA,NA,NA,NA,NA,NA,NA,NA
1353086318398603264g,A great response to the recent racist comments that have shook our town from Pastor Jill Olds of the Congregational Church of #Naugatuck @Congonaug https://t.co/kDrFvqvXq2,http://pbs.twimg.com/media/EscgxvcXIAMvklA.jpg,NA,NA,NA,NA,NA,NA,congo,black,racist,minority,NA,NA
1353089622809718791g,"No matter your circumstances, flaws, ethnicity, gender, sexual orientation........... everyone deserves shelter and food. https://t.co/tL3X6seNBw",http://pbs.twimg.com/media/Escj1gbXYAEVa4d.jpg,sexual orientation,lgbtq+,NA,NA,NA,NA,NA,NA,NA,NA,NA,NA
1353099837349261322g,@KevinMKruse @DineshDSouza Got this back in the ‘90s &amp; I know this historian also wrote The Crucible of Race. This definitely covers the Democrats being the ones who put in Jim Crow laws. Read some recent books by @EthanKytle @BlainRoberts1 @AdamHDomby @CarrieJanney that cover it too. Hope this helps. https://t.co/wXZ1AivDwv,http://pbs.twimg.com/media/EsctIYIW4AQAPfp.jpg,NA,NA,NA,NA,NA,NA,jim crow,black,NA,NA,NA,NA
1353101750773960704g,@JaySlankyy69 @DoctorShaq @BullsFanJose @wojespn Bro leave that other shit with you and your boys .. we can talk ball but ion be on that new skool freelance gay shit 🤦🏾‍♂️ https://t.co/8MG1A1nu6v,http://pbs.twimg.com/tweet_video_thumb/Escu2y5XEAEc6Mq.jpg,gay,gay,NA,NA,NA,NA,NA,NA,NA,NA,NA,NA
1353111664514752517g,Hebrews 4:12 https://t.co/tTZ50KzcWr,http://pbs.twimg.com/media/Esc34qXXAAItrLP.jpg,NA,NA,NA,NA,NA,NA,hebrews,middle eastern,NA,NA,NA,NA
1353117207358672896g,"#MENEMENETEKELUPHARSIN WE TOLD YOU SO. ENJOY THE RIDE. This is what you emeffers voted for. Every decision has a consequence. BTW, Blaks, Lesbos, Queer, Trans in government and no Native Representation. The few are twisted. 🤔⚠️👁👁💩🏹 #DEMONRATS #NoCrying #YourChoice https://t.co/tZ7NAQi9Pf",http://pbs.twimg.com/media/Esc87gBUUAAq34u.jpg,queer,lgbtq+,trans,transgender,NA,NA,NA,NA,NA,NA,NA,NA
1353121524509769728g,@QueenTAG @1dream65 But Georgia saved America. We turned Georgia blue. There are racist people in this state though. https://t.co/gghX86aYOV,http://pbs.twimg.com/media/EsdA2weWMAAvu5u.jpg,NA,NA,NA,NA,NA,NA,racist,minority,NA,NA,NA,NA
1353122890485555201g,"Today I celebrated 2 years, 731 consecutive days of DDPY workouts, one year since becoming the first African American to do so on my late cousins birthday. TMC forever 🙌💥💎🏁 @DDPYoga @jessica81412995 @RealDDP https://t.co/U7VMqJ4NT7",http://pbs.twimg.com/media/EsdCF86XIAUjfGD.jpg,bi,bisexual,NA,NA,NA,NA,african american,black,NA,NA,NA,NA
