tweet_id,tweet_text,img_url,lgbtterm1,lgbtcat1,lgbtterm2,lgbtcat2,lgbtterm3,lgbtcat3,raceterm1,racecat1,raceterm2,racecat2,raceterm3,racecat3
1356440384574873601g,"We are glad to celebrate Happy #BlackHistoryMonth The month of February is a time to recognize the progress, contributions, legacy and richness of African American culture On the cover is Michael Matthews, Founder of https://t.co/0v0tTggLcv Grab your copy today #linkinbio https://t.co/CqUYyOzPj2",http://pbs.twimg.com/media/EtMLVsEVgAEwxOc.jpg,bi,bisexual,NA,NA,NA,NA,african american,black,NA,NA,NA,NA
1356440400966406145g,USA GOD OF WAR.aka Satan with satanic slavery or SCOTTLD with LINCOLN and norms funeral https://t.co/JQ26yhPAQv,http://pbs.twimg.com/media/EtMLWQ2XUAAaUEC.jpg,NA,NA,NA,NA,NA,NA,slavery,black,NA,NA,NA,NA
1356446621467348995g,Get your Black History Flashcards from MES. https://t.co/tqSy1DSil1 https://t.co/5tectZZm8e,http://pbs.twimg.com/ext_tw_video_thumb/1356446600265142273/pu/img/LudXJ2NsqutA1aJX.jpg,NA,NA,NA,NA,NA,NA,black history,black,NA,NA,NA,NA
1356447400211058689g,Do I want to take this time As a Black Man to acknowledge Black History Month Starting today✊🏾 I hope @Twitter can stand with me and celebrate as well and educate! If your in DOGECOIN learn about Black Wall Street please #BlackHistoryMonth2021 #Dogecoins https://t.co/Fpw14TNmFn,http://pbs.twimg.com/ext_tw_video_thumb/1356447221114314754/pu/img/rcCrY2nhVuxMqJ_W.jpg,NA,NA,NA,NA,NA,NA,black history,black,black man,black,NA,NA
1356450880292290567g,"Mondays during #BlackHistoryMonth, I'll be highlighting some Little Rock Black History. As we work to #UniteLR, it is important to build on past achievements. In 1873 in Little Rock, Mifflin Wistar Gibbs became the first African American elected as a City Judge in the US. https://t.co/JAGvZ6sZgH",http://pbs.twimg.com/media/EtMU4tlXMAIzUq1.jpg,NA,NA,NA,NA,NA,NA,african american,black,black history,black,NA,NA
1356452573436391424g,"In honor of Black History Month, the CVHS Black Student Union is hosting a schoolwide art submission, where all students will be able to submit poems, drawings, paintings, song arrangements, or any other creation that they’d like to share. https://t.co/86dUfGA8xo @HoustonISD https://t.co/ROrjQ5hWTH",http://pbs.twimg.com/media/EtMWbO8XUAAmTZ2.jpg,NA,NA,NA,NA,NA,NA,black history,black,NA,NA,NA,NA
1356453874589003779g,"After I fill in all the same info on behalf of my mom every time I login bc the info doesn’t hold I get this response “no events“. She’s 74 Latina w RA, a thyroid condition &amp; a breast cancer survivor. Nothing for that priority group I guess.🤦🏻‍♀️@AZDHS @dougducey @SierraVistaAZ 💉🦠 https://t.co/04g2rAMtCJ",http://pbs.twimg.com/media/EtMXnAeVcAMtU1Y.jpg,NA,NA,NA,NA,NA,NA,latina,hispanic,NA,NA,NA,NA
1356456814355697664g,Happy Black History month ✊🏾 https://t.co/s4II2bx7oJ,http://pbs.twimg.com/media/EtMaSCEVEAIRcrq.jpg,NA,NA,NA,NA,NA,NA,black history,black,NA,NA,NA,NA
1356457286689038336g,"Today, is my AMAZING Dad's birthday, first day of National School Counseling Week, and first day of Black History Month! In my Ice Cube voice ""today, was a good day"". #impumped #ilovetheskinimin https://t.co/t8bCVTwm5Q",http://pbs.twimg.com/media/EtMatsmXAAAQJqM.jpg,bi,bisexual,NA,NA,NA,NA,black history,black,NA,NA,NA,NA
1356457548082077696g,"#BlackHistoryMonth #comicbeforebed Fantastic Four No. 52, July, 1966. Black Panther puts on his outfit, declares the FF are the hunted, and begins to tell his tale. 🧤💥🗣 First appearance of #BlackPanther #FantasticFour #MarvelComics @Marvel @MarvelUnlimited https://t.co/IZFQeQLtjx",http://pbs.twimg.com/media/EtMa8ubXEAEAFD9.jpg,NA,NA,NA,NA,NA,NA,black panther,black,blackpanther,black,NA,NA
1356458401400827905g,"Welcome Back Lansing Area! Open Tuesday 4-8pm with dine-in, heated patio &amp; carryout. We are excited to introduce a #newfoodmenu that has a #cuban #shrimp &amp; #nachos to be enjoyed with a #tequilalimegose #peanutbutterstout a #merlotbarrelagedbelgianquad #lavender or cinnamon cider https://t.co/bIQZHXUG8Y",http://pbs.twimg.com/media/EtMbud_WgAEmWEb.jpg,bi,bisexual,NA,NA,NA,NA,cuban,black,NA,NA,NA,NA
1356460972894900224g,"Black History Month, Happy February. https://t.co/X7cNPnxeYB",http://pbs.twimg.com/tweet_video_thumb/EtMeEA2VoAIwLQ2.jpg,NA,NA,NA,NA,NA,NA,black history,black,NA,NA,NA,NA
1356464684845522946g,Free my nigga man they trying to give my dog life https://t.co/qekTimmkC6,http://pbs.twimg.com/media/EtMhcQBUYAEReia.jpg,NA,NA,NA,NA,NA,NA,nigga,black,NA,NA,NA,NA
1356486625077911553g,"@GovTimWalz Why does @Tim_Walz in 2021 @GovTimWalz feel the need to create a ""proclamation"" for a reboot of ""Black History Month?"" Why not go rehire Kid'N'Play &amp; produce another ""House Party"" Sequel considering how many people are out-of-work? #Retweet #rtITBot @Retweet #HousePartySequel https://t.co/zKRQjS1NTw",http://pbs.twimg.com/tweet_video_thumb/EtM1YwaXMAMGRa8.jpg,NA,NA,NA,NA,NA,NA,black history,black,NA,NA,NA,NA
1356491199998169090g,"@GovTimWalz Why not go rehire Kid'N'Play &amp; produce another ""House Party"" Sequel considering how many people are out-of-work? Why does @Tim_Walz in 2021 @GovTimWalz feel the need to create a ""proclamation"" for a reboot of ""Black History Month?"" #Retweet #rtITBot @Retweet #HousePartySequel https://t.co/oFGQBBvCHQ",http://pbs.twimg.com/tweet_video_thumb/EtM5jFbXcAEEglX.jpg,NA,NA,NA,NA,NA,NA,black history,black,NA,NA,NA,NA
1356522610750816257g,The proud boys QAnon think that display of weapons “menacing” is gonna intimidate their opposition into fearful submission. What’s the left plans for confronting ar15 toting schnooks? https://t.co/edyiVdmwBi,http://pbs.twimg.com/media/EtNWH-IXcAYuvF-.jpg,bi,bisexual,NA,NA,NA,NA,proud boys,white,NA,NA,NA,NA
1356563567730974724g,".@CBS ""Movin' on up"" - ""The Jeffersons"" (1974-1985) Which according to @TikTok_US is banned in my region (State of Minnesota) due to copyright restrictions &amp; white boys like myself can not cover it #TheJeffersons #TikTik #MovinOnUp #TVShowThemes #rtITBot #Retweet #ShareForward https://t.co/gsjxclACTL",http://pbs.twimg.com/tweet_video_thumb/EtN7Xt0XAAUo0ia.jpg,NA,NA,NA,NA,NA,NA,white boy,white,white boys,white,NA,NA
1356575855410036739g,The Southern Baptist Convention thinks fighting Critical Race Theory and Russell Moore are the greatest challenges to the church when it has blatant racism like this on its front doorstep and refuses to denounce it. https://t.co/GXEs5bF5kA,http://pbs.twimg.com/media/EtOGjDSWYAEKWsm.jpg,NA,NA,NA,NA,NA,NA,racism,minority,NA,NA,NA,NA
1356583100524892160g,The Israeli media is attempting to caricature Marjorie Taylor Greene in the same way they did Sarah Palin (HEIL!!!). #OneZeroSix.. https://t.co/DGzwQhvskL,http://pbs.twimg.com/tweet_video_thumb/EtONIyzUUAAG-C5.jpg,NA,NA,NA,NA,NA,NA,israeli,middle eastern,NA,NA,NA,NA
1356584954348642307g,Another day at work and no mention of Black History Month 🤨 https://t.co/iJzCrK9ovh,http://pbs.twimg.com/tweet_video_thumb/EtOO0pPXMAAF4vR.jpg,NA,NA,NA,NA,NA,NA,black history,black,NA,NA,NA,NA
1356599747751120900g,"Back in 2017 I made history as the FIRST African American EKU student to write a FRONT PAGE story &amp; it was based on EKU NPHC! I still cherish this accomplishment of mine, especially because I worked so hard on it. #BlackHistoryMonth￼ https://t.co/zVTGPQ6Yh9",http://pbs.twimg.com/media/EtOcR5EXYAURZ-3.jpg,NA,NA,NA,NA,NA,NA,african american,black,NA,NA,NA,NA
1356600962073432065g,Today’s Black History moment is courtesy of Hiram B. Revels who became the the first Black United States Senator and was also a Founder of The Illustrious Alcorn St University #AlcornExcellence https://t.co/DeVix2leT3,http://pbs.twimg.com/media/EtOdYk1XEAE0O1j.jpg,NA,NA,NA,NA,NA,NA,black history,black,NA,NA,NA,NA
1356625375204433921g,Minimalla Antideslumbrante Tauro® De acero galvanizado recubierto con PVC negro para mayor durabilidad contra la corrosión (protección UV). Es un sistema ideal para dar seguridad a los automovilistas cuando transitan en carreteras o autopistas. https://t.co/yVg2SQKFRq,http://pbs.twimg.com/media/EtOzlWsWYAk1Equ.jpg,bi,bisexual,NA,NA,trans,transgender,negro,black,NA,NA,NA,NA
1356631713737236482g,"Carter G Woodson (born 1875) was an American historian, author, journalist, &amp; the founder of the Association for the Study of African American Life &amp; History. 1 of the first scholars to study the history of the African diaspora, including African-American history. #blackhistory https://t.co/Z4y4njTVwK",http://pbs.twimg.com/media/EtO5Wp6XEAE_kP8.jpg,NA,NA,NA,NA,NA,NA,african american,black,NA,NA,NA,NA
1356632262557765632g,"As we celebrate #BlackHistoryMonth, @HaywoodSchools must actively address our #equitycommitment to be #antiracist. In foreword of @DrTraceyBenson &amp; @SarahFiarman’s book, @courageousdove gives us our why. @HaywoodSchools serve 66% Black &amp; 7% Hispanic students. #knowbetterdobetter https://t.co/QZ1EziISyL",http://pbs.twimg.com/media/EtO52aUXYAAcrzI.jpg,NA,NA,NA,NA,NA,NA,hispanic,hispanic,racist,minority,NA,NA
1356634149142949889g,Trans kids read Calvin &amp; Hobbes and only want one thing https://t.co/HH24jI5kU8,http://pbs.twimg.com/media/EtO7kFDWQAEJQlZ.jpg,trans,transgender,NA,NA,NA,NA,NA,NA,NA,NA,NA,NA
1356635991352758274g,"Excited to mark this year’s black history month. This year has extra special meaning as we celebrate 25 years since the creation of Black History Month by the legendary Jean Augustine, the first Black woman MP, and first Black woman federal Cabinet minister in Canada. https://t.co/Yo7QvulKI1",http://pbs.twimg.com/media/EtO9Pk2XYAohFDN.jpg,bi,bisexual,NA,NA,NA,NA,black history,black,NA,NA,black woman,black
1356637205725286402g,I love me some #GroundhogDay but why in god’s great earth in 2021 do I only see white men standing on this stage?!? #Punxsutawney where’s the POC and WOMEN?!? @GroundhogClub https://t.co/s0Y2xX8il2,http://pbs.twimg.com/media/EtO-WQdUYAAUur5.jpg,NA,NA,NA,NA,NA,NA,poc,minority,white men,white,NA,NA
1356639380627197953g,Happy Black History Month! Support these Black-owned breweries in MA this month and every month. #BlackHistoryMonth #drinklocal 📸: @TurtleSwampBrew https://t.co/nkO1I5vlxh,http://pbs.twimg.com/media/EtPAU33XIAA28RO.jpg,NA,NA,NA,NA,NA,NA,black history,black,NA,NA,NA,NA
1356640820233928705g,National Gun Violence Survivors Week &amp; #BlackHistoryMonth Black people are disproportionately affected by deadly Gun Violence *Missouri* has the highest rate of gun deaths among Black people #MOleg Txt READY to 644-33 to join 1 of 20 MO @MomsDemand groups #GVSurvivorsWeek #BLM https://t.co/7J6Yiz0RWr,http://pbs.twimg.com/media/EtPBorvXAAIT_05.jpg,NA,NA,NA,NA,NA,NA,black people,black,NA,NA,blm,black
1356642526254555141g,"यह जंग है, और इसमें दो ही पासे हैं; तुम्हें एक तो चुनना ही होगा । अगर नहीं चुना तो तुम ख़ुद-ब-ख़ुद उसकी ओर होगे जो ज़ालिम है । #कंवल #Kanwal #Thought #Quote #Poetry #Hindi #Urdu #HumanRightsViolations #HumanRights #FarmersProtest https://t.co/fT2rqE0qzc",http://pbs.twimg.com/media/EtPDL9QWgAAC2JJ.jpg,NA,NA,NA,NA,NA,NA,hindi,asian,urdu,middle eastern,NA,NA
1356642995236466690g,"Black History Month Spotlight | Week 1, Day 2 | International Greats | Thomas N’Gijol, Paris France . . . #BlackHistoryMonth #ThomasNgijol #BHM2021 #BlackInternational #BlackCommunications #WeAreBlackHistory ✊🏾@ThomasNgijol https://t.co/I5chxNnduG",http://pbs.twimg.com/media/EtPDnPAWgAYWDPM.jpg,NA,NA,NA,NA,NA,NA,black history,black,NA,NA,NA,NA
1356652301818167299g,It's the final January episode of #TheMooreChanteShow and what a way to usher in Black History Month! https://t.co/CDpa0KYQGG Come relive the laughter and love or see what you missed... #WordPress #BloggersOfTwitter #ZootsBlogspot #ChanteMoore #ChantesGotAFan https://t.co/mNHx2wleT8,http://pbs.twimg.com/ext_tw_video_thumb/1356652077192200194/pu/img/etIkhA90X0WZzRHY.jpg,NA,NA,NA,NA,NA,NA,black history,black,NA,NA,NA,NA
1356654372785172480g,Just finish the movie #beneathus.. a great horror/thriller with a relevant social commentary on illegal immigration... This film is very disturbing https://t.co/YIpC9BkVge,http://pbs.twimg.com/tweet_video_thumb/EtPN9CFXcAAVJWm.jpg,bi,bisexual,NA,NA,NA,NA,immig,immigrant,immigration,immigrant,NA,NA
1356654404825346048g,Happy black history month ☹️🤟🏼 https://t.co/E88yl0Zpx0,http://pbs.twimg.com/media/EtPN_K8VkAAKNcr.jpg,NA,NA,NA,NA,NA,NA,black history,black,NA,NA,NA,NA
1356656022119677958g,@Tony_BATtista @tastytrade It kinda is rigged when Robinhood is forced to not allow GME buy orders. Mark Cuban explains it on WSB: https://t.co/pLZuxSTn3G,http://pbs.twimg.com/media/EtPPdX3XYAEtV0i.jpg,bi,bisexual,NA,NA,NA,NA,cuban,black,NA,NA,NA,NA
1356659699307995138g,Big shoutout to Mrs Turner @ Poteet for putting up displays of black history month in each hallway based off of the subject. #GoodStuff https://t.co/z2z2d5MQiV,http://pbs.twimg.com/media/EtPSzIlWQAEC0LO.jpg,bi,bisexual,NA,NA,NA,NA,black history,black,NA,NA,NA,NA
1356665909792829441g,me the second I land in México after self deporting https://t.co/XfZsHTKTNP,http://pbs.twimg.com/ext_tw_video_thumb/1356665893187506178/pu/img/SyVXw4ACEN3kuINt.jpg,NA,NA,NA,NA,NA,NA,deport,immigrant,deporting,immigrant,NA,NA
1356666478754476032g,@HBCUfessions Get that ignorant coon shit out of here. https://t.co/WC6aK8rz9s,http://pbs.twimg.com/media/EtPY-M7XIAIwCKf.jpg,NA,NA,NA,NA,NA,NA,coon,black,NA,NA,NA,NA
1356669171837394947g,BLACK LIVES MATTER #BlackHistoryMonth https://t.co/m32wkqFFCc,http://pbs.twimg.com/ext_tw_video_thumb/1356669141525143558/pu/img/aEIHFboWmmdOZWn5.jpg,NA,NA,NA,NA,NA,NA,black lives,black,NA,NA,NA,NA
1356674235897442309g,You all know Lawson done his work under the original Black Panther n NAACP ! Say amen ! Amen n thank you Jesus ! LadyB of Houston n America https://t.co/5ojcapMWCC,http://pbs.twimg.com/media/EtPgBOmXUAA01lZ.jpg,NA,NA,NA,NA,NA,NA,black panther,black,NA,NA,NA,NA
1356677232735838212g,"@gabyfernandezdl @MiguelOjedaS @DiablosRojosMX @alfredoharphelu @Mini_PorraMx @henrygutierrezp @LigaMexBeis @elivanterrazas Estamos ready para caminar con nuestro nuevo manager, bienvenido de regreso a la cueva del diablo NEGRO OJEDA ❤️👹⚾🤟🏽 https://t.co/peS9t4ugk6",http://pbs.twimg.com/media/EtPiwFNVoAAsHPW.jpg,bi,bisexual,NA,NA,NA,NA,negro,black,mex,hispanic,raza,hispanic
1356680171940642818g,"CHOLITA License Plate 1.5"" #SadGirl #Huera #EastLos #WhittierBlvd #OldiesAreForever #Oldies #EastsideStories #LosAngeles #Hispanic #Lowrider #Gangster #Mexican #California #BrownPride #LowriderOldies #LicensePlate #Orale #Chicana #EnamelPin #PinGame #LapelPin #SmileNowCryLater https://t.co/S5d1aq2laP",http://pbs.twimg.com/ext_tw_video_thumb/1356679481864327168/pu/img/IDa3ftkd3iQUgF_4.jpg,NA,NA,NA,NA,NA,NA,hispanic,hispanic,mex,hispanic,mexican,hispanic
1356685925477019648g,"Shoutout to @WxLLxxM taking over the NYC &amp; East Coast Playlists on Apple Music, make sure to tune in on @AppleMusic 🔥 Khaliente - Muslim Dior gotta be on there ASAP: https://t.co/b8gkqFw2z7 https://t.co/8X9BpgEjRm",http://pbs.twimg.com/media/EtPqpSxVEAIXmIn.jpg,NA,NA,NA,NA,NA,NA,muslim,middle eastern,NA,NA,NA,NA
1356697226815410181g,omaha people- would you believe that this building existed where conagra campus today is? look into the omaha world fair and the trans-mississippi international exposition. there’s literally no explanation of why this was taken down https://t.co/qDwE0jnOVS,http://pbs.twimg.com/media/EtP07yVXAAgXKFA.jpg,trans,transgender,NA,NA,NA,NA,NA,NA,NA,NA,NA,NA
1356700076702334980g,"🎉WEEKLY MANAGER'S SPECIAL 🎈 ✅💲3️⃣1️⃣,0️⃣0️⃣0️⃣ ✅2020 Jeep Grand Cherokee Limited ✅Only 17,400 Miles ✅3.5L V-6 Engine (295 HP) ✅Walnut Brown Metallic Clearcoat ✅Dual-Pane Pano SunRoof ✅UConnect Navigation ✅18"" Wheels https://t.co/pGQ9zpbykM #GoGillingham #ManagerSpecials https://t.co/iY8lSglPUz",http://pbs.twimg.com/media/EtP3hg8XAAEOMJV.jpg,NA,NA,NA,NA,NA,NA,cherokee,native american,NA,NA,NA,NA
1356703431000489984g,@CarolinaK_12 Thank you so much!!!! Not only did I have the opportunity to participate in two amazing virtual workshops I also received these amazing resources. #nced #equity #BlackHistoryMonth #BlackLivesMatterAtSchool #BlackLivesMatter https://t.co/35uWb8DNtd,http://pbs.twimg.com/media/EtP6kYDXEAArZN_.jpg,NA,NA,NA,NA,NA,NA,#blacklivesmatter,black,NA,NA,blacklivesmatter,black
1356706878328360960g,"@AliMayorkas becomes first Latino, first immigrant to lead Department of Homeland Security. ¡Así se hace! Congratulations https://t.co/aBEv2qATbB",http://pbs.twimg.com/media/EtP9tr-XIAMJR5x.jpg,NA,NA,NA,NA,NA,NA,latino,hispanic,immig,immigrant,immigrant,immigrant
1356714071048015872g,black history month 💀🖤 https://t.co/ENDrRoHAxf,http://pbs.twimg.com/ext_tw_video_thumb/1356713822690697225/pu/img/VC5kbmMQqTuFFZd1.jpg,NA,NA,NA,NA,NA,NA,black history,black,NA,NA,NA,NA
1356717411903406081g,February is Black History Month. All month long we will be recognizing &amp; celebrating our Region 5 Past Present and Future Black Female Athletes who have inspired &amp; continue to inspire young women &amp; athletes in everything they do! #blackhistorymonth￼ #celebrate #inspire https://t.co/ihWHB0mbP0,http://pbs.twimg.com/media/EtQHSwKXEAEtuTL.jpg,NA,NA,NA,NA,NA,NA,black female,black,black history,black,NA,NA
1356722852167364616g,Throughout this month in PrimeTime games we’ll look to pay homage to African Americans that made an impact that aren’t well known. Let the be the year we attack social injustice as a country and make a difference in our future and beyond! #RFL #BlackHistoryMonth https://t.co/1oRjTMMiaX,http://pbs.twimg.com/media/EtQMPe-XUAMxqBj.jpg,NA,NA,NA,NA,NA,NA,african american,black,african americans,black,NA,NA
1356723062146621441g,I’m literally sitting here on the phone with @hiholynellio and he is INSISTING that I never told him happy birthday. Niggas... https://t.co/HEoNgFTCzR,http://pbs.twimg.com/media/EtQMbvNUcAUC_mt.jpg,bi,bisexual,NA,NA,NA,NA,nigga,black,niggas,black,NA,NA
1356723714319073285g,"It’s Starkville Strong’s mission to support the community, &amp; part of that includes closing the gaps created by unbalanced opportunities &amp; experiences to influence the possibility for a better future. #blacklivesmatter #StarkvilleStrong #StarkVegas #BetterTogether #BeTheChange https://t.co/rtHDnq5L27",http://pbs.twimg.com/media/EtQNBxhWYAQo2Et.jpg,bi,bisexual,NA,NA,NA,NA,#blacklivesmatter,black,blacklivesmatter,black,NA,NA
1356736061238620163g,"@POTUS signing the three executive orders on immigration with newly-confirmed DHS Secretary @AliMayorkas, acknowledging the shame of the previous administration’s actions separating children from their families. https://t.co/X4nVF3SmG6",http://pbs.twimg.com/media/EtQYQX1XYAIEYjt.jpg,NA,NA,NA,NA,NA,NA,immig,immigrant,immigration,immigrant,NA,NA
1356742721168314368g,GOOD NEWS❗️The Polynesian Cultural Center reopened. LIMITED Shows &amp; attractions. Is it worth the visit❓All you need to know here https://t.co/xAfx9nDlkT #polynesianculturalcenter #covid19 #reopen #hawaii #oahu https://t.co/uDodNB6s1u,http://pbs.twimg.com/media/EtQeT82VoAAyGMR.jpg,NA,NA,NA,NA,NA,NA,polynesian,asian,NA,NA,NA,NA
1356742876042956800g,"@CANAL44TV @yoCelia @julio_rios @pablotoledo1981 @viogu YA NO TENGAS MÁS MIEDO SR PRESIDENTE DE MÉXICO, YA NO REGALES EL DINERO DE LOS MEXICANOS EN LA ETERNAMENTE QUEBRADA EN BANCARROTA DETERIORADA DESPRESTIGIADA Y BUSCADA HASTA RICARDO SALINAS PLIEGO, SU ATLAS, SU ELEKTRA Y SU TV AZTECA, NI DESPILFARRES EN PLENA PANDEMIA EL $$$DE LOS https://t.co/yrPs89aF0U",http://pbs.twimg.com/media/EtQebhAVoAI5Us5.jpg,NA,NA,NA,NA,NA,NA,mex,hispanic,mexican,hispanic,mexicanos,hispanic
1356743355569332224g,"The race, equity, and belonging town hall has been postponed. Hopefully it is rescheduled for a date during black history month. https://t.co/aY4kONE1Jl",http://pbs.twimg.com/media/EtQe4rEU4AMcTEV.jpg,NA,NA,NA,NA,NA,NA,black history,black,NA,NA,NA,NA
1356746897868943363g,Mostly cloudy and cooler. Precipitation likely. Windy with possible wind shift to the W NW or N. https://t.co/oWO9EQFaRj Apache Junction #AZ #forecast 16:30 https://t.co/p2l96UOXAL,http://pbs.twimg.com/media/EtQiHTVXAAAHOyg.jpg,NA,NA,NA,NA,NA,NA,apache,native american,NA,NA,NA,NA
1356757132847308801g,CULTURALISTIC - the act of being engulfed in your Heritage and the love of who you are. #BlackHistory #BlackLove #blackexcellence #Blackculture #culturalistic #blackpride https://t.co/SdKrzugznb,http://pbs.twimg.com/media/EtQra0-WgAE1V4Q.jpg,NA,NA,NA,NA,NA,NA,blackexcellence,black,blacklove,black,blackpride,black
1356762903572058112g,"Kobe Japanese Steakhouse - Brandon, Florida - My girlfriend and I both got sick from the fillet last night, I didn't even make it home without vomiting i... Food Poisoning https://t.co/aQXN1rlkxM https://t.co/OxWNDnwXaX",http://pbs.twimg.com/media/EtQwqtGXAAE0MeK.jpg,NA,NA,NA,NA,NA,NA,jap,asian,japanese,asian,NA,NA
1356764839482253315g,@ the fat nigga https://t.co/T7QpCNRrbc,http://pbs.twimg.com/media/EtQybmNUUAYZWMM.jpg,NA,NA,NA,NA,NA,NA,nigga,black,NA,NA,NA,NA
1356768694840397825g,Every time I see this nigga I think it’s RMC mike 😩😂 https://t.co/58jI5gLtoJ,http://pbs.twimg.com/media/EtQ177BUcAAL1Mh.jpg,NA,NA,NA,NA,NA,NA,nigga,black,NA,NA,NA,NA
1356773059621961728g,@LeoRautins @Matt__Devlin group B in women is the group of death. Nigeria might create the surprise. Group C in the men's is a tough group too. Grouo A depends on so many things one of which is professional and NBA players participation. https://t.co/eFpjzfFeJQ,http://pbs.twimg.com/media/EtQ55-kXYAErnBh.jpg,NA,NA,NA,NA,NA,NA,nigeria,black,NA,NA,NA,NA
1356778053242916866g,"Have you dealt with racism in Orange County, New York? Please join me for a conversation w/ local leaders and our neighbors sharing their stories. We need you &amp; your voice. #PeoplePower ✊🏾 https://t.co/3bkDnXtTaP #OrangeCounty #NewYork #BlackLivesMatter @nextstephv https://t.co/KGoNIXAwrW",http://pbs.twimg.com/media/EtQ-cpUXIAEJpvf.jpg,NA,NA,NA,NA,NA,NA,#blacklivesmatter,black,blacklivesmatter,black,racism,minority
1356782935156924419g,"The Bible said dat we should war against (the prince of the air) - Belial -satan perverted homo sexual male &amp; female filty -spirits of legions, and all sexual immoral acts spring from the filtiness of The devil and perversion -Belial ! https://t.co/kXxgHb4FKf",http://pbs.twimg.com/media/EtRC3GfXAAIoOpa.jpg,bi,bisexual,homo,lgbtq+,NA,NA,NA,NA,NA,NA,NA,NA
1356800671278850050g,Today we begin a celebration of Black Excellence. There is importance in educating ourselves on our present because it will soon become our past. #BLM #NoJusticeNopeace #KamalaHarris #21stCentury #EducateYourself #ThereIsPowerInUnity https://t.co/A5bg3Bxvb8,http://pbs.twimg.com/media/EtRTAVvXUAE1o3i.jpg,NA,NA,NA,NA,NA,NA,blm,black,NA,NA,NA,NA
1356801981067776003g,Seeking participants for a study on queer graduate students of color https://t.co/78fBqhyUWC,http://pbs.twimg.com/media/EtRUNeUXUAANe7T.jpg,queer,lgbtq+,NA,NA,NA,NA,NA,NA,NA,NA,NA,NA
1356809646514790400g,@JakeLobin Ikr the America hating democrat party mob love them some kkk. They are obsessed by it. https://t.co/qh9bHWtOn0,http://pbs.twimg.com/media/EtRbLoKWgAE7o-q.jpg,bi,bisexual,NA,NA,NA,NA,kkk,white,NA,NA,NA,NA
1356827032563445761g,"Prudential's Chief Marketing Officer Susan Johnson and Chief Medical Officer Dr. Sharon Smith were named to the Diversity Woman Magazine 2021 ""Elite 100"" Listing of Black Women Leaders. #Elite100BlackWomen Read More ➡ https://t.co/065hyv5wC7 https://t.co/MSEwwWxQfO",http://pbs.twimg.com/media/EtRq_qNXAAAVU2G.jpg,NA,NA,NA,NA,NA,NA,black women,black,blackwomen,black,NA,NA
1356857122072506376g,"Excellent, as usual, from @JimTrotter_NFL. Of last 27 head-coach hires only 3 have been Black men. Yet 70% of NFL players are Black men. This quote from Jimmy Raye, whom I covered when he was Raiders OC, nails it. “They hire who they want to hire, qualifications be damned.” https://t.co/HHfjVLnfRm",http://pbs.twimg.com/media/EtSGW-1U4AUSuJS.jpg,NA,NA,NA,NA,NA,NA,black men,black,NA,NA,NA,NA
1356866212739784709g,"@perlmutations Just to be clear, I mean an honorary Jew/Member of the Tribe. Not those mshuge fakakta QAnon schmucks. https://t.co/XJG2fDmrTW",http://pbs.twimg.com/media/EtSOoTlVkAUFLnK.jpg,NA,NA,NA,NA,NA,NA,jew,jewish,NA,NA,NA,NA
1356913624304869378g,"Dr. O’Neal is a business mogul, NBA analyst, brand ambassador, author, creative and father. Celebrating black history 24/8 #BHM #blackhistorymonth #blackhistory @nbaontnt @SHAQ @shaqfu_radio @NBA @NBATV @PapaJohns @TheGeneralAuto @frosted_flakes #Shaq @shaqtin @LSUBasketball https://t.co/dqG96SPBxO",http://pbs.twimg.com/media/EtS5v6BVgAQORs4.jpg,NA,NA,NA,NA,NA,NA,black history,black,NA,NA,NA,NA
1356937630731145216g,C'mon #FoxAndFriends #Keystone XL only cost 1000 jobs mostly in Canada Many jobs in construction &amp; fabrication of new #renewables plants🌞💦 not just installing panels🤓 Trans Canada &amp; others operators have plenty of jobs too with 80000 km of pipelines #NetZero Coal 🚫 https://t.co/aua7iDiAeK,http://pbs.twimg.com/media/EtTPk0bXcAAT-zR.jpg,trans,transgender,NA,NA,NA,NA,NA,NA,NA,NA,NA,NA
1356952612374007808g,Incredibly excited about our abstract acceptance at the 2021 Pan Arab Interventional Radiology Society meeting @pairsmedia #PAIRS2021 🙂There’s few greater gifts to a trainee than supportive mentorship. Thank you @saherssabri @PortalVeiniac ! @Georgetown_IR @GeorgetownRad https://t.co/IiZ6GFEOti,http://pbs.twimg.com/media/EtTdNXwXIAIPm2x.jpg,NA,NA,NA,NA,NA,NA,arab,middle eastern,NA,NA,NA,NA
