batch,image,text
batch_23,https://raw.githubusercontent.com/heranmane/label_studio_images/main/10k_batches/batch_23/183267-5758665937496832.png,"Special today! 🚨 $9.99 for a Burrito , 2 Tacos, Chips and a Drink!! 🤩 (408) 943-8226 ☎️ #wednesday #wednesdayvibes #wonderfulwednesday #combo #burrito #taco #UnaMascombo #discount #unamasmexican #mexican #mexicanfood #bestmexicanfoodintown #mexicanfoodinsanjose"
batch_23,https://raw.githubusercontent.com/heranmane/label_studio_images/main/10k_batches/batch_23/184940-5065890636833430.png,"➡ LINK: https://us02web.zoom.us/webinar/register/WN_rLCGeIQRQG6uCoVQTjnMqQ 29 Mar., “Distortion and Negation of the Shoah in Latin America / Distorsión y negación de la Shoah en América Latina” Convener: Dr. Pedro Gonzalez, Universidad of Texas Dallas Date: Tuesday, March 29th, 2022 Time: 11:00 AM Eastern Time Join ISGAP’s seminar series in Spanish (featuring simultaneous English translation) #Antisemitism #AcademiaAnsweringAntisemitism #AckermanCentreforHolocaustStudies #ISGAP #Holocaust #Education #Webinar"
batch_23,https://raw.githubusercontent.com/heranmane/label_studio_images/main/10k_batches/batch_23/186148-1027944104502017.png,"#Trivia Tuesday ❓❓ Slinky, the dog from Toy Story, is based on what breed? Dachshund What was the name of the adorable pug, from the Men In Black film franchise? Frank #RWCarolinas #ShopSmall #ShopLocal #PetStore #RockHillSC #DogBitesMunchery #DogStore #TriviaTuesday"
batch_23,https://raw.githubusercontent.com/heranmane/label_studio_images/main/10k_batches/batch_23/186503-5227658967325321.png,813 Lindsey Lane TYLER TX 75702 ☎️ 903 6302071 8pm -5pm
batch_23,https://raw.githubusercontent.com/heranmane/label_studio_images/main/10k_batches/batch_23/189478-3027099397540609.png,"Chai Spices Blend An absolutely perfect full flavor chai blend with no sugar. This blend is irresistible. Keto Approved, Diabetic Friendly, and Paleo. The word ""chai"" means ""tea"". How to prepare: Boil spice blend in milk (of your choice) and water, add tea bags and steep, strain out spices and tea and add your desired sweetener. Order now: https://www.cardnl.com/products/chai-blend"
batch_23,https://raw.githubusercontent.com/heranmane/label_studio_images/main/10k_batches/batch_23/189719-5217931904893378.png,Shop today with us! ☺️ #platosclosetmaconga #gentlyused #shopwithus #webuyyousell #hurryin #welovefashion
batch_23,https://raw.githubusercontent.com/heranmane/label_studio_images/main/10k_batches/batch_23/190816-5043580525662609.png,"Learn more at www.DOVESProgram.com/for-stalking:=:https://www.dovesprogram.com/for-stalking #NSAM2022 (Two images. First image shows an Indigenous woman. It reads: American Indian/Alaska Native and Multiracial (non-Hispanic) women experience the highest rates of stalking victimization. Second image reads: Women's stalking victimization by race/ethnicity. There's a chart showing rates of victimization: Asian/Pacific Islander (non-Hispanic) 8%, Hispanic 15%, Black 16%, White 16%, Multiracial 26%, American Indian/Alaska Native 28%.)"
batch_23,https://raw.githubusercontent.com/heranmane/label_studio_images/main/10k_batches/batch_23/19317-7918914391484529.png,BamaPrincess
batch_23,https://raw.githubusercontent.com/heranmane/label_studio_images/main/10k_batches/batch_23/193588-5207599409271392.png,"1) Continue the evacuation: the Biden admin must create a humanitarian corridor to evacuate all SIV applicants, citizens and lawful permanent residents of the U.S., Afghan allies of the U.S., and at-risk members of civil society to safety. 2) Pass the Afghan Adjustment Act: Unlike refugee status or Special Immigrant Visas, humanitarian parole only temporarily allows people fleeing violence to remain in the U.S. This means that they’ll have to find another pathway to safety once their parole expires. . . . #evacuateourallies #Advocate4Afghans #wewelcomerefugees"
batch_23,https://raw.githubusercontent.com/heranmane/label_studio_images/main/10k_batches/batch_23/194283-10158374461320919.png,"Cardiovascular disease is the leading cause of death in the US, resulting in one in every four male deaths each year. This #MensHealthMonth, set up an appointment with your White-Wilson primary care provider to discuss your health and your risk for developing heart disease. To schedule, visit white-wilson.com/schedule_appointment:=:https://white-wilson.com/schedule_appointment.html today!"
batch_23,https://raw.githubusercontent.com/heranmane/label_studio_images/main/10k_batches/batch_23/194410-10158193223691739.png,Will we see you there? 😄
batch_23,https://raw.githubusercontent.com/heranmane/label_studio_images/main/10k_batches/batch_23/195138-5154937484560600.png,"#BIPOC July is BIPOC Mental Health Month! MHANJ is celebrating the rich history and culture of the BIPOC community both within our organization and statewide. Join us for BIPOC- Messages of Hope & Celebration on 7/31 in West Orange, NJ. A free event sponsored by MHANJ, Pleasant Valley Productions, OSPAC & Creative Arts."
batch_23,https://raw.githubusercontent.com/heranmane/label_studio_images/main/10k_batches/batch_23/195474-4951606134935684.png,"Here's a look at the top wind gusts that we had yesterday. As you can probably hear, the winds have not gone anywhere and similar gusts to these will be seen again today. There will also be some off and on rain and snow showers; more on what to expect now on News 4 Today."
batch_23,https://raw.githubusercontent.com/heranmane/label_studio_images/main/10k_batches/batch_23/195681-5373844869303237.png,"The debut episode of Our Jewish Roots airs tonight at 7:30 pm ET/ 6:30 pm CT! ​ We invite you to tune in weekly for Bible teaching with an emphasis on Israel, prophecy and the Jewish roots of the Christian faith, made possible by Zola Levitt Ministries. Our Jewish Roots"
batch_23,https://raw.githubusercontent.com/heranmane/label_studio_images/main/10k_batches/batch_23/196328-10166295862475587.png,"Countdown to the #bestsundayinjune! Looking forward to seeing you at the 26th Boulder Jewish Festival this Sunday, June 12, from 11 am - 5 pm. A full day of music, food, art, activities, and connection for the entire family! Kick off the festivities with a Jeff and Paige concert at 11 am on the Courthouse Lawn. boulderjcc.org/boulderjewishfestival:=:https://www.boulderjcc.org/index.php?submenu=BoulderJewishFestival2022&src=events&hurl=n&srctype=lister&mrkrs=Boulder+Jewish+Festival+2022&introID=BoulderJewishFestival2022"
batch_23,https://raw.githubusercontent.com/heranmane/label_studio_images/main/10k_batches/batch_23/197810-7282732071767823.png,"Redneck Comedy Bus Tour Branson, Mo is SOLD OUT or NO LONGER AVAILABLE for today @ 1:00 PM! This is one of the best productions in Branson, so hurry & grab your tickets today! Call 1-800-987-6298 or visit https://www.bransonshows.com/activity/RedneckComedyBusTourBransonMo.cfm"
batch_23,https://raw.githubusercontent.com/heranmane/label_studio_images/main/10k_batches/batch_23/197927-10159751114147317.png,"In honor of our 29th Bunny & Leo Horvitz Scholar-In-Residence Series beginning this Thursday, let's throwback to the first ever event in 1989! Do you remember any particular programs through the years?"
batch_23,https://raw.githubusercontent.com/heranmane/label_studio_images/main/10k_batches/batch_23/198986-5128463760525201.png,"More of the BEST gospel on the internet! The Gospel News with Nina Taylor by Nina Taylor For more great gospel music, tune in to SoulProsper Radio!"
batch_23,https://raw.githubusercontent.com/heranmane/label_studio_images/main/10k_batches/batch_23/199118-8432296523462900.png,Shake off the Monday blues with BOGO burritos all day at Paradiso! https://www.paradiso.com/burrito-monday
batch_23,https://raw.githubusercontent.com/heranmane/label_studio_images/main/10k_batches/batch_23/200270-3224576467831844.png,"Join us on Tuesday, April 26th, 7pm for Minorities and Mental Health – Stress Awareness hosted by Konan from Magic 95.9 and JayCee from 92Q. Watch on Radio One Baltimore’s YouTube Page, Facebook Live and PraiseBaltimore.com! Featured Panelists Include: Terri Griffith, PsyD, Clinical Coordinator, Intensive Outpatient Program The Center for Eating Disorders Sheppard Pratt ———————— Chalarra Sessoms, LCSW-C Chief, Rural Health and School Based Programs Maryland Behavioral Health Administration ———————— Akil Taffe Owner/Operator Conscious Crusade ———————— Presented by Sheppard Pratt NAMI Maryland"
batch_23,https://raw.githubusercontent.com/heranmane/label_studio_images/main/10k_batches/batch_23/202204-10158516457991099.png,A WIND CHILL WARNING is in effect until Noon on Wednesday for the entire listening area. Dangerously cold wind chills expected. Wind chills as low as 40 below zero. For the latest weather information listen on air or visit our website. http://htl.li/GTlG30s8wpz:=:https://www.mystar106.com/alerts/
batch_23,https://raw.githubusercontent.com/heranmane/label_studio_images/main/10k_batches/batch_23/202239-4993152250774213.png,"iHeartMedia is teaming up with Global Citizen for ""Stand Up For Ukraine"" - a campaign that seeks to mobilize billions of dollars to support humanitarian efforts in Ukraine and in neighboring countries. www.ForUkraine.com:=:https://www.globalcitizen.org/en/info/ukraine/"
batch_23,https://raw.githubusercontent.com/heranmane/label_studio_images/main/10k_batches/batch_23/20247-5411338548895865.png,Extravaganzas are right around the corner! 🎉 Be on the look out for more information in the coming weeks and announcements regarding registration. #Guided22 // #SEBQE22 #WBQE22 #SCBQE22 #NEBQE22 #NCBQE22
batch_23,https://raw.githubusercontent.com/heranmane/label_studio_images/main/10k_batches/batch_23/203176-771436432986360.png,Don't shoot the messenger! #foodbabe https://www.facebook.com/thefoodbabe/posts/1112566175444759:0
batch_23,https://raw.githubusercontent.com/heranmane/label_studio_images/main/10k_batches/batch_23/203859-1103568523041034.png,We bet you never heard about her in your school history classes. ;)
batch_23,https://raw.githubusercontent.com/heranmane/label_studio_images/main/10k_batches/batch_23/204322-599288640253260.png,
batch_23,https://raw.githubusercontent.com/heranmane/label_studio_images/main/10k_batches/batch_23/204521-1193392280735588.png,be honest :) #maria
batch_23,https://raw.githubusercontent.com/heranmane/label_studio_images/main/10k_batches/batch_23/205456-1441607845852404.png,
batch_23,https://raw.githubusercontent.com/heranmane/label_studio_images/main/10k_batches/batch_23/205628-1336242036470035.png,
batch_23,https://raw.githubusercontent.com/heranmane/label_studio_images/main/10k_batches/batch_23/205664-409442042773921.png,
batch_23,https://raw.githubusercontent.com/heranmane/label_studio_images/main/10k_batches/batch_23/205732-1249472841817233.png,👏 PLEASE 👏 #RepresentationMatters
batch_23,https://raw.githubusercontent.com/heranmane/label_studio_images/main/10k_batches/batch_23/20664-2388030694678155.png,The Crazy Rich Asians machine is now live! Try it out near the 2nd Floor bar at Poe’s Nest. Gambling problem? Call 1-800-GAMBLER
batch_23,https://raw.githubusercontent.com/heranmane/label_studio_images/main/10k_batches/batch_23/207526-1965063200202622.png,
batch_23,https://raw.githubusercontent.com/heranmane/label_studio_images/main/10k_batches/batch_23/208804-403658460200240.png,Be proud of who you are! 🌈
batch_23,https://raw.githubusercontent.com/heranmane/label_studio_images/main/10k_batches/batch_23/209070-2222397284505026.png,"This also often excluded Disabled/chronically ill queers too! [Image description: ""blitheslife: Why are all queer events on at like 10 at night? Some of us queers can’t stay out that late? Can’t we have a gay afternoon tea? Lesbian lunch? Bisexual breakfast? penguintim: #this is a super important point though too stop having queer events be only late and at bars#you’re excluding underage queer ppl and sober queer ppl and it’s really shitty bigenderbeatnik: Kill the idea that LGBT+ stuff is inherently rated R and therefore must only occur in the dead of night. baabaabelias: Asexual elevenses. Transgender teatime. Help me out here. Questioning coffee date. floki-the-littlest-viking: Pansexual picnics. thatsthat24: What about bisexual second breakfast?""]"
batch_23,https://raw.githubusercontent.com/heranmane/label_studio_images/main/10k_batches/batch_23/211245-1537469293059102.png,"💎💞✨Happy Black Friday✨💞💎 Happy Black Friday Luxury Babes, we are celebrating our NEW “Hair Boutique” with our Rosé Hour ALL DAY and we can’t wait for you to order your pair of Petals Rosé Luxury Lashes & Bundles✨🥂 Our Luxury Lashes can be worn 20-25 times with proper care. Read Our Care Guide for More Details. Happy Slaying✨💞💎 #BlackFriday #BlackFridaySale #HairBoutique"
batch_23,https://raw.githubusercontent.com/heranmane/label_studio_images/main/10k_batches/batch_23/212244-1004546663212112.png,Do you believe in equal rights or special rights?
batch_23,https://raw.githubusercontent.com/heranmane/label_studio_images/main/10k_batches/batch_23/21272-10158986386969611.png,"In the League's 2021 report, Reconnecting to the New Majority, we found secure bike parking was the #1 or #2 action that Black and Hispanic people indicated would make them likely to bike more often ⬆️ It’s time to get more serious about the value of bike parking. Join us at #BikeSummit22 on March 28th at 3:45 to 4:30 pm EST for a virtual breakout session where speakers will present on innovative bike parking solutions and community efforts to provide great bike parking. Want more on demographic trends in bicycling? Click the link in our bio to explore data.bikeleague.org."
batch_23,https://raw.githubusercontent.com/heranmane/label_studio_images/main/10k_batches/batch_23/213875-2767606989926959.png,#NAME?
batch_23,https://raw.githubusercontent.com/heranmane/label_studio_images/main/10k_batches/batch_23/213914-10157391491286144.png,He's 94 years old today.
batch_23,https://raw.githubusercontent.com/heranmane/label_studio_images/main/10k_batches/batch_23/214338-2698053046928489.png,"Same goes for all of you who have had that identity for a while. If you no longer feel that the label fits, you are valid even if you change it. ❤"
batch_23,https://raw.githubusercontent.com/heranmane/label_studio_images/main/10k_batches/batch_23/214436-10151177099309975.png,"NYC Queer Scouts are LGBTQIA+ folks of all ages coming together to break down barriers to outdoor recreation through free, accessible, inclusive nature-based events throughout NYC. Join the Den Meeting today: https://lgbtbrooklyn.org/portfolio/queer-scouts/"
batch_23,https://raw.githubusercontent.com/heranmane/label_studio_images/main/10k_batches/batch_23/215225-2206668429433414.png,Then it magically becomes “hate speech.”
batch_23,https://raw.githubusercontent.com/heranmane/label_studio_images/main/10k_batches/batch_23/215623-1877305659079696.png,"Tomorrow will be the last day to register to get a shirt! If you register after tomorrow, you can still participate, but will not be guaranteed a shirt."
batch_23,https://raw.githubusercontent.com/heranmane/label_studio_images/main/10k_batches/batch_23/216340-2570451809657828.png,"Our Feminism is #Intersectional & #Inclusive. [Image description: Twitter screenshot from Amanda Jetté Knox @MavenOfMayhem Text reads: ""We need to stand up for trans women. Not meekly and politely, but with with power and assertiveness. Not while fretting over what our friends, neighbours, family, coworkers or complete strangers will think if we do, but what will happen to trans women if we don't.] -B"
batch_23,https://raw.githubusercontent.com/heranmane/label_studio_images/main/10k_batches/batch_23/21655-1313222055855686.png,Happy Lunar New Year
batch_23,https://raw.githubusercontent.com/heranmane/label_studio_images/main/10k_batches/batch_23/216926-2679664428779473.png,"DID YOU KNOW...? There's a Voice Therapy Group specializing in vocal feminization at the R.F.P. Speech-Language and Hearing Clinic. *Therapy sessions are FREE! If this is something you are interested in, call the clinic at 218-726-8199."
batch_23,https://raw.githubusercontent.com/heranmane/label_studio_images/main/10k_batches/batch_23/218108-573660626820936.png,True Dat Tho 👊
batch_23,https://raw.githubusercontent.com/heranmane/label_studio_images/main/10k_batches/batch_23/218234-2337570289677411.png,Has #Essence replaced & redefined who sisters are? Did they get our input? Let’s talk about it on #thevickishow at flyNubianqueenTV.com #vickidillard #queenoftalk
batch_23,https://raw.githubusercontent.com/heranmane/label_studio_images/main/10k_batches/batch_23/218361-2803859612992690.png,Super cute dresses 👗 out on the floor right now‼️ Need more business casual styles? We have that 🙋‍♀️ Want a more fun day out on the town look? 👀 Got that too😍 Come shop our Dresses 10am-8pm tonight✨ #cmcolumbia #resalerocks #resalenotretail #dresses #businesscasual #ootd
batch_23,https://raw.githubusercontent.com/heranmane/label_studio_images/main/10k_batches/batch_23/218754-2730211733733771.png,Save the dates for @streetwarsevents in Maryland and New York — Imports vs Domestics Drag Racing and Car Show (low car limbo and 2 step battle) #streetwars #ogs1320
batch_23,https://raw.githubusercontent.com/heranmane/label_studio_images/main/10k_batches/batch_23/21882-374568941338684.png,We are comin' for ya 😎
batch_23,https://raw.githubusercontent.com/heranmane/label_studio_images/main/10k_batches/batch_23/219047-2708747095841339.png,LSU solidified its place in college football history to finish the season No. 1 in the Amway Coaches Poll. http://bit.ly/2tjafrN
batch_23,https://raw.githubusercontent.com/heranmane/label_studio_images/main/10k_batches/batch_23/223286-3556699434452696.png,Music Bingo EVERY THURSDAY 7-9 pm Free to Play
batch_23,https://raw.githubusercontent.com/heranmane/label_studio_images/main/10k_batches/batch_23/224107-1341439776235457.png,Based China?
batch_23,https://raw.githubusercontent.com/heranmane/label_studio_images/main/10k_batches/batch_23/22428-4804934876295956.png,Shabbat Shalom!
batch_23,https://raw.githubusercontent.com/heranmane/label_studio_images/main/10k_batches/batch_23/224995-3358189240948639.png,"Join us April 16-18 for the most exciting and transformative virtual event of the year! Come join they gay community that you’ve always wanted but never found. Connect with new friends that will last a lifetime. Light up your heart in ways you never knew you could. Surround yourself with others who see you for who you are. Make a plan to ensure your life is never the same again. Have the time of your life with like-minded gay guys looking for friends just like you. Experience more Excitement, Bonding and Fun than you have in decades! Tickets are 50% off until March 30, 2021 https://www.gaymanthrivinglive.com/"
batch_23,https://raw.githubusercontent.com/heranmane/label_studio_images/main/10k_batches/batch_23/226341-286588419496915.png,Don’t miss my interview and LP Giobbi's mix of my influences and discography on Femme House Radio on SiriusXM Channel 52 on Diplo’s Revolution TONIGHT at 9pm ET!!! FEMME HOUSE sxmElectro
batch_23,https://raw.githubusercontent.com/heranmane/label_studio_images/main/10k_batches/batch_23/227114-10159856877139523.png,"""I didn't choose to be transgender, I just am!"" #TransgenderDayofVisibility #TDOV #TransInTexas"
batch_23,https://raw.githubusercontent.com/heranmane/label_studio_images/main/10k_batches/batch_23/228129-4047140011973055.png,"""Some succeed because they are destined to, but most succeed because they are determined to."" – Henry Van Dyke #MondayMotivation #LetsDoTheWork"
batch_23,https://raw.githubusercontent.com/heranmane/label_studio_images/main/10k_batches/batch_23/228213-848468035881421.png,WE DID IT! 🎉 This is what happens when we make our voices heard. Let’s continue to fight until all trans youth see justice! 🏳️‍⚧️
batch_23,https://raw.githubusercontent.com/heranmane/label_studio_images/main/10k_batches/batch_23/230624-506841924011916.png,"Don't miss out on this exclusive FREE virtual art lab with Montel Butler at the Black Artist Fair! Vocal Lessons with Montel Butler: Gospel, R&B, and Jazz technique and application. Hear about the voice from a practical standpoint and learn healthy vocal practices. Sunday, May 2nd 2pm-4pm To register, visit www.blackartsdistrict.org/events:=:https://www.blackartsdistrict.org/events"
batch_23,https://raw.githubusercontent.com/heranmane/label_studio_images/main/10k_batches/batch_23/230959-4180660701966169.png,"Tomorrow at Face to Face you'll also have the opportunity to attend ""Building an Intentional Classroom: Trans and Non-Binary Inclusion,"" presented by Theatre Development Fund's Maybe Burke, Actor, Writer, and Human Rights Advocate; Michael Leibenluft, Teaching Artist; and Ginger Meagher, Director of Education. You can register to attend Face to Face at any point during the conference at https://nycaieroundtable.org/face-to-face/conference-schedule-2/.:=:https://nycaieroundtable.org/resources/resource-library/face-to-face-2021-conference-schedule/ #f2f2021 #facetoface2021 #nycaier #radicalartsed #artseducation #artsareessential #artsedequity"
batch_23,https://raw.githubusercontent.com/heranmane/label_studio_images/main/10k_batches/batch_23/233611-4554732687888011.png,Check Out My Show Right Now On BLAZE 1 RADIO Click Here: http://ow.ly/XxDq30qjrAl:=:https://tunein.com/radio/Blaze-1-Radio-s235506/?st=undefined&utm_content=s235506&utm_medium=referral&utm_source=geminiEmbedTitle
batch_23,https://raw.githubusercontent.com/heranmane/label_studio_images/main/10k_batches/batch_23/233821-1972962942855463.png,***UPDATE*** Laura has been located safe. Thank you all for sharing. #TheAWAREFoundation
batch_23,https://raw.githubusercontent.com/heranmane/label_studio_images/main/10k_batches/batch_23/234339-1151999491941444.png,Read the background article for this post at voteinorout.com. Tell other voters what you support or oppose. A well-informed electorate is a prerequisite to Democracy. Thomas Jefferson 🇺🇸 #voteinorout #trump #biden #lgbtq
batch_23,https://raw.githubusercontent.com/heranmane/label_studio_images/main/10k_batches/batch_23/235076-10159024409129340.png,What a difference affirming space makes!
batch_23,https://raw.githubusercontent.com/heranmane/label_studio_images/main/10k_batches/batch_23/236401-4297908773629282.png,"“Man created God in his image: intolerant, sexist, homophobic and violent.” - George Weinberg Get this shirt here: https://bit.ly/2WFUHtZ:=:https://www.amazon.com/dp/B08CZ3JDCM/ref=as_li_ss_tl?customId=B07537H64L&th=1&linkCode=sl1&tag=atheistrepubl-20&linkId=0666050c0537859cb07086d4e1ad270b&language=en_US"
batch_23,https://raw.githubusercontent.com/heranmane/label_studio_images/main/10k_batches/batch_23/237136-10158286097473176.png,"The NH Teen Institute Social Justice Series Summer Reading List will spotlight two YA Novels for you to enjoy! In June join us for Cemetery Boys, a joyful tearjerker that manages to blend love, Latinx culture, and the paranormal all into one. Join us for the discussion Monday, June 28th @ 8pm For August we have I'll Be the One, a story that centers around Skye Shin, an overweight, bisexual, Korean teen who dreams of being a K-Pop dancer and won’t let anyone dash her dreams. Join us for the discussion Monday, August 23rd @ 8pm To read more about each novel check out our Social Justice Series webpage @ www.nhteeninstitute.org/social-justice-series:=:https://www.nhteeninstitute.org/social-justice-series"
batch_23,https://raw.githubusercontent.com/heranmane/label_studio_images/main/10k_batches/batch_23/237332-950579495697608.png,What she said! Shop --------> cblashco.com 💓 - - - - #20mmlashes #minkeyelashvendors #lashboxes #minkeyelashes #wholesaleminklashes #silklashes #minklashstrips #20mmminklashes #25mmlashesvendor #3dminklashes #magneticlashes #minklasheswholesale #18mmlashes #lashsale #eyelashvendor #eyelashvendors #22mmminklashes #25mmminklashes #minklashesvendor #huda #minklashextentions #jaydawayda #lashvendorswholesale #makeupaddict #talkthatmakeup #makeupguru #fiercesociety #makeupmafia #newmakeup #25mmlashes
batch_23,https://raw.githubusercontent.com/heranmane/label_studio_images/main/10k_batches/batch_23/237349-3578803299011378.png,Please share so everyone can have these resources
batch_23,https://raw.githubusercontent.com/heranmane/label_studio_images/main/10k_batches/batch_23/237709-1261773920907089.png,The real political compass ~ AtarianX
batch_23,https://raw.githubusercontent.com/heranmane/label_studio_images/main/10k_batches/batch_23/2384-2225682664262144.png,Doritos Locos Taco Pasta Salad!!! 🥗🌮😋 Our Ultimate Tasty Taco Salad! 💖💛 Yum! Get the Recipe now: https://myincrediblerecipes.com/doritos-locos-taco-pasta-salad/
batch_23,https://raw.githubusercontent.com/heranmane/label_studio_images/main/10k_batches/batch_23/239298-2193319890803652.png,"""Homosexual acts"" can land you three years in prison in Oman. #PRIDE #Pride2021"
batch_23,https://raw.githubusercontent.com/heranmane/label_studio_images/main/10k_batches/batch_23/239886-2630711333900094.png,"To kickstart the first week of #PrideMonth, Rod Griffin, Experian's Senior Director of Public Education and Advocacy, and the Debt Free Guys discussed financial planning for the LGBTQ+ community in a special #CreditChatLive on our experian.us Instagram. If you missed the conversation, head over to our IGTV to watch the full video: https://www.instagram.com/tv/CPtLfkkjWnA/?utm_medium=copy_link:=:https://www.instagram.com/accounts/login/"
