batch,image,text
batch_23,https://raw.githubusercontent.com/heranmane/label_studio_images/main/10k_batches/batch_23/128164-10159235175459900.png,Join us to celebrate Women Who Win in Chicago🔥 Watch live April 28th at 12pm for a virtual celebration of our 2022 Class of Women Who Win! Hit the LINK to submit questions for our panelist and more. ⁠ ⁠ #WomenWhoWin #iheartmediachicago YWCA Metropolitan Chicago Chicago Foundation for Women
batch_23,https://raw.githubusercontent.com/heranmane/label_studio_images/main/10k_batches/batch_23/129008-170745248624092.png,"Starting in 1️⃣ hour! Head over to Busboys and Poets to join me and Mckayla Wilkes for Congress, Nina Turner, Stephany Rose Spaulding, and Christine for Congress! ✅ RSVP: www.blackwomen.run:=:https://www.blackwomen.run/"
batch_23,https://raw.githubusercontent.com/heranmane/label_studio_images/main/10k_batches/batch_23/130428-3206619192887035.png,Join us as The Festival continues this summer! Visit brjff2022.eventive.org/schedule:=:https://brjff2022.eventive.org/schedule for tickets and information.
batch_23,https://raw.githubusercontent.com/heranmane/label_studio_images/main/10k_batches/batch_23/130730-10166250560725711.png,Black Girls Read. Reading Is Queen Spring Shirt. #readthisspring #spring2022
batch_23,https://raw.githubusercontent.com/heranmane/label_studio_images/main/10k_batches/batch_23/131531-3065112123741779.png,Pinky’s BBQ will be set up out back doing table service today from 1:30-6! We’ll be open as normal 12-8pm and reminder to all you Bottle Club 2022 members that it’s 10% off all day! #blackflagbrewingco #mdcraftbeer
batch_23,https://raw.githubusercontent.com/heranmane/label_studio_images/main/10k_batches/batch_23/131625-5261280707262371.png,"To ALL Ministry Leaders, let us not forget about Our Coming Together on This Saturday Morning for Information & Transformation …………! 😀🙏🏽❤️👏🏾🎚🔥"
batch_23,https://raw.githubusercontent.com/heranmane/label_studio_images/main/10k_batches/batch_23/133000-5073452849375059.png,"\m/ THE BAND REPENT has their own beer ""The Beer Repent"" from the tasty, Oil City Beer Company . We can't wait to try it. \m/"
batch_23,https://raw.githubusercontent.com/heranmane/label_studio_images/main/10k_batches/batch_23/133125-4958320530877520.png,Thank you to Homesteaders Life Company and eFuneral for their support of Pi515. We couldn’t do what we do without the generosity of our partners. We are so excited about our upcoming spring and summer programming!
batch_23,https://raw.githubusercontent.com/heranmane/label_studio_images/main/10k_batches/batch_23/133438-5251250828252036.png,"Don't miss this opportunity! The SBDC is offering a Nine Week Entrepreneurial Business Plan Series program beginning Wednesday, March 23rd at Nicolet College. Take a look at the testimonials from past participants and you'll see why we recommend it! bit.ly/ETP-RSP22:=:https://www.uwsp.edu:443/conted/Pages/ETP-Rhinelander.aspx"
batch_23,https://raw.githubusercontent.com/heranmane/label_studio_images/main/10k_batches/batch_23/13489-482611319889699.png,"January 6 8:30 AM - WINTER WEATHER ADVISORY issued for McDonald County (until 10 AM) & Barry County (Until 12 PM) due to this morning's snowfall. Total accumulations near an inch (up to 2"" locally) are expected in SW Missouri this morning."
batch_23,https://raw.githubusercontent.com/heranmane/label_studio_images/main/10k_batches/batch_23/136805-10159451280532247.png,"One of the most influential women in the United States, @MariaTeresa is a tireless advocate for Colombian American political rights and, more broadly, Latino rights. She is the CEO of Voto Latino, an MSNBC contributor, and a World Economic Forum Young Global Leader. In short, Teresa is a voice we count on every day — a voice we need to make sense of a world in a tough spot, and a light for Latinos everywhere. We’re #BetterBecauseOfHer"
batch_23,https://raw.githubusercontent.com/heranmane/label_studio_images/main/10k_batches/batch_23/13718-5082177675151024.png,"It’s time to bust out our May fresh sheet that happens to be “Cinco de Mayo” inspired. Is it seriously already May? 😳🤷🏼‍♀️ #illdrinktothat Everything is available except shrimp this evening, so if you don’t feel like cooking tonight…or any other night this month actually {this is your sign} #freshsheet #cincodemayo #sogood #horchata #tacostacostacos #yummmm #getinmybelly #localpub #gastropub #portangeles #pawa #olympicpeninsula #olympicnationalpark"
batch_23,https://raw.githubusercontent.com/heranmane/label_studio_images/main/10k_batches/batch_23/137485-7437215242970182.png,"The northeast half of Iowa is expected to pick up some light snow early Sunday morning. Central Iowa totals will likely be less than 1""."
batch_23,https://raw.githubusercontent.com/heranmane/label_studio_images/main/10k_batches/batch_23/138417-10158139073077373.png,"May is Asian American and Pacific Islander Heritage Month as declared by the United State Congress in 1992. Asian Americans and Pacific Islanders (AAPI) are an important part of American culture encompassing a wide range of diversity with connections to Chinese, Indian, Japanese, Filipino, Vietnamese, Korean, Hawaiian and other ancestries."
batch_23,https://raw.githubusercontent.com/heranmane/label_studio_images/main/10k_batches/batch_23/138649-3275487782597853.png,"This historic church, dating back to 1874, has been transformed into a modern, spacious event venue. Abounding natural light, exposed beams, and an upper level mezzanine make us one of the most sought-after venues in all of Nashville. Photo: John Myers Photography & Videography"
batch_23,https://raw.githubusercontent.com/heranmane/label_studio_images/main/10k_batches/batch_23/139525-4916409478395168.png,It's #HarlemRestaurantWeek and we're thrilled that our exhibition African/American: #MakingtheNationsTable is listed as an exciting experience to pair with local neighborhood restaurants. Head over to Harlem Restaurant Week (https://www.harlemrestaurantweek.com/) to learn more about pairing restaurants with experiences for a chance to win a gift card! And here's some suggested restaurant pairings near our exhibition at The Africa Center. #harlemrestaurantweek #shoplocal #localbusinesses
batch_23,https://raw.githubusercontent.com/heranmane/label_studio_images/main/10k_batches/batch_23/144499-10159846966413945.png,"Today, we commemorate the liberation of the Auschwitz concentration camp and honor the 6 million lives lost in the Holocaust. This is also a day to remember the survivors, including 15-year-old Rachel Genuth. Rachel had endured the horror of Auschwitz, and in the final years of World War II was moved to Bergen-Belsen. As Rachel continued to fight for her life, unknowingly by her side was Brigadier H. L. Glyn Hughes. Hughes commitment to helping as many prisoners as possible is what saved Rachel's life. Rachel went on to be the mother of Bernice Lerner, author of ""All the Horrors of War."" Lerner's book is the first book to pair the story of a Holocaust victim with that of a liberator. Find out more here: http://ow.ly/YMi450HkwHF:=:https://jhupbooks.press.jhu.edu/title/all-horrors-war"
batch_23,https://raw.githubusercontent.com/heranmane/label_studio_images/main/10k_batches/batch_23/145390-6941700182571196.png,"Only one in three black people in America who need mental health services receives it. Barriers to quality care include: Stigma associated with mental illness Distrust of the health care sector Lack of providers from diverse backgrounds Lack of insurance, underinsurance Learn more at: http://ow.ly/3yQf50HXTG5:=:https://www.heart.org/en/about-us/office-of-health-equity/black-history-month-2022 #HeartMonth #HeartHealthAwareness #MentalHealthAwareness"
batch_23,https://raw.githubusercontent.com/heranmane/label_studio_images/main/10k_batches/batch_23/145665-3143298085949436.png,"CIOGC Interfaith Committee is co-hosting an event with the Evangelical Church to build better understanding between our two faiths on Thursday, January 20th at Willow Creek South Barrington, 67 Algonquin Road, South Barrington, IL 60010. The event takes place from 6:30 p.m. to 8:30 p.m. RSVP is required - please register on the link below. https://oneamericamovement.org/event/the-mustard-seed-project-dinner/"
batch_23,https://raw.githubusercontent.com/heranmane/label_studio_images/main/10k_batches/batch_23/146173-4567409903362701.png,"SUNDAY SCHOOL LESSON June 25, 2022 The Service of Godly Leaders Lesson Text: Ezra 6:13-22 http://www.firstg.org/?p=6446&pdf=6446"
batch_23,https://raw.githubusercontent.com/heranmane/label_studio_images/main/10k_batches/batch_23/147273-924413861585268.png,April is #MinorityHealthMonth! Join PLG in educating ourselves about minority health and what plagues the minority community. Stay educated West Tennessee! #positivelivinggroup #plgjksn #jksn #jacksontn #westtn #stayeducated #health #selfcare #loveyourself
batch_23,https://raw.githubusercontent.com/heranmane/label_studio_images/main/10k_batches/batch_23/148355-476430724048557.png,Looking for local artists!!
batch_23,https://raw.githubusercontent.com/heranmane/label_studio_images/main/10k_batches/batch_23/149692-10158283754761078.png,ASRM member and veteran Dr. Alicia Christy created this artwork in celebration of Black History Month and honoring Black Women Veterans.
batch_23,https://raw.githubusercontent.com/heranmane/label_studio_images/main/10k_batches/batch_23/15117-2529371793865911.png,Alec Forrester – Eagle Valley High School – Class of 2022
batch_23,https://raw.githubusercontent.com/heranmane/label_studio_images/main/10k_batches/batch_23/151252-1828985967300508.png,See Fuego hot sauce
batch_23,https://raw.githubusercontent.com/heranmane/label_studio_images/main/10k_batches/batch_23/151912-4962564543781382.png,Happy World Health Day. Take this opportunity to educate yourself on health issues and crises happening around the world currently and look into ways you can help. You could volunteer with a local health organization or at a hospital or donate to medical research or funds that help make healthcare accessible to those who can't afford it. #WorldHealthDay #HispanicHealthCouncil #CT
batch_23,https://raw.githubusercontent.com/heranmane/label_studio_images/main/10k_batches/batch_23/152082-7518542364838368.png,"January is National Slavery and Human Trafficking Prevention Month in the United States (previously referred to as National Human Trafficking Awareness Month). The Defense Department defines human trafficking as a crime in which force, fraud or coercion is used to compel a person to perform labor, services or commercial sex. In 2019, Polaris, who runs the National Human Trafficking Hotline, identified 22,326 victims and survivors along with 4,384 traffickers in the US. • Learn more: https://polarisproject.org/wp-content/uploads/2019/09/Polaris-2019-US-National-Human-Trafficking-Hotline-Data-Report.pdf • #JLBetterTogether #JuniorLeague #jlm #jlmonroe"
batch_23,https://raw.githubusercontent.com/heranmane/label_studio_images/main/10k_batches/batch_23/15305-324498496391343.png,"Our #BlackIcon that we are highlighting today is Sharon Pratt Kelly 💫 She was the first Black woman to be become mayor of a major city, Washington, DC! #BuildBlackPoliticalPower #BlackHistoryMonth"
batch_23,https://raw.githubusercontent.com/heranmane/label_studio_images/main/10k_batches/batch_23/153523-10158617666652083.png,"Day 2 of our Groundhogs Day Cellar Raid is here! And TODAY ONLY, we are offering our January COM for $89! Head to shop.bin604.com to grab yours today!!⁠ #groundhogsday #sale #cellarraid #bin604baltimore #winesofbin604 #wine #bin604 #orderonline #delivery #curbsidepickup #mybmore #charmcity #harboreast #baltimore #shoplocal"
batch_23,https://raw.githubusercontent.com/heranmane/label_studio_images/main/10k_batches/batch_23/153559-10159209137535939.png,Check out the temple website for further information: https://www.tsinai.org/ or contact the temple office: 585-381-6890
batch_23,https://raw.githubusercontent.com/heranmane/label_studio_images/main/10k_batches/batch_23/154050-5163773707009363.png,"MW Restaurant congratulates the class of 2022 with their special graduation menu - check it out! Order online by emailing info@mwrestaurant.com. Plus, they deliver! • • • #diningouthawaii #hawaiifoodie #foodie #yum #supportlocal #hawaiifood #hawaiirestaurants #hawaiibusinesses #supportlocalbusinesses"
batch_23,https://raw.githubusercontent.com/heranmane/label_studio_images/main/10k_batches/batch_23/155099-3147491568800153.png,We look forward to seeing you this weekend at the Parade of Homes! Visit us at homes #21 and #38.
batch_23,https://raw.githubusercontent.com/heranmane/label_studio_images/main/10k_batches/batch_23/155963-7755156294510475.png,K-pop idols take brunt of anti-Chinese sentiment #Ningning #aespa #kpop #kdrama #kmovie #korean #koreanamerican #love #kpopdance #kpopnews #katchup #katchupofficial #케이팝 #케치업 #케치업오피셜 #닝닝 #에스파
batch_23,https://raw.githubusercontent.com/heranmane/label_studio_images/main/10k_batches/batch_23/156492-7738475686193130.png,"Round Two! You don’t want to miss out on these awesome #APAHM22 events hosted by our members! #OurAANHPIStories #AANHPIHM Learn more on our calendar: ncapaonline.org/calendar:=:https://www.ncapaonline.org/calendar/ . . . [Image Description 1: A list of events for the second week of May. Text reads: National Asian American Pacific Islander Mental Health Day, AREAA Policy Conference, AAPI Women in Labor, Forging New Paths for Safety and Power. Visit ncapaonline.org/calendar:=:https://www.ncapaonline.org/calendar/ for a full list of events.] [Image Description 2: A list of events for the second week of May. Text reads: 2022 Asian American and Pacific Islander Heritage Month Celebration, CAAM Fest 2022, Round Table Talks LGBTQIA+ FILIPINX Viewpoints. Visit ncapaonline.org/calendar:=:https://www.ncapaonline.org/calendar/ for a full list of events.]"
batch_23,https://raw.githubusercontent.com/heranmane/label_studio_images/main/10k_batches/batch_23/156844-5333641893367173.png,As Shabbat approaches - we pray for peace.
batch_23,https://raw.githubusercontent.com/heranmane/label_studio_images/main/10k_batches/batch_23/157850-7312239905467600.png,"I’m super excited to have the opportunity to be working alongside with these two amazing actresses this year for season 5 of The Chi on Showtime]. Admittedly, I haven’t had the opportunity and pleasure to work with @niajervier yet, but working with Carolyn Michelle Smith] has been really dope so far. She’s a VERY talented actress, and I know you guys are going to love her when her character eventually debuts on the show. Carolyn Michelle Smith] plays the role of “Deja” who is Shaad’s new love interest for this upcoming season. I gotta say, the work that we’ve doing together so far is really solid, and I look forward to you guys being able to see how her character makes Shaad step his game up in more ways than one. So, be on the lookout for these two beautiful ladies for upcoming S5 of The Chi on Showtime]! 😊👍🏾 #TheChi #Season5 #ComingSoon #WindyCityWednesday #ActorGang #Rp via @hillmangradproductions"
batch_23,https://raw.githubusercontent.com/heranmane/label_studio_images/main/10k_batches/batch_23/158669-1018430212219627.png,"“And the Lord God formed man of the dust of the ground, and breathed into his nostrils the breath of life; and man became a living soul.” Genesis 2:7 KJVA For more information visit: Israelunite•org #Blacks #Hispanics #NativeAmericans #TwelveTribes #IUIC #Repent #KeepTheCommandments #Prophets #Truth #Laws #IUICBahamas #Israelites #BibleVisuals #IUICTV"
batch_23,https://raw.githubusercontent.com/heranmane/label_studio_images/main/10k_batches/batch_23/159689-5283936748329888.png,This offer is for VHCC members only. Not a member yet? Visit our website and learn more about how to become a member of our chamber. https://www.volusiachamber.org/membership
batch_23,https://raw.githubusercontent.com/heranmane/label_studio_images/main/10k_batches/batch_23/16089-5292601294100470.png,"NWBA coach, boxer and friend, Ryan Dew, will be back in action at Way of the Warrior 4! Ryan returned to the ring last August for the first time in 15 years, to take on a young lion in Matt Umland in the main event in a epic match. We are so proud of our Warrior, Ryan 🐓 Dew for showing that at any age, and no matter how many years you go without boxing, once a fighter, always a fighter. You can show your support for Ryan by purchasing tickets at ⏬️ https://nitrotickets.com/event/425/Way-1of-1the-1Warrior-14 And select Ryan Dew as your boxer. This event wouldnt be possible without these impactful businesses ⏬️ The Arena Sioux City Iowa Army National Guard Recruiting and Retention Sunnybrook Shine Car Wash Stockton Towing Supplement Warehouse - Sioux City, IA Global Martial Arts University Plumbing Pros LLC"
batch_23,https://raw.githubusercontent.com/heranmane/label_studio_images/main/10k_batches/batch_23/161192-5309713365763507.png,"“To be yourself is truly a revolutionary act, and I think more and more people should try it, because it’s gotten me a pretty cool life.”- Lena Waithe #happinessispossible #spiritandtruthsanctuary #pursuingpeace #peaceispossible #peaceisnow #peaceiswithin #peaceismine #peacebychoice #seekpeace #pursuepeace #beatpeace #journey #expansion #shift #highvibration #created #creative #creating #inclusion #radicallyinclusive #christconsciousness #truth #embracethetruth #godisinall #godisall #love #hope #peace"
batch_23,https://raw.githubusercontent.com/heranmane/label_studio_images/main/10k_batches/batch_23/161384-5806196222742979.png,"What You Need to Know... But Won't Hear on the News Reproductive Racism: Margaret Sanger, Eugenicist Founder of Planned Parenthood was a known racist who wanted to exterminate the Black population and others she deemed unfit to live. Sanger, herself, said about her <Negro Project>, ""We do not want word to go out that we want to exterminate the Negro population and the minister is the man who can straighten out the idea, if it ever occurs to any of their more rebellious members."" Sanger's mission was, also, to put Black doctors and nurses in charge of birth control clinics to reduce any mistrust of a racist health care system... and to gain the trust of the Black community. It seems her project is working... because more Black babies are aborted than any other race? Ask yourself... Why?... What's, Really, Going On? FYI: Eugenics is the theory that society can be improved through planned breeding. It goes, even, deeper than racism, because the philosophy espouses it has ""THE RIGHT"" to determine who should live, who should reproduce... and who should die. Information You Should Know #BlackLove"
batch_23,https://raw.githubusercontent.com/heranmane/label_studio_images/main/10k_batches/batch_23/166984-10166142514405244.png,Join us in congratulating Orelvys Sanabria (Justcallelvys) of the Coldwell Banker Realty Pinecrest Office on ranking #70 on the Top 100 Southeast list for the NAHREP®️ Top 250 Latino Agents Award list. This award recognizes outstanding Latino real estate agents and teams from around the country! #CBProud
batch_23,https://raw.githubusercontent.com/heranmane/label_studio_images/main/10k_batches/batch_23/170093-340619384766393.png,"Our area is a great place to live, work, and play! Find out more about why, by visiting Bowling Green Works. https://bit.ly/3JnXhdm:=:https://www.bowlinggreenworks.com/"
batch_23,https://raw.githubusercontent.com/heranmane/label_studio_images/main/10k_batches/batch_23/171770-5472111479468398.png,"Sunday, May 15th Levitt Pavilion Arlington will be hosting the Asian Heritage Celebration! Festivities start at 4:00 p.m. 🙂"
batch_23,https://raw.githubusercontent.com/heranmane/label_studio_images/main/10k_batches/batch_23/171987-403900964875353.png,Great opportunity for college students! Share and APPLY!
batch_23,https://raw.githubusercontent.com/heranmane/label_studio_images/main/10k_batches/batch_23/172763-5120964877934117.png,Here's a look at the weather as we head into your Thursday. Full forecast available anytime at https://iowawx.com/forecast
batch_23,https://raw.githubusercontent.com/heranmane/label_studio_images/main/10k_batches/batch_23/172918-2983140645309741.png,Svan the QR code to visit our website
batch_23,https://raw.githubusercontent.com/heranmane/label_studio_images/main/10k_batches/batch_23/177240-3195374274046938.png,Active-Revolutionist - https://bit.ly/3lVNkux:=:http://thearkprojectllc.com/2022/05/28/active-revolutionist/
batch_23,https://raw.githubusercontent.com/heranmane/label_studio_images/main/10k_batches/batch_23/177273-3189012738016425.png,"Prophets & Messengers - https://bit.ly/3sSSknt:=:http://thearkprojectllc.com/2022/05/21/prophets-messengers/ As salaamu alaikum wa rahmatullilah wa barakartu, The real problem is that, you have a system that's been me for centuries that's targeted a specific race of people in specific locations. In order to constantly and continuously oppress (poor health care, schools, jobs, no economic system, etc.,) So, for that whole targeted race, everything is set up for them to fail. However, to survive, is that much harder. ""Whosoever of you sees an evil action, let him change it with his hand; and if he is not able to do so, then with his tongue; and if he is not able to do so, then with his heart—and that is the weakest of faith."" #therealblackvoice Share The Movement! gofundus (Please), Then Watch What Happens. https://bit.ly/3KPo1VI:=:http://thearkprojectllc.com/ https://bit.ly/3FWeuud:=:https://search.google.com/local/posts?q=The+Ark+Project+LLC&ludocid=4840125771864047548&lpsid=CIHM0ogKEICAgID23ujZeA&source=sh%2Fx%2Flocalposts&lsig=AB86z5WYNfpXyoaYdPYVaWYTPqpK"
batch_23,https://raw.githubusercontent.com/heranmane/label_studio_images/main/10k_batches/batch_23/177690-1434117650339043.png,"📖 “For such are • F A L S E • apostles, deceitful workers, transforming themselves into the apostles of Christ.” – 2 Corinthians 11:13 (KJV) : : #BabylonIsFalling! 🙌🏽"
batch_23,https://raw.githubusercontent.com/heranmane/label_studio_images/main/10k_batches/batch_23/178629-3329126643974193.png,🎉🎉🎉It’s that time of year again! Join us for our #reclaimmlk car caravan and parade to celebrate the life and legacy of Dr. King! @blmsacramento @bsba_ca @sacramento_urbanleague @bylp @sacnaacp_youthcouncil @sacblackbiz @pryorconsulting
batch_23,https://raw.githubusercontent.com/heranmane/label_studio_images/main/10k_batches/batch_23/179003-7109180755821423.png,"TONIGHT! Temple Sinai and The Jewish Federation of Sarasota-Manatee are partnering to present Jewish author and comedian, best known for her time on Saturday Night Live, Laraine Newman! This fun evening will include a lively conversation about her new book, May You Live in Interesting Times: A Memoir. People of the Book Saturday, February 19 7:30pm - 9:30pm In the Sanctuary *All Temple Sinai’s current Covid-19 precautions will be in place during this event. All guests participating are required to show proof of vaccination, including their booster shot. To register or for more information, visit our website: https://www.templesinai-sarasota.org/event/people-of-the-book2.html"
batch_23,https://raw.githubusercontent.com/heranmane/label_studio_images/main/10k_batches/batch_23/179067-4742269145878077.png,Happy Hour at its best!!! Stop in for some cocktails and conversations with friends!! @dj_jowel716 begins at 5pm!!! 2-4-1 Drinks and delicious appetizers!!
batch_23,https://raw.githubusercontent.com/heranmane/label_studio_images/main/10k_batches/batch_23/179443-2545574172253298.png,From our friends at Asian/Pacific Islander Domestic Violence Resource Project
batch_23,https://raw.githubusercontent.com/heranmane/label_studio_images/main/10k_batches/batch_23/180578-5572628952761305.png,Three words we strive to hear! Thanks Lydia!
batch_23,https://raw.githubusercontent.com/heranmane/label_studio_images/main/10k_batches/batch_23/180702-508895437520865.png,"NEW Limited Edition BeerSauce Bowling Shirts! . In honor of the first Florida BeerSauce Shop, we're pre-selling embroidered Mid-Century Retro Cuban-Style Guayabera Bowling Shirts! . Order here: https://bit.ly/3Jf1ZLt:=:https://stpetersmo.beersauceshop.com/products/beersauce-retro-cuban-style-bowling-jersey-bln/"
batch_23,https://raw.githubusercontent.com/heranmane/label_studio_images/main/10k_batches/batch_23/182160-707093064043147.png,In these days and times You are getting too old & experienced To let a person ❤️‍🩹stress you out… Go find your happiness Find 👩‍❤️‍👨someone who adds to Your happiness Fuck the rest✌🏿… - Spiritual Wellness and Consulting - ❤️‍🩹💗❤️‍🩹💗❤️‍🩹💗❤️‍🩹💗❤️‍🩹💗❤️‍🩹💗❤️‍🩹 Follow Us ✅IG/Infinit1010 ✅TikTok/1innerghealer ✅Fb/InfiniT10 📲Website: infinitservices.net 💬Dm is for more info on products/services 👑Da Inner’G HealER ❤️‍🩹💗❤️‍🩹💗❤️‍🩹💗❤️‍🩹💗❤️‍🩹💗❤️‍🩹💗❤️‍🩹 ❤️‍🩹💗❤️‍🩹💗❤️‍🩹💗❤️‍🩹💗❤️‍🩹💗❤️‍🩹💗❤️‍🩹
batch_23,https://raw.githubusercontent.com/heranmane/label_studio_images/main/10k_batches/batch_23/182346-4807175142664342.png,Here’s a thought…
