batch,image,text
batch_38,https://raw.githubusercontent.com/heranmane/label_studio_images/main/10k_batches/batch_38/195615-4794412393982335.png,"Okay, hear us out... Nachos > Football. Especially when they're covered in new Bowl & Basket Shredded Cheese! Who's with us? 😊🏈#BowlandBasket #ForLifesRecipe #BigGame https://bit.ly/3g6H6Fn:=:https://shop.shoprite.com/globaldata/banner-pages/own-brands/bowl-and-basket"
batch_38,https://raw.githubusercontent.com/heranmane/label_studio_images/main/10k_batches/batch_38/195616-4752881768093525.png,"Okay, hear us out... Nachos > Football. Especially when they're covered in new Bowl & Basket Shredded Cheese! Who's with us? 😊🏈#BowlandBasket #ForLifesRecipe #BigGame https://bit.ly/3KB8l8U:=:https://shop.shoprite.com/globaldata/banner-pages/own-brands/bowl-and-basket"
batch_38,https://raw.githubusercontent.com/heranmane/label_studio_images/main/10k_batches/batch_38/195617-10158914317262654.png,"As part of our larger network, HCA Healthcare, we are committed to reducing health disparities and advancing health equity. In 2021, we formed the HCA Healthcare Health Equity Council to identify and address health disparities both within and beyond the walls of our hospitals. A critical piece of this strategy is partnering with organizations like March of Dimes to improve maternal health for communities of color. On Thursday, April 21 at 2 p.m. ET, March of Dimes will host the next installation of the Healthy Moms, Strong Babies webinar series. Join a panel of experts as they discuss the relationship between women of color and systemic racism with the healthcare system. Tune in via Facebook Live: https://bit.ly/3uSASB1:=:https://www.facebook.com/events/d41d8cd9/understanding-racism-how-it-impacts-the-health-of-moms-and-babies-in-the-us/928801114459705/ #BlackMaternalHealthWeek #ImproveMoreLives"
batch_38,https://raw.githubusercontent.com/heranmane/label_studio_images/main/10k_batches/batch_38/195619-5064027610341140.png,"Isabella Abbott was a Hawaiian algae expert who completed important research in botany. She taught marine botany at Stanford’s Hopkins Marine station between 1960 and 1982. She was the first female professor as well as the first Asian professor at Stanford. She also was one of the first professors to study and teach Hawaiian ethnobotany. In 1997, she was awarded the Gilbert Morgan Smith medal, which is the most significant award in marine botany, from the National Academy of Sciences. Like and share this post if you learned something today! #mfl #myfirstlab"
batch_38,https://raw.githubusercontent.com/heranmane/label_studio_images/main/10k_batches/batch_38/19562-866318988102743.png,"🤔 Could this be an indication of a red wave happening in 2022? That is, if cheating can be prevented. FULL STORY ➡️ https://fxn.ws/37nnXgV:=:https://www.foxnews.com/politics/kenosha-county-flips-red-democratic-leadership"
batch_38,https://raw.githubusercontent.com/heranmane/label_studio_images/main/10k_batches/batch_38/195620-5058548784222356.png,"Steven Chu was a Chinese American who was the first Asian American to serve as the Secretary of Energy. He was a co-recipient of the Novel Prize for Physics in 1997 and worked for many years to develop renewable technologies at the Lawrence Berkeley National Lab. He completed important research regarding atom interferometry, the study of polymers, and quantum electronics. Like and share this post if you learned something today! #mfl #myfirstlab"
batch_38,https://raw.githubusercontent.com/heranmane/label_studio_images/main/10k_batches/batch_38/195621-10158728052103806.png,"Small business owners, check out these webinars! Register at https://www.virginiasbdc.org/partner-webinars/"
batch_38,https://raw.githubusercontent.com/heranmane/label_studio_images/main/10k_batches/batch_38/195622-4913752555419937.png,"Final performance of “Anna,” a new play about Sundown Towns in Oklahoma at The Studio of the Sooner Theatre is tonight at 8 p.m.! Admission is free, but donations are welcome!"
batch_38,https://raw.githubusercontent.com/heranmane/label_studio_images/main/10k_batches/batch_38/195623-10166341483320707.png,"STUDENT EVENT: ""Remembering El Monte: The Thai Garment Workers' Fight against Slavery and Trafficking"" Thu, May 19, 2022 l 5:00 p.m.–6:30 p.m. PDT 10383 Bunche Hall or via Zoom Register: https://bit.ly/3wAHsfd:=:https://ucla.zoom.us/webinar/register/WN_09-hQcWuRYakRquAdNOVTQ Hear members of the Thai Community Development Center, an anti-human slavery activist and a member of the LA County Board of Supervisors discuss the 1995 fight of Thai garment workers in El Monte against sweatshop labor abuse, human trafficking and immigrant detention. Organized by a team of Bruin undergraduates (including Global Studies majors), as part of the ""Asian American and Pacific Islander Labor Issues"" course (AAS/LS M119) taught by International Institute faculty professor Jennifer Chun. Cosponsored by the Thai Community Development Center. #garmentworkers #humantrafficking #communityorganizing #communitydevelopment UCLA International Institute Academic Programs UCLA Asian American Studies Department UCLA Asian American Studies Center UCLA Labor Center Thai Student Association at UCLA"
batch_38,https://raw.githubusercontent.com/heranmane/label_studio_images/main/10k_batches/batch_38/195624-10166262555790707.png,"UCLA Center for Southeast Asian Studies invites you to an IN PERSON reception & book talk with UCLA's Evyn Lê Espiritu Gandhi Tue, Apr 26, 2022 l 4:00 p.m. PDT Fowler Terrace RSVP below #southeastasia #vietnameserefugees #migration cc: UCLA Department of Asian Languages and Cultures VNLC - Vietnamese Language and Culture VSU Bruins UCLA Asian American Studies Department UCLA Asian American Studies Center UCLA Center for the Study of International Migration UCLA International Institute Academic Programs"
batch_38,https://raw.githubusercontent.com/heranmane/label_studio_images/main/10k_batches/batch_38/195625-10166035829395707.png,"TODAY January 27, 2022 @ 9:30 a.m. PST ""Mr. Blinken's 'Play List'"" with Wali Ahmadi, UC Berkeley ""Afghanistan through Afghan Voices: Society, Literature & the Arts"" Lecture Series UCLA Program on Central Asia Register: https://bit.ly/3rVQ4uf:=:https://ucla.zoom.us/webinar/register/WN_6arz_BRnQROs8vR9wNcUQg Details: https://bit.ly/33RpKJO:=:https://www.international.ucla.edu/asia/centralasia/event/15363 UCLA UCLA Near Eastern Languages & Cultures UCLA Alumni UCLA Center for Middle East Development UCLA Center for Near Eastern Studies UCLA Department of Political Science #foreverwar #WarOnTerror"
batch_38,https://raw.githubusercontent.com/heranmane/label_studio_images/main/10k_batches/batch_38/195626-289047643256940.png,North Korea has reportedly fired what is believed to be a ballistic missile into the Sea of Japan. Biden needs to take North Korea seriously as a threat and needs to resume peace talks.
batch_38,https://raw.githubusercontent.com/heranmane/label_studio_images/main/10k_batches/batch_38/195628-5367613086630166.png,"Black men are just as human as everyone else. They feel a range of emotions, dream of living a good life, and experience ups and downs — yet, they’re not always supported in expressing their feelings. Because society enforces the idea that men must neglect their emotional and mental well-being to be considered “manly,” many Black men suffer in silence. Or worse, with Black men being four times more likely to commit suicide than Black women, they die without receiving the care they deserve. “What ends up happening for most Black males is that we start to internalize that pain,” says Brandon Jones, a psychotherapist who specializes in intergenerational trauma and adverse childhood experiences. #TheAtlantaVoice #MentalHealth #BlackMentalHealthMatters"
batch_38,https://raw.githubusercontent.com/heranmane/label_studio_images/main/10k_batches/batch_38/195629-5328685403856268.png,"The Atlanta Braves and 7G Foundation will host the first ever Native American All-Star Baseball Showcase at Truist Park, July 16-17, 2022. The top 50 high school baseball players of Native American descent from around the country will participate in a pro-style workout on Saturday, July 16 and a showcase game on Sunday, July 17. The Native American All-Star Baseball Showcase will highlight Native American high school baseball players who aspire to play the game at the next level. Scouts from the Atlanta Braves, University of Tennessee, Georgia State University, Savannah State University, South Georgia State College, Mercer University, and Emory University will be in attendance. #TheAtlantaVoice #AtlantaBraves #TruistPark"
batch_38,https://raw.githubusercontent.com/heranmane/label_studio_images/main/10k_batches/batch_38/19563-2203327266490037.png,"PROUD MEMBER HIGHLIGHT! We are excited to feature our extraordinary member Jane Velez-Mitchell this week. She is a friend, a board member of Rowdy Girl, and my sister from another mother!! Learn more about Jane's fantastic work and how she makes a difference for animals worldwide. JANE’S WHY ""I'm a member of the Rowdy Girl Sanctuary because it provides the roadmap to saving the planet from climate apocalypse! I am a pro-farmer and know many of them hate modern-day animal agriculture's cruel and destructive system and want to work the land without killing! There is a better way, and Renee and Tommy Sonnen's sanctuary offers that blueprint. They are ranchers who have pioneered that more innovative, kinder way and teach others how to do it. For everyone's benefit, the animals, people, and the planet, we should all join Rowdy Girl Sanctuary! And, it's fun! Hoedowns and tours and talks! Come on and join us."" - Jane Velez-Mitchell Jane Velez-Mitchell is the founder and content editor of JaneUnChained, a multi-platform social media news outlet that produces original video content on animal welfare and the compassionate lifestyle. And recently launched UNCHAINED TV live streaming app. For six years, she hosted her own show on HLN/CNN Headline News, where she ran a weekly segment on animal issues that consistently broke the news. Previously, Velez-Mitchell reported for the nationally syndicated Warner Brothers/Telepictures show Celebrity Justice, where she did numerous stories on animal issues championed by celebrities. Previously, Velez-Mitchell was a news anchor/reporter at KCAL-TV in Los Angeles and WCBS-TV in New York. By becoming a PROUD member, you will help us provide them with food, shelter, vet care, and the constant improvement of their quality of life. Did you also know you could become a member by virtually adopting an animal? JOIN THE HERD & BECOME A MEMBER TODAY, HEAD TO THE LINK BELOW! https://rowdygirlsanctuary.org/membership/"
batch_38,https://raw.githubusercontent.com/heranmane/label_studio_images/main/10k_batches/batch_38/195630-5079164242141720.png,"President Joe Biden has selected Ketanji Brown Jackson as his nominee to the Supreme Court, setting in motion a historic confirmation process for the first Black woman to sit on the highest court in the nation. Biden will deliver remarks on Friday afternoon announcing the selection, the White House said. CNN first reported Biden’s decision. #TheAtlantaVoice #Biden #BlackHerStory #USPol"
batch_38,https://raw.githubusercontent.com/heranmane/label_studio_images/main/10k_batches/batch_38/195631-5000095310048614.png,"Texas Sen. Ted Cruz called President Joe Biden’s commitment to nominate the first Black woman to the Supreme Court “offensive” and said that by doing so the President is telling other Americans “you are ineligible.” “The fact that he’s willing to make a promise at the outset, that it must be a Black woman, I gotta say that’s offensive. You know, you know Black women are what, 6% of the US population? He’s saying to 94% of Americans, ‘I don’t give a damn about you, you are ineligible’,” Cruz said on an episode of his podcast “Verdict with Ted Cruz” that was released on Sunday. In 2019, Black women represented 7% of the US population, according to the US Census Bureau. #TheAtlantaVoice #USPol #Biden #TedCruz"
batch_38,https://raw.githubusercontent.com/heranmane/label_studio_images/main/10k_batches/batch_38/195632-10158310016335598.png,"TOMORROW: A Book Discussion on ""Golem Girl: A Memoir"" with Author Riva Lehrer. Check the calendar for more information and the Zoom Link: https://bethemet.org/event/a-book-discussion-of-golem-girl-with-author-riva-lehrer/"
batch_38,https://raw.githubusercontent.com/heranmane/label_studio_images/main/10k_batches/batch_38/195633-10159885497639854.png,Looking for a fun opportunity this summer? Check out this fishing program we are doing in partnership with Multi-Cultural Center of Sioux Falls
batch_38,https://raw.githubusercontent.com/heranmane/label_studio_images/main/10k_batches/batch_38/195634-10159695504439854.png,"Are you interested in learning more about conservation efforts in South Dakota? Take a look at our two-part Conservation Class, happening this Saturday, January 29. Part 1 of this introductory course will discuss the basics of conservation and what conservation looks like in South Dakota. We will discuss the need for conservation, what is currently being done, and what programs are available to assist in wildlife regeneration. Part 2 of this introductory class will review the basics of conservation and how it looks in South Dakota. We will go more in-depth on conservation by explaining and presenting some research on disappearing wetlands and how this will affect waterfowl populations. Register for one, or both classes online at gfp.sd.gov/toc-east/:=:https://gfp.sd.gov/toc-east/"
batch_38,https://raw.githubusercontent.com/heranmane/label_studio_images/main/10k_batches/batch_38/195635-1913145475552031.png,"Tomorrow, 5:30 – 6:30 pm, is the Immigration Workshop hosted by The Crimson Group and Undocumented Initiatives at WSU. Join the workshop on zoom https://wsu.zoom.us/j/92780928442 to learn more about updates regarding DACA and Advanced Parole and their impacts on students. #students #immigration"
batch_38,https://raw.githubusercontent.com/heranmane/label_studio_images/main/10k_batches/batch_38/195636-1908902242643021.png,"Next Tuesday, The Crimson Group and Undocumented Initiatives at WSU are hosting an Immigration Workshop. Join the workshop on zoom https://wsu.zoom.us/j/92780928442 Tuesday, March 8 from 5:30-6:30 pm. The workshop will cover updates regarding DACA and Advanced Parole."
batch_38,https://raw.githubusercontent.com/heranmane/label_studio_images/main/10k_batches/batch_38/195637-2786645324975336.png,"🌎 Join the 2022 Earth Day Celebration at Narbeck Wetland Sanctuary on Friday, 4/22 from 10:30 a.m. to noon. Pitch in to clean trails & the amphitheater, and put debris on unauthorized trails. Don't forget your work gloves and your favorite gardening tools! #EarthDay2022"
batch_38,https://raw.githubusercontent.com/heranmane/label_studio_images/main/10k_batches/batch_38/19564-528275791987375.png,Inspire Critical Thinking on Controversial Topics with C.S. Lewis and the MereChristianityJournal.com.
batch_38,https://raw.githubusercontent.com/heranmane/label_studio_images/main/10k_batches/batch_38/195641-10159215322083191.png,Join us!
batch_38,https://raw.githubusercontent.com/heranmane/label_studio_images/main/10k_batches/batch_38/195642-7529368770407343.png,"(Girls & Science - Now Through March 26th (online)) on COMBO - The Colorado Music Business Organization https://coloradomusic.org/girls-science-now-through-march-26th-online/ Be inspired by women in STEM! CBS4, in partnership with Girls Inc. of Metro Denver, is excited to present the 8th Annual Girls & Science. This year’s virtual event will run from February 24th – March 26th and will offer free resources, video presentations and activity kits for girls. Female mentors will share their personal …"
batch_38,https://raw.githubusercontent.com/heranmane/label_studio_images/main/10k_batches/batch_38/195643-10158328934875826.png,Jump in!
batch_38,https://raw.githubusercontent.com/heranmane/label_studio_images/main/10k_batches/batch_38/195645-4719676198109797.png,Valentine's Day is less than a week away and we're here to make your planning easy! ❤️🍫
batch_38,https://raw.githubusercontent.com/heranmane/label_studio_images/main/10k_batches/batch_38/195646-10159932980414729.png,"Thursday, bring on the blessings of the Qur'an!: 🟣 Our Monthly Open House continues at 7pm at Masjid Annoor. Share the live link or join in person (muslimknoxville.org/live:=:https://www.youtube.com/channel/UCy3IgUAq8djfUmrivWWz_pg) 📒Read Surah Al-Kahf in Masjid Annoor tonight after Isha (8pm) followed by refreshments. 📖 Join the monthly Qur'an Khatm. Pls sign up to read a juz! Join us this Saturday at 7pm to take part in the Khatem dua as a community! 🤲🏽 Sign up here: muslimknoxville.org/qurankhatm:=:https://docs.google.com/spreadsheets/d/12_SfXnFuXXs2OyYzx2GUkh8biPJNZGarPbGFk9JInmY/edit"
batch_38,https://raw.githubusercontent.com/heranmane/label_studio_images/main/10k_batches/batch_38/195647-10159918155899729.png,Open the door to the Qur'an this March 4-5 at MCK's 1st Annual Treasures of the Qur'an Conference. Learn more at https://muslimknoxville.org/treasures2022:=:https://muslimknoxville.org/programs/treasures2022/ and register now to save your seat! Watch the video and share with friends and family.
batch_38,https://raw.githubusercontent.com/heranmane/label_studio_images/main/10k_batches/batch_38/195648-10159916224634729.png,"This Friday at 7pm: Build Power through Advocacy, a special event presented by AMAC and Voter Education Fund. Join us in-person or live at muslimknoxville.org/live:=:https://www.youtube.com/channel/UCy3IgUAq8djfUmrivWWz_pg Tonight, don't forget about Tafsir Halaqa with Imam Rafiq right after Isha (8pm). Also streamed at the same link. Btw, have you registered for the photo hike contest? muslimknoxville.org/mykphoto:=:https://docs.google.com/forms/d/e/1FAIpQLSfMywyLjKiYVxYCIt70Qk3bhsXSAb2bMTRuKhGLPULxDq1Ipg/viewform"
batch_38,https://raw.githubusercontent.com/heranmane/label_studio_images/main/10k_batches/batch_38/195649-10159912511014729.png,"By popular request, Sister's Halaqa starts at 12:30pm in Masjid Annoor with Imam Khalid. Don't forget about Quranic Reflections tonight after Isha (8pm) also. Try your best to make it a habit to come to the masjid for your heart, for your rest, for your restoration. Programs are a nice bonus and so is community :) May God accept all our intentions! Btw, heard of the UTK MSA Fundraiser? Sign up here: https://forms.gle/Lhqn11utWEnLMdpQ6:=:https://docs.google.com/forms/d/e/1FAIpQLSfxpO2A9OlzQ8_HmX6CXBXF2RJdgQ2bjAsytcJGz19PgTADeA/viewform"
batch_38,https://raw.githubusercontent.com/heranmane/label_studio_images/main/10k_batches/batch_38/19565-5278417425529406.png,We Welcome ZEE5 - the largest streaming platform in the world! ZEE5 is the title sponsor at Spring India Day! Do visit their booth on June 11th for exciting offers. ZEE5
batch_38,https://raw.githubusercontent.com/heranmane/label_studio_images/main/10k_batches/batch_38/195650-10159892214864729.png,"We're here to answer your MIST questions. Please join us this Thursday at 6pm - either in-person or on Zoom - to learn about the Muslim Interscholastic Tournament, and how YOU can help us bring the gold 🏆 home to Knoxville! Join Zoom Meeting https://zoom.us/j/91473733685?pwd=WGI1NWFUM0l1TXRwV0liNm9zNGlzZz09"
batch_38,https://raw.githubusercontent.com/heranmane/label_studio_images/main/10k_batches/batch_38/195651-10159875236589729.png,"The Zakat Workshop is today at 6:30pm in Masjid Annoor with Zanne Soliz and Imam Khalid Shahu. Get all your questions on what Zakat is, how to give it, and how you can perform your obligation. Livestreamed at muslimknoxville.org/live:=:https://www.youtube.com/channel/UCy3IgUAq8djfUmrivWWz_pg"
batch_38,https://raw.githubusercontent.com/heranmane/label_studio_images/main/10k_batches/batch_38/195653-5390188064330471.png,"Today at 12pm join our Policy Analyst Rebekah de la Mora for ""Navigating Local Resources and Connections to Take Action"" and learn how to get started with the resources you have to take actionable steps in reducing your organization’s environmental footprint. Register for The Big Bold Jewish Climate Fest, January 10-14, 2022 at http://www.jewishclimatefest.org:=:https://www.jewishclimatefest.org/"
batch_38,https://raw.githubusercontent.com/heranmane/label_studio_images/main/10k_batches/batch_38/195655-10160047025791217.png,"Please note, all BSSB locations will be closed this coming Monday in observance of Juneteenth. Be sure to conduct all in-person banking needs before noon tomorrow!"
batch_38,https://raw.githubusercontent.com/heranmane/label_studio_images/main/10k_batches/batch_38/195656-323157636515614.png,"🔁@eunisses2022: No one should be harassed, arrested or threatened for selling food in our neighborhoods. It’s time to support street vendors and their growth as a businesses as they are part of communities. To learn about different resources —> @inclusivaction Visit —> Eunisses.com to learn more about my campaign and what I am fighting for ✊🏽 #Eunisses2022 #ForThePeople #streetvendors #CD1"
batch_38,https://raw.githubusercontent.com/heranmane/label_studio_images/main/10k_batches/batch_38/195657-2789376624700819.png,What's the good life to you? We're currently attending Ellen Burstein & Jing Jing Shen's 'Bringing to Life the Best Life: Young People and Their Mental Health' at the Sixth Annual Virtual #ConferenceonSuicide.
batch_38,https://raw.githubusercontent.com/heranmane/label_studio_images/main/10k_batches/batch_38/195658-3140961066147034.png,"Donate today! Through the WE Love Her campaign, your contribution fuels our ability to continue our transformative work within voter engagement, leadership development, and reproductive justice. While every day is a day to celebrate Black history and Women's herstory, consider commemorating the occasion by giving today. #WeLoveHer #WomenEngaged #Donate #GiveBack #WeVoteWeRise"
batch_38,https://raw.githubusercontent.com/heranmane/label_studio_images/main/10k_batches/batch_38/195659-3137662826476858.png,We truly enjoyed having La’Meshia Whittington today on YAWA! She spoke truth about the issues Black and Brown communities face with Enviromental Justice and Enviromental Racism. Thank you for joining us and thanks to our host Zoe Bambara for a great conversation. #YAWA #WomenEngaged #WeVoteWeRise
batch_38,https://raw.githubusercontent.com/heranmane/label_studio_images/main/10k_batches/batch_38/19566-2642979745837393.png,4193320811 Margaritas available to go 🔥🔥🔥🔥🙏
batch_38,https://raw.githubusercontent.com/heranmane/label_studio_images/main/10k_batches/batch_38/195660-3132637046979436.png,"Join us next Friday, March 18th on Facebook Live for a great conversation on Environmental 🌳 Justice w/ special guest La’Meshia Whittington and our very own Zoe Bambara. #YAWA #WomenEngaged #WeVoteWeRise"
batch_38,https://raw.githubusercontent.com/heranmane/label_studio_images/main/10k_batches/batch_38/195661-3125554517687689.png,Visit www.WomenEngaged.vote:=:https://womenengaged.vote/ to read our full statement 💜✊🏾 #WomenEngaged #WeVoteWeRise #WomenHealthProtectionAct
batch_38,https://raw.githubusercontent.com/heranmane/label_studio_images/main/10k_batches/batch_38/195662-3124740634435744.png,"On this last day of #blackhistorymonth we would like to honor our very own Malika Redmond the CEO and co-founder of #WomenEngaged. Malika Redmond is the co-founder and CEO of Women Engaged a nonprofit based in Atlanta, GA, that works to inspire Black women and young adults to become impactful leaders, key decision-makers and effective agents for social change through voter engagement and reproductive justice advocacy and leadership development. Malika has worked for 20 years both nationally and internationally managing projects that focus on women's human rights, racial justice, and youth empowerment. She founded the International Black Youth Summit in 1994, and was one of the youngest national field organizers for the 2004 March for Women’s Lives an event that brought nearly 1 million participants to the National Mall. Malika served two elected terms as the 1st board Chair of the ProGeorgia Civic Engagement Table, and first leader of a Reproductive Justice organization to do so. Her awards include the 2016 distinguished Rockwood Leadership Institute for Leaders In the Reproductive Health, Rights, and Justice field,""Stand Up for Reproductive Justice"" award by Feminist Women's Health Center, ""Legends in the Making"" award by Planned Parenthood, SE, and a nominated ""ChangeMaker"" for the 2016 United States of Women conference. Her writings are featured in Truthout, Blavity, Essence, and AlterNet. Malika holds a BA from Spelman College and MA from Georgia State University. We celebrate you 💜✊🏾 #WomenEngaged #WeVoteWeRise #blackhistorymonth"
