batch,image,text
batch_30,https://raw.githubusercontent.com/heranmane/label_studio_images/main/10k_batches/batch_30/199564-10159975848012328.png,"Virginia Asian Chamber of Commerce and Dominion Energy are partnering to present the VACC 7th Annual ProcureCon Hampton Roads Buyer Expo! For more information and registration, click below: https://www.eventbrite.com/e/procurecon-hampton-roads-buyer-xpo-tickets-158642186049%20z:=:https://www.eventbrite.com/e/158642186049 #smallbusiness #procurement #businessdevelopment #minorityownedbusiness #expo #businessadvice #Chamber757 #meansbusiness"
batch_30,https://raw.githubusercontent.com/heranmane/label_studio_images/main/10k_batches/batch_30/199566-3166398830284094.png,"𝗗𝗲𝗮𝗱𝗹𝗶𝗻𝗲 𝗶𝘀 𝗧𝗢𝗠𝗢𝗥𝗥𝗢𝗪: 𝗝𝘂𝗻𝗲 𝟭𝟲𝘁𝗵 Norfolk Arts grantee, Little Theatre of Norfolk seeks 2-5min. songs, monologues, stories, poems and/or dance video submissions of works created and/or traditionally performed by African American artists and playwrights for their Juneteenth Virtual Cabaret. Original works are also welcomed! #ShareNorfolkTheatre"
batch_30,https://raw.githubusercontent.com/heranmane/label_studio_images/main/10k_batches/batch_30/199567-3159666810957296.png,"🌟Norfolk Arts grantee, Little Theatre of Norfolk seeks 2-5 min. videos of songs, monologues, stories, poems, etc. of works created or traditionally performed by African American artists & playwrights for a virtual Juneteenth celebration. ⌛️Deadline: 06/16 https://docs.google.com/forms/d/e/1FAIpQLSdQ1JGlux4oW3nel8JDwHWNdVOiRkj42B-Tt3yez7dvzCJaqQ/viewform:=:https://accounts.google.com/v3/signin/identifier"
batch_30,https://raw.githubusercontent.com/heranmane/label_studio_images/main/10k_batches/batch_30/199569-10159792716285928.png,"Our Division of Student Affairs presents ""Courageous Conversations"" on Thursday, April 21, at 6 p.m. in room 149 of our Student Center. You can also join the conversation on Zoom using ID 9313465 1662. For more info, please contact campuslife-diversity@nsu.edu or 757-785-3688."
batch_30,https://raw.githubusercontent.com/heranmane/label_studio_images/main/10k_batches/batch_30/19957-5150541618340477.png,We want to thank you for your continued support which helps us provide a brighter future for our students.
batch_30,https://raw.githubusercontent.com/heranmane/label_studio_images/main/10k_batches/batch_30/199580-4917878611614730.png,✅ SEE ALL THE CHARTS: https://www.ditchthecarbs.com/egg-conversion-egg-substitution-charts/ How many small eggs make a large egg? How many medium eggs equal a large egg? How many large eggs are in a cup? These helpful egg conversions will show you how to make any recipe with any size egg.
batch_30,https://raw.githubusercontent.com/heranmane/label_studio_images/main/10k_batches/batch_30/199581-4908994665836458.png,"Are you children hard to please? ✅ GET THE RECIPE: https://www.ditchthecarbs.com/thai-chicken-lettuce-cups/ Thai chicken lettuce cups are super easy to make and fun to eat, but don't think you're going to win any prizes for the neatest eater. Children love being allowed to eat with their hands and get messy."
batch_30,https://raw.githubusercontent.com/heranmane/label_studio_images/main/10k_batches/batch_30/199582-4837618132974112.png,What's your favourite 🌮MEXICAN dish????? Now you can search ALL the low-carb and keto MEXICAN recipes: https://www.ditchthecarbs.com/category/low-carb-keto-mexican-recipes/
batch_30,https://raw.githubusercontent.com/heranmane/label_studio_images/main/10k_batches/batch_30/199583-4817862084949717.png,✅ GET THE RECIPE: https://www.ditchthecarbs.com/curried-devilled-eggs/ Devilled eggs - the perfect keto snack and high-protein snack. The best part? Devilled eggs are keto and almost zero carbs and perfect when you want some extra protein on your low-carb diet or keto diet.
batch_30,https://raw.githubusercontent.com/heranmane/label_studio_images/main/10k_batches/batch_30/199584-3275637272672045.png,Disney Is Forced To Apologize For “Racist” Dance During Their Parade: https://buff.ly/3yo0Xd6:=:https://awm.com/disney-is-forced-to-apologize-for-racist-dance-during-their-parade-2/
batch_30,https://raw.githubusercontent.com/heranmane/label_studio_images/main/10k_batches/batch_30/199585-3248321288736977.png,Celeb Gets Fired After Going On A Racist Rant About White People: https://buff.ly/3GasXmM:=:https://celebrities.awm.com/celeb-gets-fired-after-going-on-a-racist-rant-about-white-people-2-2-2-2-2-2-2-2-2-2-2/
batch_30,https://raw.githubusercontent.com/heranmane/label_studio_images/main/10k_batches/batch_30/199586-3238464443055995.png,Outraged Employees Are Telling Their Bosses That Canceling Work From Home Is Racist: https://buff.ly/3yss6vD:=:https://bizarre.awm.com/outraged-employees-are-telling-their-bosses-that-canceling-work-from-home-is-racist/
batch_30,https://raw.githubusercontent.com/heranmane/label_studio_images/main/10k_batches/batch_30/199587-3234278553474584.png,The Sign At “George Floyd Square” Has A Message For All White People: https://buff.ly/39Dwf5F:=:https://awm.com/the-sign-at-george-floyd-square-has-a-message-for-all-white-people-2-2-2-2-2-2/
batch_30,https://raw.githubusercontent.com/heranmane/label_studio_images/main/10k_batches/batch_30/199588-3227771887458584.png,Some Criminal Justice Experts Are Blaming BLM For A Rise In Murders Of African-Americans: https://buff.ly/3kf9Yx2:=:https://crime.awm.com/some-criminal-justice-experts-are-blaming-blm-for-a-rise-in-murders-of-african-americans/
batch_30,https://raw.githubusercontent.com/heranmane/label_studio_images/main/10k_batches/batch_30/199589-3210954609140312.png,"Disney Is Forced To Apologize For ""Racist"" Dance During Their Parade: https://buff.ly/3DyDKFK:=:https://awm.com/disney-is-forced-to-apologize-for-racist-dance-during-their-parade/"
batch_30,https://raw.githubusercontent.com/heranmane/label_studio_images/main/10k_batches/batch_30/19959-10158967204252404.png,"“Washington College gave me many meaningful leadership and experiential opportunities that helped me determine what kind of work I wanted to do after graduation. I found a passion and drive for public service that has steered me to serve Jewish youth in my career after college,” says Kat. #SeniorSpotlights #GooseNationGraduates 🎓"
batch_30,https://raw.githubusercontent.com/heranmane/label_studio_images/main/10k_batches/batch_30/199590-3188831448019295.png,"Police Were Shocked When They Found Out Who Put ""Racist"" Graffiti At The School's Water Fountains: https://buff.ly/3HIpw5N:=:https://awm.com/police-were-shocked-when-they-found-out-who-put-racist-graffiti-at-the-schools-water-fountains/"
batch_30,https://raw.githubusercontent.com/heranmane/label_studio_images/main/10k_batches/batch_30/199591-3188076088094831.png,California Demands Trees Be Removed For Being Racist: https://buff.ly/36RVXSp:=:https://awm.com/california-demands-trees-be-removed-for-being-racist-2-2-2-2-2-2-2-2-2-2-2-2-2-2-2-2/
batch_30,https://raw.githubusercontent.com/heranmane/label_studio_images/main/10k_batches/batch_30/199592-3178556182380155.png,AOC And Her Boyfriend Have A Message They Want All White People To Hear: https://buff.ly/3s0yPt9:=:https://awm.com/aoc-and-her-boyfriend-have-a-message-they-want-all-white-people-to-hear-2-2-2-2-2-2-2-2-2-2-2-2/
batch_30,https://raw.githubusercontent.com/heranmane/label_studio_images/main/10k_batches/batch_30/199593-3172560836313023.png,Now We Get To See Inside The Housing For The Migrants Who Come Across The Border: https://buff.ly/3uGjRu6:=:https://america.awm.com/now-we-get-to-see-inside-the-housing-for-the-migrants-who-come-across-the-border-2-2-2-2/
batch_30,https://raw.githubusercontent.com/heranmane/label_studio_images/main/10k_batches/batch_30/199594-3169291166639990.png,"BLM Has $60M, But Nobody Knows Who's In Charge Of All That Money: https://buff.ly/3sc8as4:=:https://america.awm.com/blm-has-60m-but-nobody-knows-whos-in-charge-of-all-that-money/"
batch_30,https://raw.githubusercontent.com/heranmane/label_studio_images/main/10k_batches/batch_30/199595-3168265646742542.png,Neighbor Writes A Letter Telling Him That Christmas Lights Are Racist: https://buff.ly/3scsnhE:=:https://bizarre.awm.com/neighbor-writes-a-letter-telling-him-that-christmas-lights-are-racist-2-2-2-2-2/
batch_30,https://raw.githubusercontent.com/heranmane/label_studio_images/main/10k_batches/batch_30/199596-3166922696876837.png,AOC And Her Boyfriend Have A Message They Want All White People To Hear: https://buff.ly/3uhpLln:=:https://awm.com/aoc-and-her-boyfriend-have-a-message-they-want-all-white-people-to-hear-2-2-2-2-3-2-2-2-3-2-2/
batch_30,https://raw.githubusercontent.com/heranmane/label_studio_images/main/10k_batches/batch_30/199597-3165036307065476.png,"If You See This In A Parking Lot, You Can Only Park There If You’re LGBTQ Or An Immigrant: https://buff.ly/3o6nB40:=:https://awm.com/if-you-see-this-in-a-parking-lot-you-can-only-park-there-if-youre-lgbtq-or-an-immigrant-2-2/"
batch_30,https://raw.githubusercontent.com/heranmane/label_studio_images/main/10k_batches/batch_30/199598-3151250578444049.png,"Not Many Know How ""Black Sign Language"" Is Different From Traditional Sign Language: https://buff.ly/3qV28M2:=:https://inspire.awm.com/not-many-know-how-black-sign-language-is-different-from-traditional-sign-language/"
batch_30,https://raw.githubusercontent.com/heranmane/label_studio_images/main/10k_batches/batch_30/199599-3147316162170824.png,Professor’s Lecture About White People Is Going Viral For All The Wrong Reasons: https://buff.ly/3eOdjk9:=:https://awm.com/professors-lecture-about-white-people-is-going-viral-for-all-the-wrong-reasons-2/?utm_content=buffer79490&utm_medium=fb&utm_source=style&utm_campaign=buffer
batch_30,https://raw.githubusercontent.com/heranmane/label_studio_images/main/10k_batches/batch_30/1996-493200009036502.png,Cancer will meet its end the same way flu did. 🤡
batch_30,https://raw.githubusercontent.com/heranmane/label_studio_images/main/10k_batches/batch_30/199600-3147030362199404.png,Armed Group Of Civilians Just 300 Illegal Immigrants At The Border: https://buff.ly/3Jlz4pj
batch_30,https://raw.githubusercontent.com/heranmane/label_studio_images/main/10k_batches/batch_30/199601-3146569505578823.png,"Students Are Being Shown Controversial BLM Video That Claims ""Crime Is Made Up"": https://buff.ly/3Jrcvzq"
batch_30,https://raw.githubusercontent.com/heranmane/label_studio_images/main/10k_batches/batch_30/199603-10158736893780954.png,"Each month, we showcase University of Nebraska Press (UNP) books that the Nebraska Publications Clearinghouse receives 📚 Check out the #NLCblog to see what books the Clearinghouse received in January, February, and March ➡️ https://buff.ly/3ISbxLj:=:http://nlcblogs.nebraska.gov/nlcblog/2022/03/29/book-briefs-new-university-of-nebraska-press-books-at-the-nebraska-publications-clearinghouse-16/"
batch_30,https://raw.githubusercontent.com/heranmane/label_studio_images/main/10k_batches/batch_30/199604-4925744604169773.png,"Racist inequities in health care, income, housing, and education have widened during the COVID-19 pandemic, harming health and well-being. We must address the public health crisis of racism and advance racial equity to improve health. #NPHW https://www.nphw.org/Themes-and-Facts/2022-Racism:=:https://nphw.org/Themes-and-Facts/2022-Racism"
batch_30,https://raw.githubusercontent.com/heranmane/label_studio_images/main/10k_batches/batch_30/199607-515097080183526.png,"A few days ago my lil homie was like ""you're song ""BUSY"" was heard on YouTube by over 400,000 ppl on a channel with 1.9 million subscribers."" Made me think, like really think. Cuz I typically just move on after making a hit. It's good to keep these young dudes around, they keep this social media stuff in perpective for me. I need another single deal!!! https://lnkd.in/dvvytcVi:=:https://www.youtube.com/watch?v=e7i20Pj-7gE #BugzeeLixISBoyFace"
batch_30,https://raw.githubusercontent.com/heranmane/label_studio_images/main/10k_batches/batch_30/199608-5015392498568037.png,"There are just 9 days left until Eid, which means we still have 9 days left of our Ramadan Fundraiser and you have 9 days to help us reach our goal! If you've learned something from MPV's educational content, benefited from our marriage or counseling services (or know someone who has), or you just appreciate the work we are doing across the Muslim world with our programming, like Alliance of Inclusive Muslims or the #ImamsForShe Program, please consider making a donation to support MPV to ensure that we can continue to do this work for generations to come. Your support is essential to our work and our success and therefore essential to the future of the Muslim world, which means no amount is too small. Head to our website (https://www.mpvusa.org/donate) to donate today to promote love in the Muslim community this year! #MuslimsForProgressiveValues #MPV #MPVUSA #MPV #ProgressiveIslam #ProgressiveMuslims #ProgressiveMuslim #Ramadan #SocialJustice #IslamIsJustice #CompassionateIslam #InclusiveIslam #InclusiveMuslims #AntiRacistIslam #ImamsForShe #HeForShe #Interfaith #IslamicFeminist #MuslimFeminist #IslamicFeminism"
batch_30,https://raw.githubusercontent.com/heranmane/label_studio_images/main/10k_batches/batch_30/199609-4982247828549171.png,"By donating to our Ramadan fundraiser you are helping MPV to sustain our various initiatives and needs as we advocate social justice, human rights, and progressive interpretations of Islam across the world. You can select which program you'd like to assist with, whether it be our counseling services, our advocacy efforts, #ImamsForShe, or the Alliance of Inclusive Muslims. Your donation ensures that we at MPV can continue our work to create a culture rooted in human rights across Muslim societies. Click the button on this post or go directly to our website (https://www.mpvusa.org/donate) to donate today! #Support #RamadanFundraiser #Zakat #MuslimsForProgressiveValues #MPVUSA #MPV #ProgressiveMuslim #ProgressiveIslam #ProgressiveMuslims"
batch_30,https://raw.githubusercontent.com/heranmane/label_studio_images/main/10k_batches/batch_30/19961-5320002901356409.png,"“Meet a Rescued Horse (or other Equine) a Day” until our next Public Open Day of 2022 - June 12th, 11 AM - 4 PM"
batch_30,https://raw.githubusercontent.com/heranmane/label_studio_images/main/10k_batches/batch_30/199610-10160072404511085.png,"While Black people are not often portrayed as the face of anti-immigration policies, anti-Blackness can be found throughout US immigration policies and their enforcement. This #BlackHistoryMonth, commit to learning more about anti-Blackness in immigration, and only support policies that are explicitly anti-racist. #RestoringWelcome Thank you Refugee Council USA for compiling these resources."
batch_30,https://raw.githubusercontent.com/heranmane/label_studio_images/main/10k_batches/batch_30/199611-5574528975924931.png,"Do you want to honor a yahrzeit, a special birthday, or anniversary? Sponsor a day in the USCJ Calendar today. We're accepting sponsorships until Monday, May 16th. Click the link below. https://crm.uscj.org/civicrm/contribute/transact?reset=1&id=24"
batch_30,https://raw.githubusercontent.com/heranmane/label_studio_images/main/10k_batches/batch_30/199612-5557271670950345.png,"Watch the recording of our #MinorityHealthMonth webinar featuring the Vox film ""Is Racism Making People Sick?"" followed by a discussion with Rosalyn Carpenter, senior vice president and chief diversity, equity, inclusion officer, CommonSpirit Health. https://youtu.be/X8nbkOjMnF4:=:https://www.youtube.com/watch?v=X8nbkOjMnF4"
batch_30,https://raw.githubusercontent.com/heranmane/label_studio_images/main/10k_batches/batch_30/199613-5534548623222650.png,"Through CHA’s #WeAreCalledUS pledge, the #CatholicHealth ministry is working together to support each other — whether as beginners, leaders or innovators — to bring healing, unity and justice to our communities. Read the #HealthProgress article: https://tinyurl.com/yh5938mj:=:https://www.chausa.org/publications/health-progress/archives/issues/spring-2022/health-equity---catholic-health-care-systems-confront-racism-through-'we-are-called' #HealthEquity"
batch_30,https://raw.githubusercontent.com/heranmane/label_studio_images/main/10k_batches/batch_30/199614-5515115388499307.png,"A critical first step in anti-racist training asks individuals to write their own racial autobiography. In #HealthProgress, M. Therese Lysaught and Sheri Bartlett Browne explore the analogous practice of writing “institutional” racial autobiographies. http://ow.ly/zrJo50IRPzM:=:https://www.chausa.org/publications/health-progress/archives/issues/spring-2022/looking-backward-to-move-forward-writing-your-system%27s-racial-autobiography #WeAreCalledUS"
batch_30,https://raw.githubusercontent.com/heranmane/label_studio_images/main/10k_batches/batch_30/199615-5482691485075031.png,"Join us this #MinorityHealthMonth to watch the Vox film ""Is Racism Making People Sick? How the stress of discrimination is widening the racial health gap."" This webinar includes the film and a discussion about the issues highlighted. Register: http://ow.ly/24sy50IJgOf:=:https://www.chausa.org/events/calendar-of-events/minority-health-month-watch-webinar/overview/ #NMHM"
batch_30,https://raw.githubusercontent.com/heranmane/label_studio_images/main/10k_batches/batch_30/199616-5455526821124831.png,Racism directly affects the physical and mental health of people of color. Learn more about #WeAreCalledUS – our initiative that confronts racism by achieving health equity: wearecalled.org American Public Health Association #NationalPublicHealthWeek
batch_30,https://raw.githubusercontent.com/heranmane/label_studio_images/main/10k_batches/batch_30/199618-10159204749569724.png,"""Young was a noted civil rights leader and statesman who worked to eradicate discrimination. He received many honorary degrees and awards —including the Medal of Freedom (1969), presented by President Lyndon Johnson—for his outstanding civil rights accomplishments."" Resources: NASWFoundation.org https://www.nasw-pa.org/page/192/Black-History-Month---Influential-Social-Workers.htm"
batch_30,https://raw.githubusercontent.com/heranmane/label_studio_images/main/10k_batches/batch_30/199619-5738154196199216.png,"The staff of Today’s Catholic Newspaper are grateful to the advertisers who made the April 8, 2022 Today's Catholic Newspaper possible. We encourage our readers to get to know them and give them your business!! To subscribe, call (210) 734-160 or visit our website at SAtodayscatholic.org. For story ideas, send us an email to TCpaper@archsa.org. To advertise, contact Joann Hopkins at (210) 734-1693 or send an email to jhopkins@archsa.org #iamTodaysCatholic St. Mary's University"
batch_30,https://raw.githubusercontent.com/heranmane/label_studio_images/main/10k_batches/batch_30/19962-530828615059224.png,"10:22PM - A Flash Flood Warning has been issued for southern Cherokee, northern Nacogdoches, southern Rusk, and Shelby counties until 2:15AM. Avoid low water crossings. Turn around, don't drown."
batch_30,https://raw.githubusercontent.com/heranmane/label_studio_images/main/10k_batches/batch_30/199622-10158240488087167.png,"[WEEKLY GIVEAWAY] The Spiritual Teachings of the Prophet ﷺ : Hadith with Commentaries by Saints & Sages of Islam | 1 Winner @CelebrateMercy is giving away a copy of the book The Spiritual Teachings of the Prophet ﷺ to one winner! 🔷This book is a collection of over 200 of the most spiritual Hadith, along with commentary by scholars likr Hasan al-Basrī, al-Ghazali, Junayd, and Shaykh al-‘Alawi. The Prophetic traditions address all aspects of earthly life, as well as the spiritual life, the path to the world beyond impermanence. This book is a great tool to learn more about the spiritual path, or to get a more complete view of Islamic tradition overall. 🔶Learn more & order here ➡️ CelebrateMercy.com/Teachings:=:https://store.celebratemercy.com/products/the-spiritual-teachings-of-the-prophet-hadith-with-commentaries-by-saints-sages-of-islam ENTER THE GIVEAWAY: Find us on Instagram or click CelebrateMercy.com/Giveaway:=:https://www.instagram.com/p/CbI_QCWvXss/ Note: Must have a valid mailing address to enter. DEADLINE: Friday, March 25 at 5pm ET (New York Time). The winner will be announced at the end of the March 25 Friday Gems webinar, insha-Allah."
batch_30,https://raw.githubusercontent.com/heranmane/label_studio_images/main/10k_batches/batch_30/199623-10159026465785823.png,"""The MM Recap: A Dhul-Hijjah And Hajj Resource"" For all things related to this blessed month, check out MM's best articles from years past! GET IT HERE: https://muslimmatters.org/2022/06/27/mm-recap-hajj-resource/ #DhulHijjah #Islam #Muslim #Hajj #Pilgrimage #Barakah #Hasanaat"
batch_30,https://raw.githubusercontent.com/heranmane/label_studio_images/main/10k_batches/batch_30/199624-5344271418969154.png,"Toggling between the past and the present, Korea and America, don't miss this moving, surprisingly comic novel about a man looking back at his life and reflecting on family, war, and the legacies we all carry within us. Learn more about The Evening Hero, on sale May 24, here: http://spr.ly/6185KlJ63:=:https://www.simonandschuster.com/books/The-Evening-Hero/Marie-Myung-Ok-Lee/9781476735078"
batch_30,https://raw.githubusercontent.com/heranmane/label_studio_images/main/10k_batches/batch_30/199625-5838659872896883.png,"If you haven't already, it's time to build your library for Black History Month. Which titles do you recommend?📚"
batch_30,https://raw.githubusercontent.com/heranmane/label_studio_images/main/10k_batches/batch_30/199626-10159893879592778.png,"Did you catch the new today? We are LIVE NOW on muslimnetwork.tv ▶ Biden Calls Death of Migrant Inside Tractor-Trailer In Texas ""Horrifying’ ▶Ketanji Jackson Becomes First Black Woman Supreme Court Justice ▶Arizona's First Muslim Judge Takes The Bench & More Muslim Network airs on Galaxy 19 Satellite covering USA, Canada and Mexico. It also streams on Amazon FireTV, Apple TV, and Roku. #tractordeaths #supremecourt #muslimjudge"
batch_30,https://raw.githubusercontent.com/heranmane/label_studio_images/main/10k_batches/batch_30/199627-10159892143962778.png,"Did you catch the new today? We are LIVE NOW on https://buff.ly/3dqbiHW:=:https://www.muslimnetwork.tv/ ▶ Trump Became Violent When Secret Service Refused to Take Him to #CapitolHill on Jan 6 ▶ Poor People's Campaign March Includes Injustice For #Palestine ▶ US to Provide $55 M to Those Affected by #AfghanistanEarthquake & More Muslim Network airs on Galaxy 19 Satellite covering USA, Canada and Mexico. It also streams on Amazon FireTV, Apple TV, and Roku."
batch_30,https://raw.githubusercontent.com/heranmane/label_studio_images/main/10k_batches/batch_30/199628-10159888265712778.png,"Did you catch the new today? We are LIVE NOW on https://buff.ly/3dqbiHW:=:https://www.muslimnetwork.tv/ ▶10 States to Ban Abortions While Others Work To Protect Access ▶ Illinois Republican Tells Trump Roe Verdict ""Victory For White LIfe” ▶ Thomas Says Court Should Reconsider Marriage Equality, Right To Contraception & More Muslim Network airs on Galaxy 19 Satellite covering USA, Canada and Mexico. It also streams on Amazon FireTV, Apple TV, and Roku. #roeoverturned #righttocontraception #marriageequality"
batch_30,https://raw.githubusercontent.com/heranmane/label_studio_images/main/10k_batches/batch_30/199629-10159883143092778.png,"Did you catch the new today? We are LIVE NOW on https://buff.ly/3dqbiHW:=:https://www.muslimnetwork.tv/ ▶ Supreme Court Overturns Roe V. Wade, Eliminiating Right to Abortion in US ▶ Supreme Court Blocks New York Law Limiting Guns In Public ▶ House Jan. 6 Committee Reveals GOP Lawmakers Who Sought Trump Pardons & More Muslim Network airs on Galaxy 19 Satellite covering USA, Canada and Mexico. It also streams on Amazon FireTV, Apple TV, and Roku. #roevwade #gunlaws #abortionlaw"
batch_30,https://raw.githubusercontent.com/heranmane/label_studio_images/main/10k_batches/batch_30/19963-10159157095267669.png,My toxic trait is having no self-control whatsoever when it comes to the baskets of chips & salsa 😩🤣 ~ Jenny
batch_30,https://raw.githubusercontent.com/heranmane/label_studio_images/main/10k_batches/batch_30/199630-10159878205967778.png,"Did you catch the new today? We are LIVE NOW on https://buff.ly/3dqbiHW:=:https://www.muslimnetwork.tv/ ▶ Texas Could Vote To Secede US In 2023 As GOP Pushes For Referendum ▶ Study Reveals Harm Overwhelming Negative Portrayal of Muslims In Media Causes ▶ Former Watergate Prosecutor Says Trump Has 'Zero' Defense In Georgia Probe & More Muslim Network airs on Galaxy 19 Satellite covering USA, Canada and Mexico. It also streams on Amazon FireTV, Apple TV, and Roku. #referendum #islamophobia"
batch_30,https://raw.githubusercontent.com/heranmane/label_studio_images/main/10k_batches/batch_30/199631-10159878029332778.png,"One of the biggest issues that I am seeing is the question of #inheritance,” Iqbal said. “The parents are pressured into if they have #property or whatever it is, children kind of coerce them (it) into writing in their will, and they are pressured into that, which in my opinion is a kind of #abuse. LEARN MORE: https://buff.ly/3blEX9D:=:https://www.soundvision.com/article/elder-abuse-in-the-muslim-community New articles every week on https://buff.ly/3Fodv5c:=:https://soundvision.com/articles"
