batch,image,text
batch_38,https://raw.githubusercontent.com/heranmane/label_studio_images/main/10k_batches/batch_38/195734-4973692869376100.png,Come to El Cid's for fajitas and the BEST margaritas! https://www.facebook.com/elcidmexicancuisine/
batch_38,https://raw.githubusercontent.com/heranmane/label_studio_images/main/10k_batches/batch_38/195735-4937680199644034.png,El Cid's Restaurant in Oakhurst has some of the Finest Authentic Mexican food you can find. Stop by for some Delicious Fajitas and Margaritas!! https://www.facebook.com/elcidmexicancuisine/
batch_38,https://raw.githubusercontent.com/heranmane/label_studio_images/main/10k_batches/batch_38/195736-4937648806313840.png,The Hideout has the latest food service in town! Bring in this ad for 20% OFF your order! https://www.facebook.com/hideoutgold/
batch_38,https://raw.githubusercontent.com/heranmane/label_studio_images/main/10k_batches/batch_38/195737-4891580440920677.png,The Hideout has the latest food service in town! Bring in this ad for 20% OFF your order! https://www.facebook.com/hideoutgold/
batch_38,https://raw.githubusercontent.com/heranmane/label_studio_images/main/10k_batches/batch_38/195738-1459160861207020.png,U19 Girls - Day 1 #MNNPL
batch_38,https://raw.githubusercontent.com/heranmane/label_studio_images/main/10k_batches/batch_38/195739-374109744723287.png,Apply to join our team as a #NatAgLaw Staff Attorney here: http://bit.ly/2oxzXXq:=:https://nationalaglawcenter.org/about-the-center/professional-staff/jobs/ Staff #Attorneys assist with #research and writing activities that further the national mission of the National Agricultural Law Center.
batch_38,https://raw.githubusercontent.com/heranmane/label_studio_images/main/10k_batches/batch_38/19574-10158340468696604.png,誠プラスメンバーになってください！！ Support us and get our Makoto e-zine at https://www.MakotoPlus.com:=:https://makotoplus.com/ or become a Patreon supporter at https://www.patreon.com/TheJapanesePage (Both methods are the same price and have the same benefits)⁠ #learnjapanese #japanese #japaneselanguage #nihongo #japan #jlpt #learnjapaneseonline #ilovejapanese #japanesestudy #furigana #learnkanji #studykanji #hiragana #katakana #japaneselesson #kanji #learningjapanese #japanesewords #japaneselearner #study #studyjapanese
batch_38,https://raw.githubusercontent.com/heranmane/label_studio_images/main/10k_batches/batch_38/195741-10158967330757805.png,Sioux Falls School District adding Ag to Career Ed https://www.cattlebusinessweekly.com/articles/sioux-falls-school-district-adding-ag-to-career-ed/
batch_38,https://raw.githubusercontent.com/heranmane/label_studio_images/main/10k_batches/batch_38/195742-5001368569910210.png,Get your whole family excited about hiking and nature in this fun program families. All ages welcome $5 RSVP required at Yampatika.org
batch_38,https://raw.githubusercontent.com/heranmane/label_studio_images/main/10k_batches/batch_38/195744-10160003630093967.png,"Family Action Network presents the virtual event, “Learning America: One Woman's Fight for Educational Justice for Refugee Children,” on Monday, May 9, at 7 p.m. Luma Mufleh, founder of Fugees Family, Inc., will be in conversation with Jose Antonio Vargos, Pulitzer Prize-winning journalist, Emmy-nominated filmmaker, Tony-nominated producer, and author about Mufleh's book. Register at bit.ly/MuflehBookPurchase:=:https://www.thebookstall.com/event/learning-america-one-woman%E2%80%99s-fight-educational-justice-refugee-children-fan-program-luma."
batch_38,https://raw.githubusercontent.com/heranmane/label_studio_images/main/10k_batches/batch_38/195745-4804504153009100.png,Today’s food drive is on!!! Please stop by Boro Hall and help those in need. 8 am to noon.
batch_38,https://raw.githubusercontent.com/heranmane/label_studio_images/main/10k_batches/batch_38/195746-360878002750426.png,cc: @njboardofpublicutilities ・・・ Happy #AsianPacificAmericanHeritageMonth celebrating all the amazing achievements & contributions of our Asian American and Pacific Islander community. #CelebrateDiversity
batch_38,https://raw.githubusercontent.com/heranmane/label_studio_images/main/10k_batches/batch_38/195747-360875619417331.png,cc: @bergencountynj ・・・ Please join us this Thursday at One Bergen County Plaza as the County in collaboration with Jewish Federation of Northern New Jersey recognizes Israel's Independence Day!
batch_38,https://raw.githubusercontent.com/heranmane/label_studio_images/main/10k_batches/batch_38/195749-3196861960529615.png,"Join us for our In person and via zoom Immigration Summit on June 17 at 10:00am to share your advocacy voice for change, as we work towards equity for immigrants! You must register to attend: Please click on this link to register: https://tinyurl.com/FANMSummit2022:=:https://us02web.zoom.us/meeting/register/tZYrfuyqpjIuGNU-AC2NG6CXivMWaMmtnWbJ #STOPDEPORTATIONS #comprehensiveimmigrationreform"
batch_38,https://raw.githubusercontent.com/heranmane/label_studio_images/main/10k_batches/batch_38/19575-474239161160845.png,Anyone else's clothes shrink while they eat? Or is that just me..
batch_38,https://raw.githubusercontent.com/heranmane/label_studio_images/main/10k_batches/batch_38/195750-3133526943529784.png,"#Title42 has been used to send thousands upon thousands of Haitians back to life-threatening conditions in #Haiti. Experts have made clear that #Title42 has no basis in public health. Today, We #Act4BlackImms by calling on @POTUS to end #Title42 and welcome Black asylum seekers."
batch_38,https://raw.githubusercontent.com/heranmane/label_studio_images/main/10k_batches/batch_38/195751-3133525133529965.png,"The human rights and humanitarian situation in #Cameroon is dire with rampant extrajudicial killings, arbitrary detention, and targeted violence against women, LGBTQI+ people, and children. We support an immediate designation of #TPS4Cameroon. #Act4BlackImms"
batch_38,https://raw.githubusercontent.com/heranmane/label_studio_images/main/10k_batches/batch_38/195752-4825498067487863.png,"https://buttenews.net/index.php/11-latest-news/11283-news-update-for-friday-january-28-2022 PNS - Friday, January 28, 2022 -The Indiana House passes a controversial bill barring schools from teaching about Critical Race Theory; and President Biden pledges to place a Black woman on the Supreme Court for the first time."
batch_38,https://raw.githubusercontent.com/heranmane/label_studio_images/main/10k_batches/batch_38/195754-2111777162310860.png,"Happy Chinese New Year! Today starts the Lunar New Year in Chinese astrology this year is the year of the Water Tiger, the symbol of courage and ambition. 2022 represents new beginnings on so many levels. The year of the Tiger is another confirmation. The tiger is fearless and powerful. It is all about dynamic change, going on an adventure and being ready to take risks. The element of Water is all about feelings and emotions and riding the wave of change. The seeds we have planted in the past will start showing their progress which will give us confidence and a push to go further and grow even more. The Tigers ""yang"" and the Waters ""'yin"" will bring balance and harmony into a year #chinesenewyear #watertiger #newyear #goodluck"
batch_38,https://raw.githubusercontent.com/heranmane/label_studio_images/main/10k_batches/batch_38/195755-4076012449168988.png,"A year ago our country was shaken to its core. The attack on the U.S. Capitol prompted important conversations around race, justice, and bitter divisiveness. The Anti-Racism directory includes resources on how you can talk to your child about the U.S. Capitol events and more: https://bit.ly/38W4Add:=:https://r50gh2ss1ic2mww8s3uvjvq1-wpengine.netdna-ssl.com/wp-content/uploads/2021/01/LH_Anti-Racism-Resources-Directory_USCapitol.pdf"
batch_38,https://raw.githubusercontent.com/heranmane/label_studio_images/main/10k_batches/batch_38/195756-1631235893905612.png,#UFC273 April 9 SAT 🔥 @alexvolkanovski vs @koreanzombiemma! Don't miss the action & your BEST #fightnight experience only at Bokamper’s • • • #Bokampers #BestGameDayExperience #BestGameinTown #VotedBestSportsBar #FortLauderdale #Plantation #Miramar #MVP
batch_38,https://raw.githubusercontent.com/heranmane/label_studio_images/main/10k_batches/batch_38/195757-2237113903137589.png,See below if you are a student and identify as APIDA!
batch_38,https://raw.githubusercontent.com/heranmane/label_studio_images/main/10k_batches/batch_38/195759-10158346894584147.png,"As part of our Women's History edition of ""Ask the Faculty,"" History faculty members share more about women's historical impact around the world and in our own backyard. Read more Women's History Month faculty quotes: https://fal.cn/3nk83:=:https://dyson.pace.edu/news-and-events/ask-the-faculty-womens-history-month"
batch_38,https://raw.githubusercontent.com/heranmane/label_studio_images/main/10k_batches/batch_38/19576-523903345935310.png,Over 70 of the Daughters of Deborah mentees attended this Gathering. I’m so amazed by God’s grace. Im so godly proud of them all. We have work to do!!! #kingdomgovernment #whenleaderslead
batch_38,https://raw.githubusercontent.com/heranmane/label_studio_images/main/10k_batches/batch_38/195760-10158321343539147.png,"LAST CALL! 📣 The Center for Community Action and Research is looking for volunteers to join the planning committee for the third annual #PaceU Social Justice Week, set for October 24-28. Applications for the week's four subcomittees are due TODAY! https://fal.cn/3mRK1:=:https://pace.qualtrics.com/jfe/form/SV_4TnfriHmWibIUrs"
batch_38,https://raw.githubusercontent.com/heranmane/label_studio_images/main/10k_batches/batch_38/195761-10158310131404147.png,"Get involved! The Center for Community Action and Research is looking for volunteers to join the planning committee for the third annual #PaceU Social Justice Week, set for October 24-28. Applications for the four subcomittees are due Friday, March 11. https://fal.cn/3mDV5:=:https://pace.qualtrics.com/jfe/form/SV_4TnfriHmWibIUrs"
batch_38,https://raw.githubusercontent.com/heranmane/label_studio_images/main/10k_batches/batch_38/195762-10158305657894147.png,"Who does Assistant Professor of Communication Studies Melvin Williams, PhD, draw inspiration from in his field? Dr. Joan Morgan – often referred to as the ""Mother of Hip Hop Feminism."" (Pictured in second slide.) Read more about her impact on him and other Black History Month quotes from Dyson faculty: https://fal.cn/3mxRM:=:https://dyson.pace.edu/news-and-events/ask-faculty-black-history-month"
batch_38,https://raw.githubusercontent.com/heranmane/label_studio_images/main/10k_batches/batch_38/195763-10158305434649147.png,"Get involved! The Center for Community Action and Research is looking for volunteers to join the planning committee for the third annual #PaceU Social Justice Week, set for October 24-28. Applications for the week's four subcomittees are due March 11. https://fal.cn/3mxo9:=:https://pace.qualtrics.com/jfe/form/SV_4TnfriHmWibIUrs"
batch_38,https://raw.githubusercontent.com/heranmane/label_studio_images/main/10k_batches/batch_38/195764-10158302585609147.png,"In honor of Black History Month, Associate Professor of History Durahn Taylor, PhD, shares his thoughts on the moment in time that most profoundly shaped US history for Black Americans. Read more on his thoughts and more Black History Month quotes from Dyson faculty: https://fal.cn/3muU5:=:https://dyson.pace.edu/news-and-events/ask-faculty-black-history-month"
batch_38,https://raw.githubusercontent.com/heranmane/label_studio_images/main/10k_batches/batch_38/195765-10158298115409147.png,"In honor of Black History Month, Dyson faculty members shared their thoughts on Black history and culture as it relates to their own lives or academic work. Assistant Professor of Public Administration Tiffany Henley, PhD, gave her thoughts on how the COVID-19 pandemic has exposed health and social inequities. Read more faculty quotes: https://fal.cn/3mpMO:=:https://dyson.pace.edu/news-and-events/ask-faculty-black-history-month"
batch_38,https://raw.githubusercontent.com/heranmane/label_studio_images/main/10k_batches/batch_38/195766-10158292114709147.png,"Get involved! The Center for Community Action and Research is looking for volunteers to join the planning committee for the third annual #PaceU Social Justice Week, set for October 24-28. Applications for the events four subcomittees are due March 11. https://fal.cn/3miCY:=:https://pace.qualtrics.com/jfe/form/SV_4TnfriHmWibIUrs"
batch_38,https://raw.githubusercontent.com/heranmane/label_studio_images/main/10k_batches/batch_38/195767-10158277015114147.png,"Tomorrow, Assistant Professor of Political Science Kiku Huckle, PhD, is presenting as part of the Migration Narratives Project, an exhibit from grant recipients telling the stories of migration in Texas. Learn more: https://fal.cn/3lZtI:=:https://uploads.knightlab.com/storymapjs/9e4c83c74f2e073cde77aeaf5dfe9592/migration-narratives-project/index.html Register: https://fal.cn/3lZtJ:=:https://us02web.zoom.us/meeting/register/tZApcuisqj8jE9MQZQDHakOke0dqM9TEi8dP"
batch_38,https://raw.githubusercontent.com/heranmane/label_studio_images/main/10k_batches/batch_38/195768-398940745375204.png,Please join us tonight (2/28/2022) and share!🖤
batch_38,https://raw.githubusercontent.com/heranmane/label_studio_images/main/10k_batches/batch_38/195769-5513885568643912.png,"During Asian American and Pacific Islander Heritage Month, we celebrate #ENDALZ Celebrity Champion Crystal Kung Minkoff, who shares her family’s story to raise Alzheimer’s awareness. bit.ly/3xA2hJL:=:https://alz.org/blog/alz/october-2021/the-real-housewives-of-beverly-hills-crystal-kung #AAPIMonth"
batch_38,https://raw.githubusercontent.com/heranmane/label_studio_images/main/10k_batches/batch_38/19577-2730587590419911.png,"Winner is Carole 🧚🏻‍♀️ AUCTION IS NOW Closed 🧚🏻‍♀️ - starting bid is $27 comment your bid below $1 increments or more - ends Monday at 12 pm MST, payment is due the same day - FREE shipping within USA and ships by Wednesday All crystals deal with luck, prosperity, wealth and abundance. More info on the coins in the comments"
batch_38,https://raw.githubusercontent.com/heranmane/label_studio_images/main/10k_batches/batch_38/195770-5456504531048683.png,"This month, join us in celebrating the contributions of Asian Americans and Pacific Islanders, like journalist, caregiver & #ENDALZ Celebrity Champion Richard Lui, who raises Alzheimer’s awareness by telling his family’s story & sharing stories of other families affected by the disease. #AAPIMonth"
batch_38,https://raw.githubusercontent.com/heranmane/label_studio_images/main/10k_batches/batch_38/195771-3385742008216784.png,"ICYMI👇 https://biglink.to/CCDR Country Club Disco Radio w/ Golf Clap 2-16-22 Fire show featuring the new Faucon single ""Make It Right"" dropping 2morrow on CCD! #dj #housemusic #techhouse #newmixtape #InsomniacRadio"
batch_38,https://raw.githubusercontent.com/heranmane/label_studio_images/main/10k_batches/batch_38/195772-7055200744552836.png,"In just the last nine months, EEO-1 Report or Intersectional Data disclosure nearly doubled across the Russell 1000. What’s driving this trend? We take a deeper look at what’s compelling companies to reveal their #diversity data in our latest report: http://spr.ly/6182KuC0I:=:https://justcapital.com/reports/share-of-largest-us-companies-disclosing-race-and-ethnicity-data-rises/"
batch_38,https://raw.githubusercontent.com/heranmane/label_studio_images/main/10k_batches/batch_38/195773-5177938068968878.png,Tonight at Grand Lake…
batch_38,https://raw.githubusercontent.com/heranmane/label_studio_images/main/10k_batches/batch_38/195774-5174595395969812.png,Tonight at Grand Lake…
batch_38,https://raw.githubusercontent.com/heranmane/label_studio_images/main/10k_batches/batch_38/195775-5154836221279063.png,Tonight at Grand Lake…
batch_38,https://raw.githubusercontent.com/heranmane/label_studio_images/main/10k_batches/batch_38/195776-5135502849879067.png,Tonight at Grand Lake…
batch_38,https://raw.githubusercontent.com/heranmane/label_studio_images/main/10k_batches/batch_38/195777-5100433113386041.png,Tonight at Grand Lake…
batch_38,https://raw.githubusercontent.com/heranmane/label_studio_images/main/10k_batches/batch_38/195778-4866567810105907.png,Tonight at Grand Lake…
batch_38,https://raw.githubusercontent.com/heranmane/label_studio_images/main/10k_batches/batch_38/195779-363647668915683.png,"Mayor Lightfoot is the first LGBT black woman to be elected mayor of a major city in the United States. Moreover, she is the second woman (after Jane Byrne), and the third African-American—after Harold Washington and Eugene Sawyer—to be mayor of Chicago."
batch_38,https://raw.githubusercontent.com/heranmane/label_studio_images/main/10k_batches/batch_38/19578-3218375498380753.png,Join us for FUNFEST in August!!
batch_38,https://raw.githubusercontent.com/heranmane/label_studio_images/main/10k_batches/batch_38/195780-1836438643212072.png,"Dine with us Wednesday, April 6th from 5-9PM, as we help Faith Family Church Youth attend summer camp. Just mention them when you order either dine in or drive thru and they will receive 15% back to help their program."
batch_38,https://raw.githubusercontent.com/heranmane/label_studio_images/main/10k_batches/batch_38/195781-1828561547333115.png,"Join us as we fundraise for the Hilltop United Methodist Church Youth. Mention them when you place your order in person or thru drive thru and they will receive 15% back. This event is Monday, March 28, starting at 4PM."
batch_38,https://raw.githubusercontent.com/heranmane/label_studio_images/main/10k_batches/batch_38/195782-1619093585135925.png,It's National Hamburger Day! Celebrate with the 🐐
batch_38,https://raw.githubusercontent.com/heranmane/label_studio_images/main/10k_batches/batch_38/195783-1618389271873023.png,Onion ring + BBQ + American & pepper jack cheese = 🤤
batch_38,https://raw.githubusercontent.com/heranmane/label_studio_images/main/10k_batches/batch_38/195784-1616894308689186.png,Have you treated yourself to this legend? 🍩🍔
batch_38,https://raw.githubusercontent.com/heranmane/label_studio_images/main/10k_batches/batch_38/195785-1586389461739671.png,Don't miss out on this huge opportunity! 💰 https://www.facebook.com/jobs/job-opening/2874898476142701?source=job_ats
batch_38,https://raw.githubusercontent.com/heranmane/label_studio_images/main/10k_batches/batch_38/195786-6983338291706422.png,"Have you had a chance to try our Thai Chicken Salad? It's available for just a little longer! This fresh salad includes romaine lettuce with: - sliced chicken tenders - red peppers - mandarin oranges - crispy wonton strips Then, top it with our new Thai Satay Dressing for an extra kick! 🌶🍊 Now available on the buffet. But, don't miss this limited-time salad - it's heading out soon! Find more info on buffet hours @ pizzaranch.com . . Available at participating locations."
batch_38,https://raw.githubusercontent.com/heranmane/label_studio_images/main/10k_batches/batch_38/195787-4587337374699426.png,Great fun from Sioux Falls Parks and Recreation! Mark your calendars!
batch_38,https://raw.githubusercontent.com/heranmane/label_studio_images/main/10k_batches/batch_38/195788-4556532427779921.png,Sioux Falls historic downtown is full of rich history. Join us this weekend to find out more! www.sufufoodtours.com:=:https://sufufoodtours.com/
batch_38,https://raw.githubusercontent.com/heranmane/label_studio_images/main/10k_batches/batch_38/195789-4536034563163041.png,Not sure where to go out to eat? 🙋 Check out our food blog to learn more about some of our favorite spots! 🍺🍕🍝🌯🍲 https://sufufoodtours.com/food-blog/ #sufufoodtour #siouxfallsfoodtour #foodtour #funthingstodoinsiouxfalls #thingstodothisweekend #thingstodoinsiouxfallsthisweekend #brewerytour #breweries #dtsf #weareopen #uniqueexperience #experiencesiouxfalls #trysomethingnew #supportsmallbusiness #eatlocal #drinklocal #supportlocal #supportsmall #siouxfalls #hifromsouthdakota #siouxfallslocal #support #smallbusiness #SoDakfoodtour #celebrate
batch_38,https://raw.githubusercontent.com/heranmane/label_studio_images/main/10k_batches/batch_38/19579-343285861165720.png,"Ramadan Mubarak ! Everyone is welcome to join in on the most spectacular Ramadan Celebration in Nassau County's history! Program includes: Guest Speaker- Mufti Mohammad Farhan Quran Recitations, Poetry, and Nasheed Performances From Our Very Own Hamza Academy Students. Concluded with a heart softening call to prayer by Br. Moyadd Hakeem- Son of World-Renowned Muadhin of Masjid Al-Nabawi Event will begin @6PM sharp. Refreshments will be served."
batch_38,https://raw.githubusercontent.com/heranmane/label_studio_images/main/10k_batches/batch_38/195790-4533182346781596.png,Sign up for our newsletter and receive a code for $10 off a food tour. Keep up on specialty tours and flash sales with our newsletter. Don't miss a bite!
batch_38,https://raw.githubusercontent.com/heranmane/label_studio_images/main/10k_batches/batch_38/195791-4505953946171103.png,"With 🌻Mother's Day🎁 just around the corner, (WARNING: IT IS THIS SUNDAY) give mom a gift of an experience. Gift certificates available for a food tour! #mothersday #momsfavorite https://sufufoodtours.com/purchase-a-gift-card/"
batch_38,https://raw.githubusercontent.com/heranmane/label_studio_images/main/10k_batches/batch_38/195792-4501831186583379.png,"With 🌻Mother's Day🎁 just around the corner, (WARNING: IT IS THIS SUNDAY) give mom a gift of an experience. Gift certificates available for a food tour! #mothersday #momsfavorite https://sufufoodtours.com/purchase-a-gift-card/"
batch_38,https://raw.githubusercontent.com/heranmane/label_studio_images/main/10k_batches/batch_38/195793-4501231029976728.png,"It's Mother's Day weekend...have you picked out something for mom? 🎁 Surprise her and join us for a food tour on Saturday, May 7! Bonus for you, use code 🐶 BowWow for $10 off this tour. https://sufufoodtours.com/events/downtown-food-tour-may-7-2022/"
batch_38,https://raw.githubusercontent.com/heranmane/label_studio_images/main/10k_batches/batch_38/195794-4500714913361673.png,Sign up for our newsletter and receive a code for $10 off a food tour. Keep up on specialty tours and flash sales with our newsletter. Don't miss a bite!
batch_38,https://raw.githubusercontent.com/heranmane/label_studio_images/main/10k_batches/batch_38/195795-4498729133560251.png,"It's Mother's Day weekend...have you picked out something for mom? 🎁 Surprise her and join us for a food tour on Saturday, May 7! Bonus for you, use code 🐶 BowWow for $10 off this tour. https://sufufoodtours.com/events/downtown-food-tour-may-7-2022/"
batch_38,https://raw.githubusercontent.com/heranmane/label_studio_images/main/10k_batches/batch_38/195796-4498276530272178.png,"Tired of doing the same old thing every weekend? Join us for our Going to the Dogs tour! It will do you both some good! Due to the rainy weather last weekend, we have rescheduled our 🐶Going to the Dogs tour to this Saturday! You didn't miss it!!! Use code BowWow to save $10 on this week's tour! Plus, for Mother's Day 🌻🌻, you can get a shout out for your mom on our social media pages! Check out the details with the link below. https://sufufoodtours.com/events/downtown-food-tour-may-7-2022/"
batch_38,https://raw.githubusercontent.com/heranmane/label_studio_images/main/10k_batches/batch_38/195797-4496143000485531.png,"You heard right...we are having our 2nd annual Going to the Dogs tour! Don't miss out, book your spot today! https://sufufoodtours.com/events/downtown-food-tour-may-7-2022/ Use code 🐶 BowWow for $10 off our Mother's Day weekend tour. Perfect gift for all fur baby mama's out there!"
batch_38,https://raw.githubusercontent.com/heranmane/label_studio_images/main/10k_batches/batch_38/195798-4495617907204707.png,Sign up for our newsletter and receive a code for $10 off a food tour. Keep up on specialty tours and flash sales with our newsletter. Don't miss a bite!
batch_38,https://raw.githubusercontent.com/heranmane/label_studio_images/main/10k_batches/batch_38/195799-4492250464208118.png,Sign up for our newsletter and receive a code for $10 off a food tour. Keep up on specialty tours and flash sales with our newsletter. Don't miss a bite!
batch_38,https://raw.githubusercontent.com/heranmane/label_studio_images/main/10k_batches/batch_38/1958-10159062160233462.png,"Aversive racism is defined as exhibiting racist tendencies while denying that one’s thoughts, behaviors, or motives are racist. Aversive racism is pervasive in academic medicine and impedes diversity, equity, and inclusion efforts. https://nej.md/3J7D8JC:=:https://www.nejm.org/doi/full/10.1056/NEJMp2112913?cookieSet=1"
batch_38,https://raw.githubusercontent.com/heranmane/label_studio_images/main/10k_batches/batch_38/195800-4487566528009845.png,Sign up for our newsletter and receive a code for $10 off a food tour. Keep up on specialty tours and flash sales with our newsletter. Don't miss a bite!
batch_38,https://raw.githubusercontent.com/heranmane/label_studio_images/main/10k_batches/batch_38/195801-4485566144876550.png,Sign up for our newsletter and receive a code for $10 off a food tour. Keep up on specialty tours and flash sales with our newsletter. Don't miss a bite!
batch_38,https://raw.githubusercontent.com/heranmane/label_studio_images/main/10k_batches/batch_38/195802-4484696231630208.png,Today is National Oatmeal Cookie Day and National Raisin Day... Couldn't we just put them together for Oatmeal Raisin Cookie Day?🍪 What's your favorite cookie?
