batch,image,text
batch_38,https://raw.githubusercontent.com/heranmane/label_studio_images/main/10k_batches/batch_38/195663-3122620007981140.png,"Because Black women, femmes and girls can do anything 💜✊🏾 #Repost @blkwomenshealth with @make_repost ・・・ We are thrilled about this historic nomination! 🙌🏾✨ ""President Joe Biden has selected Ketanji Brown Jackson as his nominee to the Supreme Court, according to a source who has been notified about the decision, setting in motion a historic confirmation process for the first Black woman to sit on the highest court in the nation. Jackson, 51, currently sits on DC's federal appellate court and had been considered the front-runner for the vacancy since Justice Stephen Breyer announced his retirement. She received and accepted Biden's offer in a call Thursday night, a source familiar with the decision told CNN."" Read the full story at the link in our bio. #BreakingNews #KetanjiBrownJackson #BlackHerstory #BlkWomensHealth #BlackHistory"
batch_38,https://raw.githubusercontent.com/heranmane/label_studio_images/main/10k_batches/batch_38/195664-3121098921466582.png,"Angela Doyinsola Aina, MPH is the Co-Founder and Executive Director of @blackmamasmatter a Black women-led organization that centers Black mamas by advocating, driving research, building power, and shifting culture for Black maternal health, rights and justice. Angela is a fierce advocate for Black women and their babies and has been in the trenches working to improve birthing outcomes for Black birthing people for many years. We celebrate you ✊🏾💜 #WomenEngaged #WeVoteWeRise #blackhistorymonth"
batch_38,https://raw.githubusercontent.com/heranmane/label_studio_images/main/10k_batches/batch_38/195665-3115642132012261.png,"Help us celebrate #blackgirlfreedomweek along with Black Girl Freedom Fund]] 💜✊🏾 #Repost Black Girl Freedom Fund]] with @make_repost ・・・ Are you ready to celebrate #BlackGirlFreedomWeek? This is a time to uplift and support the dreams, power, joy and leadership of Black girls, femmes and gender-expansive youth. Tune into @BlackGirlFreedomFund from Feb. 14-20 to participate in the inspiring conversations and events, and learn more about how you can be a part of change. Join the #1Billion4BlackGirls campaign and Black Girl Freedom Fund for an amazing week. RSVP for the week at: https://bit.ly/BGFW2022REG:=:https://docs.google.com/forms/d/e/1FAIpQLSf33PFMiGl6cle6hbciu8AReJn_k8CFkc8e4RrByQ09loZO2Q/viewform"
batch_38,https://raw.githubusercontent.com/heranmane/label_studio_images/main/10k_batches/batch_38/195666-3107830379460103.png,"Because Black women, femmes and girls can do anything 💜✊🏾 #Repost @janesdueprocess with @make_repost ・・・ For #BlackHistoryMonth and every month, we are thankful for the work of Black organizers, activists, and leadership in our movement. ⁣⁣⁣#blackwomenlead #womenegaged #wevotewerise #blackhistorymonth #reproductivejustice"
batch_38,https://raw.githubusercontent.com/heranmane/label_studio_images/main/10k_batches/batch_38/195667-10158303185326044.png,Have you signed up for our email list? You can get: -Round-ups of the latest DCWS news -Updates on upcoming concerts and community events -Content from your favorite DCWS musicians All delivered right to you! Sign up at detroitchamberwinds.org/contact-us/:=:https://detroitchamberwinds.org/contact-us/ https://conta.cc/3rYAgqJ:=:https://myemail.constantcontact.com/Your-DCWS-weekly-roundup-.html?soid=1102455566507&aid=3OyrMfQ-0hs
batch_38,https://raw.githubusercontent.com/heranmane/label_studio_images/main/10k_batches/batch_38/195668-7185698488139497.png,"More than 1 million people have already crossed the border, with numbers set to rise as the Russian invasion intensifies. What has been the response of neighbouring countries? Guardian: https://www.theguardian.com/global-development/2022/mar/03/ukraines-refugees-how-many-are-displaced-and-where-will-they-go Photo: Think.Geography"
batch_38,https://raw.githubusercontent.com/heranmane/label_studio_images/main/10k_batches/batch_38/195669-7170777399631606.png,"More than 500,000 people have fled from Ukraine. UNHCR is building a dashboard that should launch soon to track."
batch_38,https://raw.githubusercontent.com/heranmane/label_studio_images/main/10k_batches/batch_38/195670-7133171113392235.png,"Keep up with the latest at the UN in our weekly summary column, The Week @ UN, https://www.passblue.com/2022/02/18/trending-un-news-week-ending-feb-18/ And stay up to day on the UN with the PassBlue twitter account: https://twitter.com/pass_blue/status/1495384962836705281"
batch_38,https://raw.githubusercontent.com/heranmane/label_studio_images/main/10k_batches/batch_38/195673-370135541788829.png,"A new civil rights organization will be suing government agencies ""that unlawfully separate low-income children of color from parents,"" in New York City. https://imprintnews.org/child-welfare-2/new-civil-rights-organization-dedicated-to-families-rights-launches-in-new-york-city/63762"
batch_38,https://raw.githubusercontent.com/heranmane/label_studio_images/main/10k_batches/batch_38/195674-365514078917642.png,"Better Tech, Better Outcomes: How Technology Collaboration Can Improve Foster Care begins today at 11 a.m. PST/2 p.m. EST! This one-hour session will host a unique panel with diverse experience across #childwelfare, including experts in public policy and practice, former #fosteryouth, and foster/adoptive parents. This discussion will highlight ways to harness data, increase collaboration, streamline processes, and better match children/youth with families and services for better outcomes and overall experiences. Register: https://bit.ly/35xqHb1:=:https://us02web.zoom.us/webinar/register/WN_jINyEcU1TEWYOGBilRugtA"
batch_38,https://raw.githubusercontent.com/heranmane/label_studio_images/main/10k_batches/batch_38/195676-4930897703598587.png,"January is National Slavery and Human Trafficking Prevention Month. Through FUNraising over the last 20 years, #PMTS collectively has donated over $505k to the Andrew Gomez Dream Foundation to support Coalition to Abolish Slavery and Trafficking, @castlosangeles, and their mission to provide comprehensive, life-changing services to survivors and advocate for policies and legislation. 🖤 Find resources and information on how you can make a difference at castla.org."
batch_38,https://raw.githubusercontent.com/heranmane/label_studio_images/main/10k_batches/batch_38/195679-4865557783541727.png,"Did you know? We've got meeting rooms of all sizes available for public use, free-of-charge! Find more information at https://centralskagitlibrary.org:=:https://www.centralskagitlibrary.org/ #NationalLibraryWeek #connectwithyourlibrary"
batch_38,https://raw.githubusercontent.com/heranmane/label_studio_images/main/10k_batches/batch_38/19568-10160680187401614.png,"Today is the day! The Asian Night Market is happening today at 5-10pm at the Downtown Eugene East Park Block! There’ll be performances, food vendors, and craft vendors! Do you have any questions about the event? Hope to see you there!"
batch_38,https://raw.githubusercontent.com/heranmane/label_studio_images/main/10k_batches/batch_38/195680-681189052852688.png,Let's eat up for a good cause!
batch_38,https://raw.githubusercontent.com/heranmane/label_studio_images/main/10k_batches/batch_38/195682-5267344789953246.png,Is it possible to see things differently when studying the Bible from a Jewish point of view? Find out this week on Jewish Voice as Jonathan & Ezra explain why it just might put things into greater perspective. For airtimes: https://loom.ly/8aDBHy8:=:http://proweb.myersinfosys.com/nrb/search?search_text=jewish+voice Jewish Voice Ministries International
batch_38,https://raw.githubusercontent.com/heranmane/label_studio_images/main/10k_batches/batch_38/195683-4669138369859256.png,Today's the day! Tune in to author Michelle Goodloe's conversation with the SIS Talk Show (Real Brown Girls) at 7 PM ET as they discuss black women owning their magic! Register for this wonderful event below ✨ http://ow.ly/2xHk50IkS9b:=:https://www.eventbrite.com/e/294967976157
batch_38,https://raw.githubusercontent.com/heranmane/label_studio_images/main/10k_batches/batch_38/195684-4664403996999360.png,Happy Ramadan to all who celebrate! Have you checked out our spiritual books Shukr by Gabrielle Deonath and The New Muslim Workbook by Bisma Parvez? #spritiuality #ramadan #muslim #religion #celebration #spiritualbooks #holiday
batch_38,https://raw.githubusercontent.com/heranmane/label_studio_images/main/10k_batches/batch_38/195685-4589472664492494.png,"SNEAK PEEK ALERT 😍 We have a recipe to get you excited for The Van Life Cookbook by Susan Marque! Try this delicious Van Life Summer Rolls recipe. You'll Need: •4 small Vietnamese rice wrap sheets •fresh basil leaves •4 slices of feta (vegan or regular) •1 carrot, washed and cut into matchstick pieces •1 small zucchini, washed and cut into matchstick pieces Instructions: 1. Heat about 1 inch of water in a fry pan until hot but not boiling. 2. Turn off the heat under the pan. 3. Place 1 rice wrap sheet into the water to soften. (Give it a few seconds.) 4. Carefully put the wrap on a cutting board. 5. Put 1 large or several tiny basil leaves in the middle of the wrap. 6. Put a slice of feta on top of the basil. 7. Put a few carrots and a few zucchini pieces on top of the cheese. 8. Fold in the sides of the wrap to cover the ingredients like a tiny burrito. 9. Repeat softening and filling the wraps until all the filling is used up, to make 4 rolls. Make sure you check out her new cookbook 🥘: http://ow.ly/EQPg50I66L3:=:https://ulyssespress.com/books/the-van-life-cookbook/"
batch_38,https://raw.githubusercontent.com/heranmane/label_studio_images/main/10k_batches/batch_38/195687-10159417303888122.png,Tune in tonight for a brand new episode of Makilala TV featuring NYC Deputy Mayor for Economic & Workforce Development Maria Torres-Springer and Fr. Julian S. Jagudilla from the Filipino American Network Against Asian Hate (FANAAH). #FilAm #FilipinoAmerican #MNNNYC
batch_38,https://raw.githubusercontent.com/heranmane/label_studio_images/main/10k_batches/batch_38/195688-467538231846970.png,"Just want to thank NYC Mayor Eric Adams for this proclamation that June 19th is not only a holiday, but Juneteenth March Day. If you're in the area, we'd love to have all of you join us in Central Park to walk or roll 5K on this newest Federal State and now City holiday 🙌🏿🙌🏽🙌🏻 www.juneteenthmarch.org:=:https://www.juneteenthmarch.org/"
batch_38,https://raw.githubusercontent.com/heranmane/label_studio_images/main/10k_batches/batch_38/195689-7683504705022888.png,"Laredo CDJR Has the 2022 Jeep Grand Cherokee WK Laredo X in Stock and Ready for Immediate Delivery! Save Today and Get $2,000 Cash Allowance! Shop Our Inventory in Store or Online Today!"
batch_38,https://raw.githubusercontent.com/heranmane/label_studio_images/main/10k_batches/batch_38/19569-1052874831982801.png,"Numerous severe thunderstorms and tornado warnings for portions of Minnesota, Nebraska and South Dakota."
batch_38,https://raw.githubusercontent.com/heranmane/label_studio_images/main/10k_batches/batch_38/195690-385638293574105.png,CALLING ALL UNDOCU ALLYS! Join Us by getting involved and join the DREAM ACHIEVERS CLUB!
batch_38,https://raw.githubusercontent.com/heranmane/label_studio_images/main/10k_batches/batch_38/195691-4951117111668227.png,"Celebrate #womenshistorymonth2022 with queer, bilingual pop star Gina Chavez! Join her today for a -- Panel Discussion at the Cross-Cultural Center at 12PM (open to Chapman University students, faculty and staff) -- @THEMUSCO-Online interview live stream on the Musco Center YouTube at 7PM (open to everyone!) Learn more at muscocenter.org"
batch_38,https://raw.githubusercontent.com/heranmane/label_studio_images/main/10k_batches/batch_38/195692-5789836624364935.png,"WRAP this evening in Arlington, Virginia joining partners the Arlington County Police Department and the Foundation for Advancing Alcohol Responsibility (Responsibility.org) in recognizing efforts to prevent underage drinking via the Arlington Restaurant Initiative's 2022 Fake ID Awards. 🚫 (Arlington County Police collected 512 fake IDs in 2019 as a means of thwarting teen drinking.)"
batch_38,https://raw.githubusercontent.com/heranmane/label_studio_images/main/10k_batches/batch_38/195693-3920340268191376.png,"Pakistan’s ace equestrian Usman Khan made a strong comeback in the circuit almost a year after meeting an accident to confirm Pakistan’s berth in Asian Games. According to a message received by this correspondent from Usman Khan, Pakistan has secured 12th place in the FEI CIC 2-Star long format event, Haras De Jardy, which took place in Paris, France. Following that, Pakistan has now qualified for Asian Games 2022-23. #aceequestrian #pakistan"
batch_38,https://raw.githubusercontent.com/heranmane/label_studio_images/main/10k_batches/batch_38/195694-3840903602801710.png,Chinese state-owned and private companies have expressed the desire to establish a $3.5 billion reprocessing park in Gwadar and a $350 million textile cluster near the city of Lahore.
batch_38,https://raw.githubusercontent.com/heranmane/label_studio_images/main/10k_batches/batch_38/195695-4980569438662923.png,"Racism harms us all. While people of color experience more direct negative consequences on their health and wellness due to racism, the inequity driven by racism affects society as a whole. The public health community must address racism as the key driver of poorer health for communities of color and health disparities. Learn more: https://nphw.org/Themes-and-Facts/2022-Racism #NPHW #NPHW2022"
batch_38,https://raw.githubusercontent.com/heranmane/label_studio_images/main/10k_batches/batch_38/195696-1876651666011800.png,"With wins over Max Holloway, Jose Aldo and Brian Ortega, UFC featherweight champion Alexander Volkanovski is carving out his legacy as one of the best ever. But to keep his belt and his place atop the division, he must hold off the charge of ""The Korean Zombie"" Chan Sung Jung in the main event of UFC 273 on April 9. Fresh from a big victory over Dan Ige, Jung is determined that his second crack at the crown will see him bring a world title to South Korea for the first time as attempts to use his dynamic style to defeat Australia's finest. Plus, a heated rivalry gets its second chapter in the co-main event, as Aljamain Sterling and Petr Yan meet for the undisputed bantamweight title"
batch_38,https://raw.githubusercontent.com/heranmane/label_studio_images/main/10k_batches/batch_38/195697-1876650782678555.png,"With wins over Max Holloway, Jose Aldo and Brian Ortega, UFC featherweight champion Alexander Volkanovski is carving out his legacy as one of the best ever. But to keep his belt and his place atop the division, he must hold off the charge of ""The Korean Zombie"" Chan Sung Jung in the main event of UFC 273 on April 9. Fresh from a big victory over Dan Ige, Jung is determined that his second crack at the crown will see him bring a world title to South Korea for the first time as attempts to use his dynamic style to defeat Australia's finest. Plus, a heated rivalry gets its second chapter in the co-main event, as Aljamain Sterling and Petr Yan meet for the undisputed bantamweight title"
batch_38,https://raw.githubusercontent.com/heranmane/label_studio_images/main/10k_batches/batch_38/195698-1876650099345290.png,"With wins over Max Holloway, Jose Aldo and Brian Ortega, UFC featherweight champion Alexander Volkanovski is carving out his legacy as one of the best ever. But to keep his belt and his place atop the division, he must hold off the charge of ""The Korean Zombie"" Chan Sung Jung in the main event of UFC 273 on April 9. Fresh from a big victory over Dan Ige, Jung is determined that his second crack at the crown will see him bring a world title to South Korea for the first time as attempts to use his dynamic style to defeat Australia's finest. Plus, a heated rivalry gets its second chapter in the co-main event, as Aljamain Sterling and Petr Yan meet for the undisputed bantamweight title"
batch_38,https://raw.githubusercontent.com/heranmane/label_studio_images/main/10k_batches/batch_38/195699-1868829806793986.png,"With wins over Max Holloway, Jose Aldo and Brian Ortega, UFC featherweight champion Alexander​​​​​​​​ Volkanovski is carving out his legacy as one of the best ever. But to keep his belt and his place atop the​​​​​​​​ division, he must hold off the charge of ""The Korean Zombie"" Chan Sung Jung in the main event of UFC​​​​​​​​ 273 on April 9. Fresh from a big victory over Dan Ige, Jung is determined that his second crack at the crown​​​​​​​​ will see him bring a world title to South Korea for the first time as attempts to use his dynamic style to defeat​​​​​​​​ Australia's finest. Plus, a heated rivalry gets its second chapter in the co-main event, as Aljamain Sterling​​​​​​​​ and Petr Yan meet for the undisputed bantamweight title.​​​​​​​​ #UFC #Featherweight #Bantamweight #KoreanZombie #Volkanovski"
batch_38,https://raw.githubusercontent.com/heranmane/label_studio_images/main/10k_batches/batch_38/1957-254545100195888.png,"Houston gang member joins co-conspirators in prison for role in string of 33 Texas and Louisiana ATM robberies and assaults, following ICE #HSI Houston investigation w/local law enforcement partners. Details: https://xsm.link/ugbu7w:=:https://www.ice.gov/news/releases/third-gang-member-sentenced-prison-series-truck-stop-atm-robberies-related-assault"
batch_38,https://raw.githubusercontent.com/heranmane/label_studio_images/main/10k_batches/batch_38/19570-2398010780340233.png,"We stand with Ukraine. Our sanctuary will be open to those who would like to come pray - prayer guides will be available. We have also had many ask how to give towards a trustworthy cause with boots on the ground in Ukraine - we know, trust, and regularly partner with amazing missionaries through Michael Gott International. They have long-standing ties and have made an incredible impact for the kingdom in Ukraine for several decades. You can give directly to their work at www.mgi.global:=:https://www.mgi.global/"
batch_38,https://raw.githubusercontent.com/heranmane/label_studio_images/main/10k_batches/batch_38/195710-5164275553606357.png,Join Grace Fitness today at noon for the Black K.A.R.E Challenge. The event is aimed to educate the African American community on the importance of nutrition and exercise and the prevention of kidney disease. #HSIEndorsed
batch_38,https://raw.githubusercontent.com/heranmane/label_studio_images/main/10k_batches/batch_38/195711-3026692434308678.png,"The NBA has a massive social media presence. Throughout the 2021 NBA Playoffs, the NBA Instagram channel generated 1.4 billion views!"
batch_38,https://raw.githubusercontent.com/heranmane/label_studio_images/main/10k_batches/batch_38/195712-5275164462540620.png,May is Asian American and Pacific Islander (AAPI) Heritage Month. Join us on Saturday May 21 for the NC Asian American Pacific Islander Heritage Month Celebration. The event is free! Light snacks will be provided (at no cost) and we also have a phenomenal speaker program with cultural programs. Time: 4:30 to 6:30 PM Where: Raleigh Little Theatre Amphitheatre (301 Pogue St. Raleigh NC) #asian #asianamerican #asianheritagemonth #raleigh #durham #cary #chapelhill #northcarolina
batch_38,https://raw.githubusercontent.com/heranmane/label_studio_images/main/10k_batches/batch_38/195713-5394875513924498.png,The Hideout has the latest food service in town! Bring in this ad for 20% OFF your order! https://www.facebook.com/hideoutgold/
batch_38,https://raw.githubusercontent.com/heranmane/label_studio_images/main/10k_batches/batch_38/195714-5363742233704493.png,The Hideout has the latest food service in town! Bring in this ad for 20% OFF your order! https://www.facebook.com/hideoutgold/
batch_38,https://raw.githubusercontent.com/heranmane/label_studio_images/main/10k_batches/batch_38/195715-5363740643704652.png,Come to El Cid's for fajitas and the BEST margaritas! https://www.facebook.com/elcidmexicancuisine/
batch_38,https://raw.githubusercontent.com/heranmane/label_studio_images/main/10k_batches/batch_38/195716-5338032206275496.png,Come to El Cid's for fajitas and the BEST margaritas! https://www.facebook.com/elcidmexicancuisine/
batch_38,https://raw.githubusercontent.com/heranmane/label_studio_images/main/10k_batches/batch_38/195717-5314701141941936.png,The Hideout has the latest food service in town! Bring in this ad for 20% OFF your order! https://www.facebook.com/hideoutgold/
batch_38,https://raw.githubusercontent.com/heranmane/label_studio_images/main/10k_batches/batch_38/195718-5298795826865801.png,The Hideout has the latest food service in town! Bring in this ad for 20% OFF your order! https://www.facebook.com/hideoutgold/
batch_38,https://raw.githubusercontent.com/heranmane/label_studio_images/main/10k_batches/batch_38/195719-5245807315497986.png,The Hideout has the latest food service in town! Bring in this ad for 20% OFF your order! https://www.facebook.com/hideoutgold/
batch_38,https://raw.githubusercontent.com/heranmane/label_studio_images/main/10k_batches/batch_38/19572-10158409906906604.png,日本語を勉強しませんか？ Support us and get our Makoto e-zine at https://www.MakotoPlus.com:=:https://makotoplus.com/ or become a Patreon supporter at https://www.patreon.com/TheJapanesePage (Both methods are the same price and have the same benefits)⁠ #learnjapanese #japanese #japaneselanguage #nihongo #japan #jlpt #learnjapaneseonline #ilovejapanese #japanesestudy #furigana #learnkanji #studykanji #hiragana #katakana #japaneselesson #kanji #learningjapanese #japanesewords #japaneselearner #study #studyjapanese
batch_38,https://raw.githubusercontent.com/heranmane/label_studio_images/main/10k_batches/batch_38/195720-5242546665824051.png,El Cid's Restaurant in Oakhurst has some of the Finest Authentic Mexican food you can find. Stop by for some Delicious Fajitas and Margaritas!! https://www.facebook.com/elcidmexicancuisine/
batch_38,https://raw.githubusercontent.com/heranmane/label_studio_images/main/10k_batches/batch_38/195721-5202607269817991.png,The Hideout has the latest food service in town! Bring in this ad for 20% OFF your order! https://www.facebook.com/hideoutgold/
batch_38,https://raw.githubusercontent.com/heranmane/label_studio_images/main/10k_batches/batch_38/195722-5179354245476627.png,Come to El Cid's for fajitas and the BEST margaritas! https://www.facebook.com/elcidmexicancuisine/
batch_38,https://raw.githubusercontent.com/heranmane/label_studio_images/main/10k_batches/batch_38/195723-5160772567334795.png,Take this ad into Hideout Saloon for 20% OFF! https://www.facebook.com/hideoutgold/
batch_38,https://raw.githubusercontent.com/heranmane/label_studio_images/main/10k_batches/batch_38/195724-5142342992511086.png,Come to El Cid's for fajitas and the BEST margaritas! https://www.facebook.com/elcidmexicancuisine/
batch_38,https://raw.githubusercontent.com/heranmane/label_studio_images/main/10k_batches/batch_38/195726-5102955253116527.png,Take this ad into Hideout Saloon for 20% OFF! https://www.facebook.com/hideoutgold/
batch_38,https://raw.githubusercontent.com/heranmane/label_studio_images/main/10k_batches/batch_38/195727-5063241793754540.png,Take this ad into Hideout Saloon for 20% OFF! https://www.facebook.com/hideoutgold/
batch_38,https://raw.githubusercontent.com/heranmane/label_studio_images/main/10k_batches/batch_38/195728-5040709599341093.png,The Hideout has the latest food service in town! Bring in this ad for 20% OFF your order! https://www.facebook.com/hideoutgold/
batch_38,https://raw.githubusercontent.com/heranmane/label_studio_images/main/10k_batches/batch_38/195729-5028191970592856.png,Come to El Cid's for fajitas and the BEST margaritas! https://www.facebook.com/elcidmexicancuisine/
batch_38,https://raw.githubusercontent.com/heranmane/label_studio_images/main/10k_batches/batch_38/19573-10158368040586604.png,応援してね。 Support us and get our Makoto e-zine at https://www.MakotoPlus.com:=:https://makotoplus.com/ or become a Patreon supporter at https://www.patreon.com/TheJapanesePage (Both methods are the same price and have the same benefits)⁠ #learnjapanese #japanese #japaneselanguage #nihongo #japan #jlpt #learnjapaneseonline #ilovejapanese #japanesestudy #furigana #learnkanji #studykanji #hiragana #katakana #japaneselesson #kanji #learningjapanese #japanesewords #japaneselearner #study #studyjapanese #thejapanshop #thejapanesepage #makotomagazine #makotoezine #makotoplus
batch_38,https://raw.githubusercontent.com/heranmane/label_studio_images/main/10k_batches/batch_38/195730-5028172413928145.png,The Hideout has the latest food service in town! Bring in this ad for 20% OFF your order! https://www.facebook.com/hideoutgold/
batch_38,https://raw.githubusercontent.com/heranmane/label_studio_images/main/10k_batches/batch_38/195731-5000031926742194.png,The Hideout has the latest food service in town! Bring in this ad for 20% OFF your order! https://www.facebook.com/hideoutgold/
batch_38,https://raw.githubusercontent.com/heranmane/label_studio_images/main/10k_batches/batch_38/195732-5000022510076469.png,El Cid's Restaurant in Oakhurst has some of the Finest Authentic Mexican food you can find. Stop by for some Delicious Fajitas and Margaritas!! https://www.facebook.com/elcidmexicancuisine/
batch_38,https://raw.githubusercontent.com/heranmane/label_studio_images/main/10k_batches/batch_38/195733-4973791016032952.png,Take this ad into Hideout Saloon for 20% OFF! https://www.facebook.com/hideoutgold/
